Unnamed: 0,pid,filename,poet,title,year,poem,poemlength,epoch_year,epoch_poet
1596,8491,"Thoma, Ludwig_Neujahr bei Pastors_1894","Thoma, Ludwig",Neujahr bei Pastors,1894,"Mama schöpft aus dem Punschgefäße, Der Vater lüftet das Gesäße Und spricht: »Jetzt sind es vier Minuten Nur mehr bis zwölfe, meine Guten.Ich weiß, daß ihr mit mir empfindet, Wie dieses alte Jahr entschwindet, Und daß ihr Gott in seinen Werken – Mama, den Punsch noch was verstärken! –Und daß ihr Gott von Herzen danket, Auch in der Liebe nimmer wanket, Weil alles, was uns widerfahren – Mama, nicht mit dem Arrak sparen! –Weil, was geschah, und was geschehen, Ob wir es freilich nicht verstehen, Doch weise war, durch seine Gnade – Mama, er schmeckt noch immer fade! –In diesem Sinne meine Guten, Es sind jetzt bloß mehr zwei Minuten, In diesem gläubig frommen Sinne – Gieß noch mal Rum in die Terrine! –Wir bitten Gott, daß er uns helfe Auch ferner – Wie? Es schlägt schon zwölfe? Dann prosit! Prost an allen Tischen! – Ich will den Punsch mal selber mischen.«",182,Jahrhundertwende,Jahrhundertwende
2474,24018,"Henckell, Karl_Psalm_1896","Henckell, Karl",Psalm,1896,"Ich habe die Tiefen des Elends geschaut , Und es hat mir in Tiefen der Seele gegraut . Ich sah lebendiger Toten Skelett Und stand an der Buhlen entweihtem Bett . Die stolze Vermessenheit sah ich im Schwang Und lauschte der Reichen betörtem Sang . Die Seelen sah ich verkauft und feil , Nach Gold und Ehren und Wollust geil . Der Knechte traf Heuchler noch mehr . Im Bethaus sah ich vor Gott sie knien Und sah , wie sie heimlich den Heiland bespien , Und lachten verborgen und trieben Hohn Und krochen hündisch zu Kreuz und Thron . Und ich sah , was mir höllisch die Sinne gepackt , Sie die Wahrheit peitschen – notzüchtigen nackt ! Und zu Boden sank ich und rang und rang Und lag todmüde und lebensbang . Meine Seele war wüst und mein Geist war Nacht , Da flammte ein Strahl , nun bin ich erwacht , Und ich schreie empor voll brünstiger Glut : Du Geist der Welten ! Verleih uns Mut , Daß das Zagen zergeht und der Zweifel zerbricht , Zu sehnen und suchen das ewige Licht , In harrender Treu , in Gedanken und Tat , Wann der Abend sinkt , wann der Morgen naht , Mit der Liebe Rüstung im brennenden Kampf , Schildleuchtende Helden im Nebeldampf , Mit des Mitleids Helm , mit der Wahrheit Speer , Zahllos sich mehrend ein siegreich Heer , Zu lösen das Leid und die Welt zu befrein – O selig , Lichtzeuge des Lebens zu sein !",256,Jahrhundertwende,Naturalismus
2622,46718,"Löns, Hermann_UNTITLED_1890","Löns, Hermann",UNTITLED,1890,"Es steht eine Rose im Garten, Ein rotes Röselein; Die Allerschönste im Dorfe, Das ist die Liebste mein.Vollmeier ist ihr Vater, Im Dorfe der reichste Mann; Geht er über die Straße, Seinen Tritt man hören kann.Ich pfeife auf seine Taler, Ich flöte auf seinen Stolz, Ich küsse seine Dorette Jedweden Abend im Holz.Und ist der Mond nicht helle Und sind die Sterne nicht klar, Dann sieht man an meinem Bette, Daß ich wo anders war.",86,Naturalismus,Naturalismus
1937,11944,"Falke, Gustav_UNTITLED_1884","Falke, Gustav",UNTITLED,1884,"Willst du dich über die Menge erheben, Halte die Ehre blank und eben, Den kleinsten Flecken, den kleinsten Belauf, Die Leute zeigen mit Fingern darauf, Froh eine Stelle gefunden zu haben, Worein sie ihre Haken graben, Die dich aus deiner Höhe wieder Zerren zu ihren Sümpfen nieder. Viel eher dulden sie schlecht dich, gemein, Als dass sie dein Besserseinwollen verzeihn.",71,Naturalismus,Jahrhundertwende
2159,19978,"Müller-Jahnke, Clara_Zur Arbeit_1882","Müller-Jahnke, Clara",Zur Arbeit,1882,"Aus Morgennebeln leuchtet der frühe rote Tag; da treibt mich auf vom Lager ein dumpfer Glockenschlag. Der ruft aus süßem Traume zum trauten Heim hinaus mich in die Flammenschwüle ins dunstige Kesselhaus zur Arbeit.Ich schreite gleich dem Krieger in eisenstarrer Wehr, mit Hammer, Beil und Zange zum Daseinskampf einher. Und wo die Bälge sausen, wo hell das Feuer sprüht, singt mir die rote Flamme ein heißes Morgenlied zur Arbeit.Des Schweißes schwerer Tropfen, der von der Stirn mir läuft, ist Tau, der auf die Saaten der Zukunft niederträuft. Kein Mordgewaffen schmiedet die schwielenharte Hand; sie dehnt und schweißt und hämmert ein ehern Friedensband der Arbeit.Schlaf ruhig du, mein Knabe, in treuer Mutterhut; auch dich ruft einst die Frühe, auch dich ruft einst die Glut. Dann wirst in blaue Weiten auf fernster Brüder Ruf du die Maschine leiten, die einst dein Vater schuf, zur Arbeit.Zur Arbeit ruft ihr Sausen, zur Arbeit, nicht zur Fron! Dann wird die Sonne scheinen hell auf dein Werk, mein Sohn. In freier Männer Kreise klingt dann in Nord und Süd jauchzend wie Siegesweise ein frohes Morgenlied.",204,Naturalismus,Naturalismus
83,26137,Klabund_Die Infantriekaserne_1909,Klabund,Die Infantriekaserne,1909,"Hinter diesem kleinen Feldchen Steht ein grau verhutzelt Wäldchen, Über seinen Gipfeln ferne Blinkt die Infantriekaserne.Viele schöne rote Dächer Streckt sie in die Luft wie Fächer. – Ach, der schönen Wanderin Ward ein wenig schwül zu Sinn.Ja sie trippelte und hetzte, Weil sie was in Glut versetzte, Und ihr Auge, heiß und gier, Späht nach einem Musketier.Dieser hockt im Fenster träge, Eine Pfeife im Gehege. Ach, wie wär er doch so gerne",82,Jahrhundertwende,Expressionismus
2373,24045,"Henckell, Karl_UNTITLED_1896","Henckell, Karl",UNTITLED,1896,"Dreitausend Mark, heidi, per Jahr Von Seiner Exzellenz – Wie schirmt der Himmel wunderbar Lockspitzels Existenz! Kein Gentleman, kein Gentleman, Als wär das ein Malheur, So bin ich denn und blei ich dennSpitz, spitz: die Ohren aufgeknöpft! Horch, horch nach links und rechts! Bum, bum! »Und alles wird geköpft Tyrannischen Geschlechts!« Fällt mir dann so ein Tölpel rein Und brüllt: »Den Teufel – ja!« Das muß ein Anarchiste sein, Ein Anarchist, hurra!Ich bin ein Werkzeug der Gewalt Von Gottes Gnaden nur, Ein unentbehrlich Rädchen halt In der Regierungsuhr. Spitz, spitz, horch, horch! Kein Gentleman, Als wär das ein Malheur. So bin ich denn und blei ich denn»Genosse, prost!« Begleite ihn, Schüttl ihm als Freund die Hand Und melde schleunigst nach Berlin: »Ein frischer Fisch – brillant!« Aus deutschem Reichsfonds stell' ich flugs Das süße Mordsblatt her, Die »Freiheit« – kolossaler Jux! Ex'lenz, was willst du mehr?Ach, als ich noch kein Spitzel war, Welch kreuzerbärmlich Los! Dreitausend Reichsmark jedes Jahr, Das macht sich ganz famos. Mitunter puppert's mir von fern: »Du Schuft!« Herrje, ich bin Ein treuer Diener meines Herrn – Und schlag' mir's aus dem Sinn.",253,Jahrhundertwende,Naturalismus
2197,19980,"Müller-Jahnke, Clara_Die Straßenkehrer_1882","Müller-Jahnke, Clara",Die Straßenkehrer,1882,"Aus Norden bläst der eisige Wind, die Flocken wirbeln auf allen Wegen – nimm Schippe und Besen und komm geschwind, komm mit, wir wollen die Straße fegen. Wie ein Tanzboden, blank und rein, muß heute abend die Straße sein.Sie geben im Schloß den Fastnachtsball; da dürfen wir unten am Fenster stehen und dürfen lauschen der Geigen Schall und all die glänzenden Kutschen sehen, fege, du, fege die Straße rein!Der Pfaff hat recht, wenn der Winter droht: Arbeit, Alte, die wärmt die Glieder! Wir haben kein Holz, wir haben kein Brot . . . ihr himmlischen Flocken nur tanzt hernieder. Sollt ihr die Helfer der Armen sein? – Fege, du, fege die Straße rein!",136,Naturalismus,Naturalismus
2013,46580,"Löns, Hermann_Trost_1890","Löns, Hermann",Trost,1890,"Entfalte deine trübe Stirne, Leg die Pistole aus der Hand Und gräm' dich nicht um deine Dirne, Die nie dein großes Herz verstand: Ein buntgeschmücktes Modepüppchen Mit kleinen Füßen, hohem Zopf, Mit Wolffschem Unsinn auf den Lippchen Und Marlitts Blödsinn in dem Kopf.Naive Puppen – alles finden Sie reizend, lieblich, niedlich, nett, Sie haben keine großen Sünden Und freun sich auf das Ehebett Wie Kinder auf Geburtstagssachen Und was das Christkindchen beschert, Sie passen – du brauchst nicht zu lachen – Für Türken, doch sind dein nicht wert.Das Weib, das deinen Weg will gehen, Muß Seele haben, Herz und Geist, Muß den Gedankenflug verstehen, Der stürmend dein Gehirn durchkreist, Muß dich durch Blick und Kuß berauschen Zu kühnerem Gedankengang, Und mußt du Schwerterschläge tauschen, Dein Schwert dir halten rein und blank.Dein Weib muß nicht bloß Freudendirne, Nein, auch ein treuer Freund dir sein, Mit unerschrockner, starker Stirne Muß sie sich deinem Lose weihn, – Vergiß dein Bräutchen, such dir eine, Die würdig ist für einen Komm, klingen wir mit goldnem Weine Aufs Wohlsein der Zukünft'gen an.",205,Naturalismus,Naturalismus
400,16652,"Engelke, Gerrit_UNTITLED_1912","Engelke, Gerrit",UNTITLED,1912,"Da liegt das zwanzigmeterlange Tier, Die Dampfmaschine, Auf blankgeschliffener Schiene Voll heißer Wut und sprungbereiter Gier – Da lauert, liegt das langgestreckte Eisen-Biest – Sieh da: wie Oel- und Wasserschweiß Wie Lebensblut, gefährlich heiß Ihm aus den Radgestängen: den offnen Weichen fließt. Es liegt auf sechzehn roten Räder-Pranken, Wie fiebernd, langgeduckt zum Sprunge Und Fieberdampf stößt röchelnd aus den Flanken. Es kocht und kocht die Röhrenlunge – Den ganzen Rumpf die Feuerkraft durchzittert, Er ächzt und siedet, zischt und hackt Im hastigen Dampf- und Eisentakt, – Dein Menschenwort wie nichts im Qualm zerflittert. Das Schnauben wächst und wächst – Du stummer Mensch erschreckst – Du siehst die Wut aus allen Ritzen gähren – Der Kesselröhren-Atemdampf Ist hochgewühlt auf sechzehn Atmosphären: Gewalt hat jetzt der heiße Krampf: Das Biest es brüllt, das Biest es brüllt, Der Führer ist in Dampf gehüllt – Der Regulatorhebel steigt nach links: Der Eisen-Stier harrt dieses Winks!: Nun bafft vom Rauchrohr Kraftgeschnauf: Nun springt es auf! nun springt es auf!Ruhig gleiten und kreisen auf endloser Schiene Die treibenden Räder hinaus auf dem blänkernden Band, Gemessen und massig die kraftangefüllte Maschine, Der schleppende, stampfende Rumpf hinterher –Dahinter – ein dunkler – verschwimmender Punkt Darüber – zerflatternder – Qualm –",230,Expressionismus,Expressionismus
1942,8676,"Thoma, Ludwig_August_1894","Thoma, Ludwig",August,1894,"So hat man nichts als immer Regen, Es plätschert laut, es rieselt still, Es sammelt Dreck auf allen Wegen, Wie Gott es will.Man fühlt sich gänzlich auf dem Hunde Und kommt so weit, wenn's immer gießt, Daß man in einer solchen Stunde Die Zeitung liest.Auf Seite zwei die Redeflüsse In Bayerns Sommerparlament – Das ist der schönste der Genüsse! Kreuzsakrament!Man hört den Regen, liest die Seiche Und hat so das Gefühl dabei, Man trete in das Windelweiche, In lauter Brei.",94,Jahrhundertwende,Jahrhundertwende
2024,36634,"Holz, Arno_Einem Pseudonym_1896","Holz, Arno",Einem Pseudonym,1896,"Zwar deine Reime sind nur selten weibliche, Doch was sie meinen ist das Ewig-Leibliche; Lass ab, du lockst uns doch nicht in den Sumpf, Durch deine Phrasen lugt der blaue Strumpf!",36,Jahrhundertwende,Naturalismus
2471,24059,"Henckell, Karl_UNTITLED_1896","Henckell, Karl",UNTITLED,1896,"O eure Sicherheit ist groß. Ihr treibt dahin gedankenlos. Bald aber wird zu eurem Schrecken Die brüllende Löwin der Not euch wecken. Sie reckt das Haupt aus dunkler Höhle Und leise donnert ihre Kehle. Sie wirft den Schweif und prüft die Pranken, Schon fühl' ich den Boden der Erde schwanken. Schon hör' ich die Wellen der Lüfte zittern Von hungerheulenden Ungewittern. Ihr aber mit zugestopftem Sinn Tanzt auf dem Dache der Höhle dahin.",83,Jahrhundertwende,Naturalismus
1692,40012,"Ringelnatz, Joachim_Spielball_1908","Ringelnatz, Joachim",Spielball,1908,"Es weint ein Kind. Ein Luftballon mit dünnem Zopf Und kleiner als des Kindes Kopf Entflieht im Wind.Und reist und steigt verwegen. Ein Nebel wallt. Ein Fehlschuß knallt. Dann fällt ein sanfter Regen.Rundrote Riesenbeere Rollt müde und verschrumpft In einem Wipfelmeere, Hat austriumpht.Witziger Kräherich Bringt seinem Bräutchen Ein hohles Häutchen, Die aber ärgert sich.",61,Jahrhundertwende,Jahrhundertwende
2228,36598,"Holz, Arno_Die deutsche Dichtkunst_1896","Holz, Arno",Die deutsche Dichtkunst,1896,"Die deutsche Dichtkunst schrieb notorisch Sich selber den Uriasbrief, Seit das Gefühl ihr obligatorisch Und der Verstand nur facultativ.",21,Jahrhundertwende,Naturalismus
515,26304,Klabund_7._1909,Klabund,7.,1909,"Nicht werde ich vergessen deine Brust, Die tönende Ampel, Darin dein Herz leuchtet, Du Samtene! Oft Wenn ich erwache des Nachts, Sehe ich dich wie einen silbernen Delphin Durch die Gewässer des Dunkels schwimmen. Oder am Tage: Aus dem Asphalt Blüht ein Gesträuch, Und dein Duft Wirft mich besinnungslos auf den Stein.",61,Jahrhundertwende,Expressionismus
2469,24220,"Henckell, Karl_UNTITLED_1896","Henckell, Karl",UNTITLED,1896,"Lebe, liebe! Grüble nicht! Frisch den Saft der Stunde pressen! Alles Leben heißt vergessen – Ewig gleich bleibt Gottes Angesicht.",25,Jahrhundertwende,Naturalismus
2863,28906,"Scheerbart, Paul_UNTITLED_1889","Scheerbart, Paul",UNTITLED,1889,"Meine Welt ist nicht von Pappe! Dieses sag ich dir im Traum! Trägst du eine Narrenkappe, Trag sie unterm Lorbeerbaum!",24,Naturalismus,Naturalismus
387,44915,"Heym, Georg_UNTITLED_1899","Heym, Georg",UNTITLED,1899,"Durch hohe Tore wird das Meer gezogen Und goldne Wolkensäulen , wo noch säumt Der späte Tag am hellen Himmelsbogen Und fern hinab des Meeres Weite träumt. » Vergiß der Traurigkeit , die sich verlor Ins ferne Spiel der Wasser , und der Zeit Versunkner Tage . Singt der Wind ins Ohr Dir seine Schwermut , höre nicht sein Leid.Laß ab von Weinen . Tiefen drunten , In den verborgenen Städten der Dämonen.Dort wird uns Einsamkeit die Lider schließen . Wir hören nichts in unserer Hallen Räumen , Die Fische nur , die durch die Fenster schießen , Und leisen Wind in den Korallenbäumen.Wir werden immer beieinander bleiben Im schattenhaften Walde auf dem Grunde . Die gleiche Woge wird uns dunkel treiben , Und gleiche Träume trinkt der Kuß vom Munde.Der Tod ist sanft . Und die uns niemand gab , Er gibt uns Heimat . Und er trägt uns weich In seinem Mantel in das dunkle Grab , Wo viele schlafen schon im stillen Reich. « Des Meeres Seele singt am leeren Kahn . Er treibt davon , ein Spiel den tauben Winden In Meeres Einsamkeit . Der Ozean Türmt fern sich auf zu schwarzer Nacht , der Blinden.In hohen Wogen schweift ein Kormoran Mit grünen Fittichs dunkler Träumerei . Darunter ziehn die Toten ihre Bahn . Wie blasse Blumen treiben sie vorbei.Sie sinken tief . Das Meer schließt seinen Mund Und schillert weiß . Der Horizont nur bebt Wie eines Adlers Flug , der von dem Sund Ins Abendmeer die blaue Schwinge hebt .",258,Jahrhundertwende,Expressionismus
2076,14443,"Lachmann, Hedwig_UNTITLED_1891","Lachmann, Hedwig",UNTITLED,1891,"Ein Paar Verlorner, die in ihrem Wahne Verpfänden Gut und Blut für ihre Fahne.Verirrte Märtyrer, die sich verpflichtet, Am Pfahl zu sterben, den sie sich errichtet.Ihr hört sie nicht an Kreuz und Altarstufen Wie Sünder hingestreckt um Gnade rufen.Im Land der Knechte tragen sie mit Würde Und aufrecht ihre unsichtbare Bürde.Und büssen ohne Schuld und ohne Reue Mit ihrem Leben schweigend ihre Treue.",68,Naturalismus,Naturalismus
2292,24240,"Henckell, Karl_Mensch und Partei_1896","Henckell, Karl",Mensch und Partei,1896,"Wuchs und Rasse spotten der Regel, Blut geht tiefer als Feldgeschrei: Edelleute und Herrgottsflegel Gibt es stets bei",20,Jahrhundertwende,Naturalismus
2405,46585,"Löns, Hermann_An ..._1890","Löns, Hermann",An ...,1890,"Nur vorwärts auf dem Siegeswege, Nur vorwärts ohne Ruh und Rast, Es bleibt dein Lohn, du Wahrheitsstreiter, Daß du doch eine Stufe weiter Vom Menschheitsziel erklettert hast.Wenn Dummheit und Gemeinheit hocken Auch oben auf der Leiter Thron, Nichts soll dich schrecken und verwirren, Laß deine Kugeln pfeifend schwirren Und achte nicht auf Spott und Hohn.Du stehst allein und bist am stärksten Und schaust nicht abwärts ins Gewühl, Und ob sie schimpfen dich und lästern, Neid und Bewunderung sind Schwestern, Kein Dummbescheidner kommt ans Ziel.Wo alles dumpfig und verschlossen Und voll von Staub und Todeskeim, Da öffne du die blinden Fenster, Vertreibe Lüge und Gespenster Und lüfte aus das alte Heim.Schon seh' am Himmelsrand ich zucken Den Wetterstrahl von deinem Ruhm, Zerfeilt sind Eisenstab und Ketten, Auf steht die Tür, du kannst dich retten In freies, schönes Dichtertum.",154,Naturalismus,Naturalismus
1126,39890,"Ringelnatz, Joachim_Der Seriöse_1908","Ringelnatz, Joachim",Der Seriöse,1908,"Wo ich abends Weißwürste fresse, Da sitzt oft drei Tische weit Vor mir ein Herr von Noblesse, Sehr groß, sehr ernst und sehr breit.Sein Haar und Bart, seine Kleidung Sind einwandfrei und gepflegt, Wie er unter steter Vermeidung Sich einwandfrei sicher bewegt.Wie ihn die Kellner bedienen, Ist er ein Fürst oder reich. Doch bleibt das Spiel seiner Mienen Jederzeit würdig und gleich.Wenn diese würdig seriöse Erscheinung vorübergeht, Dann ist mir, als ob mein Gekröse In Hirn und Leib sich verdreht.Denn wenn er mit seinen Blicken Mich streifte – das fühle ich klar –, Ich würde zusammenknicken Und nimmer sein, was ich war.Doch ohne seitwärts zu schauen, Schreitet er durchs Lokal. Seine gerunzelten Brauen – Wie alles an ihm – sind aus Stahl.Und seine Schritte lenken Sich dahin, wohin man nicht sieht. Ich wage nicht auszudenken, Was er dort etwa vollzieht.Ach, ich bin klein, ich bin böse. Mein Herz ist auch nicht ganz rein. Ach dürfte ich solche seriöse Persönlichkeit einmal sein!",182,Jahrhundertwende,Jahrhundertwende
2046,73487,"Liliencron, Detlev von_UNTITLED_1883","Liliencron, Detlev von",UNTITLED,1883,Wilde Rosen überschlugen  Tiefer Wunden rotes Blut. Windverwehte Klänge trugen Siegesmarsch und Siegesflut.Nacht. Entsetzen überspülte Dorf und Dach in Lärm und Glut. „Wasser . . . .“ und die Hand zerwühlte Gras und Staub in Dursteswut.Wilde Rosen überschlugen Tiefer Wunden rotes Blut. Windverwehte Klänge trugen Siegesmarsch und Siegesflut.,70,Naturalismus,Naturalismus
2065,18356,"Wille, Bruno_Das bist du_1894","Wille, Bruno",Das bist du,1894,"Wenn mit Dunkel und mit Schweigen Mutter Nacht dein Bett umhüllt, Lausche, wie mein Zaubergeigen Heimlich dir die Kammer füllt. Lausche, wie dich Wunderglocken Fromm zur heilgen Tiefe locken. In der Tiefe wohnt die Ruh, Und die Tiefe/ das bist du.Frieden ihm, so dir zur Seiten Atmend ruht; er ist dein Schild. Frieden allen Erdenbreiten, Jedem Gottesebenbild! Gib den Hütten dein Erbarmen Und dem Glück ein froh Umarmen. Ohne Güte keine Ruh. Jedes Antlitz/ das bist du.Engel, heitre Lichtgestalten, Steigen aus dem dunkeln Land Und in deine Hände falten Kosend sie die Kinderhand. Sieh doch, deine toten Lieben Sind dir alle treu geblieben; Mutterherz heißt ihre Ruh. Deine Kinder/ das bist du.Spürst du auch, wie auf dein Grüßen Harrt ein treuer Paladin? Aus der Ferne dir zu Füßen Kann ihn deine Sehnsucht ziehn. Gib dein Auge seinem Auge; Eins im andern sauge, sauge Heimatswonne, Heimatsruh. Du bist ich, und ich bin du.Horch, mein Lieb, die Zaubergeigen Singen Hochzeitsmelodein, Und der bunte Sternenreigen Stimmt und funkelt üppig drein. Welten schwärmen dort bei Welten, Wiegen sich in blauen Zelten, Summen uns in selge Ruh ... Ich bin Stern, und Stern bist du.",225,Jahrhundertwende,Naturalismus
2629,36766,"Holz, Arno_UNTITLED_1896","Holz, Arno",UNTITLED,1896,Lustig-seyn und nicht studiren/ durch die Gassen kreutz und krumm nach den Mägdgens scharmutziren/ lustig-sein und nicht studiren/ dihses ist mein Bropprium!Bluhder-Hosen/ Bontac-Flaschen/ Wörffelgens und ein Rappihr/ darzu Göldt in allen Daschen/ Bluhder-Hosen/ Bontac-Flaschen/ Bruder-Hertz/ daß lohb ich mir?Wihder blühen itzt die Pfirschen/ alles ist wie Rohsen-roht/ drümb/ so sizz ich hihr im Hirschen/ wihder blühen itzt die Pfirschen/ Dabbak ist mein Himmels-Brodt!Hühnergens in Galantine stellt man mir auff meinen Disch/ Blühmckens zihren die Turrine/ Hühnergens in Galantine/ auch die Sprottgens sind schön frisch!Kugel-Dorten/ Eyer-Baben seh ich frölichen Gesichts/ darfor bün ich stähts zu haben/ Kugel-Dorten/ Eyer-Baben/ Hola/ Jung/ verschütt mir nichts!Jeder Dropffen/ den ich drincke/ schärfft mir mehr das komme wihder/ wenn ich plincke/ jeder Dropffen/ den ich drincke – Himmel/ Herrgott/ ist mir wohl!Flöten/ Lauten und Pandoren/ Gott sey Danck/ itzt sind sie da! Singt und springt mir in die Ohren/ Flöten/ Lauten und Pandoren/ drey mahl hoch dieNachts mit gantz verschobner Krause steh ich dan für meiner Thür. Bün ich würcklich schon zu Hause? Nachts mit gantz verschobner Krause/ ha/ wie kom ich mir blohß für?Soll ich itzt Skarteken schmihren? Oder – dreh ich wihder um? Nein/ ich gehe Soll ich itzt Skarteken schmihren? Dihses were mir zu thumm!Meine Feuer-reichen Jahre blühn mir itzo/ oder nie. meine Feuer-reichen-Jahre sind mir vihl zu werth for sie!,242,Jahrhundertwende,Naturalismus
1841,45694,"Rilke, Rainer Maria_UNTITLED_1900","Rilke, Rainer Maria",UNTITLED,1900,"Euch, die ihr nie mein Gefühl verließt, grüß ich, antikische Sarkophage, die das fröhliche Wasser römischer Tage als ein wandelndes Lied durchfließt.Oder jene so offenen, wie das Aug eines frohen erwachenden Hirten, – innen voll Stille und Bienensaug – denen entzückte Falter entschwirrten;alle, die man dem Zweifel entreißt, grüß ich, die wiedergeöffneten Munde, die schon wußten, was schweigen heißt.Wissen wirs, Freunde, wissen wirs nicht? Beides bildet die zögernde Stunde in dem menschlichen Angesicht.",90,Jahrhundertwende,Jahrhundertwende
191,16677,"Engelke, Gerrit_UNTITLED_1904","Engelke, Gerrit",UNTITLED,1904,"Könnt ich mich lösen vom starren Gebein, Von erdegeborener Schwere: Könnt ich in Lüften eine Wolke sein, – Ein Funkeln im Sternenheere –Könnt ich zerbrechen den drückenden Zaum, In Licht und in Brausen verließen: In rollende Wogen, in stürzenden Schaum Die durstende Seele ergießen –O könnt ich in rauschendem, rasendem Spiel, Im Sturm sein ein seliger Reiter: Ich weiß nicht wohin – ohne Maß, ohne Ziel Immer weiter, immer weiter – –",83,Jahrhundertwende,Expressionismus
2261,28825,"Hartleben, Otto Erich_3_1884","Hartleben, Otto Erich",3,1884,"Auf den Feldern war die Frucht geschnitten , in die Scheunen war sie eingefahren , und es kam der frohe Tag der Ernte . Auf der Tenne worfelte die Gerste Boas mit den Knaben und den Dirnen.Tief im Herzen war ein Keim entsprossen , tief in heissem , demuthvollem Herzen : sich zu geben dem geliebten Herren , das gedachte Ruth , die Moabitin ihres hingegebnen Herzens Wonne wacht und athmet in der Hut der Schatten.Als die Mitternacht herangekommen , schrickt der Mann zusammen und erzittert . Er erwacht und siehe , ihm zu Füssen liegt ein junges Weib . Wer bist du ? fragt er.Ich bin Ruth , bin deine Magd und Dirne . Gieb mir Ruhe ! Breite deine Flügel über mich ! Ich bin zu dir gekommen , denn du bist der Herr , und will dir dienen . Und gerührt ob so viel armer Demuth , hebt sie Boas auf und spricht voll Mitleid : Sei dem Herrn gesegnet , meine Tochter ! Was du geben kannst , hast du gegeben , was du giebst , ist gross wie deine Liebe , und an mir hast du sie nicht vergeudet . Wie du sagst , so soll es dir geschehen : Meines Volkes ganze Stadt erfahre , dass ich dich erwählt zu meinem Weibe . Schlafe nun bis an den andern Morgen ! Keines Menschen Seele soll erkunden , dass ein Weib gekommen in die Tenne : morgen sollst du meine Gattin heissen ... Schlafe nun bis an den andern Morgen !",256,Naturalismus,Naturalismus
1492,8688,"Thoma, Ludwig_UNTITLED_1894","Thoma, Ludwig",UNTITLED,1894,"Jetzt kann uns auch der Herr Scharschant, Ade! Ade, Kaserne! Wir grüßen dich und allerhand Und winken aus der Ferne.Jetzt kann uns auch der Herr Major Zum letzten Lebewohle; Wir ziehens fröhlich aus dem Tor Und rufens die Parole.Jetzt, Mädchen, muß geschieden sein Und darfst dich nicht zergrämen! Es rucken schon die andern ein, Die wo dich wieder nehmen.",69,Jahrhundertwende,Jahrhundertwende
373,44974,"Heym, Georg_Spitzköpfig kommt er_1899","Heym, Georg",Spitzköpfig kommt er,1899,"Spitzköpfig kommt er über die Dächer hoch Und schleppt seine gelben Haare nach, Der Zauberer, der still in die Himmelszimmer steigt In vieler Gestirne gewundenem Blumenpfad.Alle Tiere unten im Wald und Gestrüpp Liegen mit Häuptern sauber gekämmt, Singend den Mond-Choral. Aber die Kinder Knien in den Bettchen in weißem Hemd.Meiner Seele unendliche See Ebbet langsam in sanfter Flut. Ganz grün bin ich innen. Ich schwinde hinaus Wie ein gläserner Luftballon.",77,Jahrhundertwende,Expressionismus
2149,46662,"Löns, Hermann_Der späte Mai_1890","Löns, Hermann",Der späte Mai,1890,"Die roten Blätter rauschen, Der Sommer ist lange vorbei, Es leuchten unsere Augen, Es blüht in uns der Mai.Wir können die Liebe nicht bergen, Wir sind uns viel zu gut, Es brennen unsere Lippen, In den Schläfen klopft unser Blut.Wir reden schüchterne Worte, Wir sehn aneinander vorbei, Scheu wie die erste Liebe Macht uns der späte Mai.Was zögerst du, was zagst du, Wer weiß, bald fällt der Schnee, Die ungeküßten Küsse, Das ist das bitterste Weh.",90,Naturalismus,Naturalismus
