Unnamed: 0,pid,filename,poet,title,year,poem,poemlength,epoch_year,epoch_poet
383,44930,"Heym, Georg_1._1899","Heym, Georg",1.,1899,"Wie Feuerregen füllt den Ozean Der schwarze Gram . Die großen Wogen türmt Der Südwind auf , der in die Segel stürmt , Die schwarz und riesig flattern im Orkan.Ein Vogel fliegt voraus . Sein langes Haar Sträubt von den Winden um das Haupt ihm groß . Der Wasser Dunkelheit , die meilenlos , Umarmt er riesig mit dem Schwingenpaar.Vorbei an China , wo Trommeln schlagen um die Tempel her.Der Regen jagt , der spärlich niedertropft Auf seinen Mantel , der im Sturme bläht . Im Mast , der hinter seinem Rücken steht , Hört er die Totenuhr , die ruhlos klopft.Die Larve einer toten Ewigkeit Hat sein Gesicht mit Leere übereist . Dürr , wie ein Wald , durch den ein Feuer reist . Wie trüber Staub umflackert es die Zeit.Die Jahre graben sich der Stirne ein , Die wie ein alter Baum die Borke trägt . Sein weißes Haar , das Wintersturmwind fegt , Steht wie ein Feuer um der Schläfen Stein.Die Schiffer an den Rudern sind verdorrt , Als Mumien schlafen sie auf ihrer Bank . Und ihre Hände sind wie Wurzeln lang Hereingewachsen in den morschen Bord.Ihr Schifferzopf wand sich wie ein Barett Um ihren Kopf herum , der schwankt im Wind . Und auf den Hälsen , die wie Röhren sind , Hängt jedem noch ein großes Amulett.Er ruft sie an , sie hören nimmermehr . Der Herbst hat Moos in ihrem Ohr gepflanzt , Das grünlich hängt und in dem Winde tanzt Um ihre welken Backen hin und her .",256,Jahrhundertwende,Expressionismus
935,21116,"Stadler, Ernst_UNTITLED_1898","Stadler, Ernst",UNTITLED,1898,"Flut, die in Nebeln steigt. Flut, die versinkt. O Glück: das große Wasser, das mein Leben überschwemmte, sinkt, ertrinkt. Schon wollen Hügel vor. Schon bricht gesänftigt aus geklärten Strudeln Fels und Land. Bald wehen Birkenwimpel über windgesträhltem Strand. O langes Dunkel. Stumme Fahrten zwischen Wolke, Nacht und Meer. Nun wird die Erde neu. Nun gibt der Himmel aller Formen zarten Umriß her. Herzlicht von Sonne, das sich noch auf gelben Wellen bäumt – Bald kommt die Stunde, wo dein Gold in grünen Frühlingsmulden schäumt – Schon tanzt im Feuerbogen, den der Morgen übern Himmel schlägt, Die Taube, die im Mund das Ölblatt der Verheißung trägt.",128,Jahrhundertwende,Expressionismus
2751,24032,"Henckell, Karl_UNTITLED_1896","Henckell, Karl",UNTITLED,1896,"Er war von Mutterleib der Brave Und hat sich trefflich aufgeführt, Er war das zahmste aller Schafe, Dem stets der Demut Kranz gebührt. Er war gehorsam in der Schule, Der Bakel lehrt' ihn seine Pflicht, Er träumte nie vom fernen Thule, Denn unvernünftig war er nicht.Mit Glorie macht' er sein Examen, Ward vielbeflissener Jurist, Er schwärmte sehr für leichte Damen Und war ein königstreuer Christ. Er hob urdeutscher Sitte Fahne Und brüllte weidlich mit im Schwarm, Macht' seinen Schatz zur Kurtisane Und zahlt' sie aus – daß Gott erbarm!Er war ein eleganter, feiner, Ein höchst charmanter, junger Held, Galant, wie er, war keiner, keiner So unterhaltend auf der Welt. Der Kneifer thront' ihm auf der Nase, Er schwang sein Stöckchen selbstbewußt, Ihn lobte Onkel, Tante, Base Und zog ihn liebend an die Brust.Er avancierte und er minnte, Natürlich nicht um Geld noch Stand – Verspritzte selbst zu Versen Tinte, Und sein ward die ersehnte Hand. Er lebte in behäbiger Muße Als wohlbestallter dritter Rat, Zuweilen litt er auch am Fuße Und ging von Zeit zu Zeit ins Bad ... . . . . . . . . . . . . . . . . . . . . . . . . . . . . .",241,Jahrhundertwende,Naturalismus
634,70721,"Trakl, Georg_DIE SCHÖNE STADT_1913","Trakl, Georg",DIE SCHÖNE STADT,1913,"Zitternd flattern Glockenklange, Marschtakt hallt und Wacherufen. Fremde lauschen auf den Stufen. Hoch im Blau sind Orgelklänge.Zitternd flattern Glockenklange, Marschtakt hallt und Wacherufen. Fremde lauschen auf den Stufen. Hoch im Blau sind Orgelklänge.",40,Expressionismus,Expressionismus
2032,36724,"Holz, Arno_Zum Dessert_1896","Holz, Arno",Zum Dessert,1896,"Nicht jeder, der hinkt, Hat heut eine Chaise; Nicht alles, was stinkt, Ist Limburger Käse.",21,Jahrhundertwende,Naturalismus
120,16648,"Engelke, Gerrit_UNTITLED_1912","Engelke, Gerrit",UNTITLED,1912,"Gott! Zeus! – Christ! Pan! Gott! Baal! – Zeus! Pan! Inder-Somar! Wolken-Donar! Großer Lama! Schöpfer-Brahma! Aller Götterhirne Schädelhaus! Alles Götteratems Luftgebraus!All-Hirn! Kraft-Stirn! Zorn-Arm! Welt-Darm! Lebenslunge! Kosmoszunge!Alles Sommerblühens Baum, Alles Narren-Denkens Schwinge, Aller Tatenfäuste Daum, Fleisch und Seele aller Dinge: Anfangsall-Gebärer: Ewig-Forternährer:Wirf herab die Böllerpauke! Wirf herab die Weltenpauke!Aller Städtemenschen Herdenstrom Will ich schlagen laut und barsch, In Fabrik- wie Kirch- und Wolkendom, Generalgewaltenmarsch!Alle Laster, Leidenschaften, Alles Werdens Mutterschaften, Dirnenliebe, vielgeschmähte, Alle Telegraphendrähte, Alles Krankenhaus-Gestöhn, Aller Hammer Schlag-Gedröhn, Alle krummen Straßenstränge, Allen Wirtshaus-Lärm, Militärkapellen-Klänge, Alles Mensch-Gedärm Will ich auf die Pauke spannen, Daraus Groß-Gesänge bannen! Trotzig meine Pauke tragen: Und mit harten Knöcheln schlagen! Daß sie jedes Ding mit Ehrfurcht nennen, Deinen Körper überall erkennen!Deines Gipfel-Kopfes Wolkenschaum-Gelock, Deines Mundes-Topfes Städtequalm-Geflock, Deiner Brüste-Pamir-Platte, Deines Bauches Straßen-Därme, Deines Leibes Krater-Wärme, Deiner Füße Länder-Matte, Deiner großen Zornes-Pforte Schwarz-Gewitterwolken-Graus, Deiner tiefen Kosmos-Worte Neunte-Symphonie-Gebraus. Eifersvoll beschlag ich gell Deiner Pauke Paukenfell: Daß man hört durch mich! Alles-Gottheit Dich!",217,Expressionismus,Expressionismus
1358,11970,"Falke, Gustav_UNTITLED_1884","Falke, Gustav",UNTITLED,1884,"Sie drängen nach oben, Die lange geduckt, Das Haupt erhoben Wird aufgemuckt; Wollen auch was haben Von der Welt Gaben. Habt lange genug allein gezecht, Den Wein verteilt mehr schlecht als recht. Zögernd erst, doch mählich frecher Tappen sie nach eurem Becher, Mit groben Fäusten und wenig eben. Hättet willig ihr gegeben, Das Tischtuch wäre geblieben rein. Nun wird verschüttet viel edler Wein, Vieles verderbt, Wie Blut gefärbt.",82,Naturalismus,Jahrhundertwende
2966,24208,"Henckell, Karl_UNTITLED_1896","Henckell, Karl",UNTITLED,1896,"An den größten Idealen Baumeln lustige kleine Schellen, Mit dem Ernst des Lebens prahlen Meist die seichtesten Gesellen.",20,Jahrhundertwende,Naturalismus
348,12748,"Lichtenstein, Alfred_Die Nacht_1911","Lichtenstein, Alfred",Die Nacht,1911,"Verträumte Polizisten watscheln bei Laternen. Zerbrochne Bettler meckern, wenn sie Leute ahnen. An manchen Ecken stottern starke Straßenbahnen, Und sanfte Autodroschken fallen zu den Sternen.Um harte Häuser humpeln Huren hin und wieder, Die melancholisch ihren reifen Hintern schwingen. Viel Himmel liegt zertrümmert auf den herben Dingen ... Wehleidge Kater schreien schmerzhaft helle Lieder.",60,Expressionismus,Expressionismus
774,26412,Klabund_Liebeslied_1909,Klabund,Liebeslied,1909,"Dein Mund, der schön geschweifte, Dein Lächeln, das mich streifte, Dein Blick, der mich umarmte, Dein Schoß, der mich erwarmte, Dein Arm, der mich umschlungen, Dein Wort, das mich umsungen, Dein Haar, darein ich tauchte, Dein Atem, der mich hauchte, Dein Herz, das wilde Fohlen, Die Seele unverhohlen, Die Füße, welche liefen, Als meine Lippen riefen –: Gehört wohl mir, ist alles meins, Wüßt' nicht, was mir das liebste wär', Und Gä nicht Höll noch Himmel her: Eines und alles, all und eins.",116,Jahrhundertwende,Expressionismus
1795,7898,"Dehmel, Richard Fedor Leopold_Einst!_1891","Dehmel, Richard Fedor Leopold",Einst!,1891,"O weine nicht! die Wunden heilen bald, die uns ins Herz der Sehnsucht Dornen rissen. Du wirst noch das LichtDenn siehe: um dein Haupt ein Kranz erblüht, wie schöner drin jeder Schmerz als Purpurblume glüht, den dir um Mich die Liebe hat geschlagen!Schon tauch' ich meine Hand ins Morgenrot, das einst auch Deine Stirne wird verklären, wenn eine ferne und wenn als",73,Naturalismus,Jahrhundertwende
540,16657,"Engelke, Gerrit_UNTITLED_1904","Engelke, Gerrit",UNTITLED,1904,Bleib noch länger goldnes Dämmern – Wie wird der Tag schon matt und blauer – Verstummt ist Lärm und Werkstatthämmern. Die Nacht liegt auf der Lauer –Der Schlüssel schließt die Häusertore. Nun Wandrer meide die dunkle Mauer – Das Licht ist aus – es klingt im Ohre – Liegen Strolche auf der Lauer?4 –Hinauf die knarrenden Windeltritte. Die Gasse wäscht ein Regenschauer. Bald nahen im Schlafe weiche Schritte: Der Traum liegt auf der Lauer –,82,Jahrhundertwende,Expressionismus
636,26293,Klabund_2._1909,Klabund,2.,1909,"Ich spielte kindlich in den dumpfen Mauern, Der gaukelnde Genoss von Kröt und Wurm. An meinen Händen tanzten Stab und Turm Wie unsrer Dörfer trunkne Sonntagsbauern.An allen Ecken sah ich Drachen lauern, Bekämpfenswert wie ein Oktobersturm. Die Kröte glotzte königlich. Der Wurm Vermochte nur als Königssohn zu dauern.Der Drache hob im Herbst sich in die Winde, Der Turm ward Unterkunft der Metzgerei, Und ein Gespenst entfuhr dem goldnen KindeWie in der Mitternacht ein Katzenschrei. Um meinen Scheitel schlang sich Rosenbinde – Der Königsknabe freite um die Fei.",96,Jahrhundertwende,Expressionismus
374,41421,"Trakl, Georg_Die Schwermut_1900","Trakl, Georg",Die Schwermut,1900,"Gewaltig bist du dunkler Mund Im Innern, aus Herbstgewölk Geformte Gestalt, Goldner Abendstille; Ein grünlich dämmernder Bergstrom In zerbrochner Föhren Schattenbezirk; Ein Dorf, Das fromm in braunen Bildern abstirbt.Da springen die schwarzen Pferde Auf nebliger Weide. Ihr Soldaten! Vom Hügel, wo sterbend die Sonne rollt Stürzt das lachende Blut – Unter Eichen Sprachlos! O grollende Schwermut Des Heers; ein strahlender Helm Sank klirrend von purpurner Stirne.Herbstesnacht so kühle kommt, Erglänzt mit Sternen Über zerbrochenem Männergebein Die stille Mönchin.",90,Jahrhundertwende,Expressionismus
2581,46910,"Löns, Hermann_Weißt du, wieviel ..._1890","Löns, Hermann","Weißt du, wieviel ...",1890,"Weißt du, wieviel Gaslaternen Am Ernst-August-Platze stehn? Weißt du, wieviel Kandelaber Man am Tag dort kriegt zu sehn?Kandelaber, Gaslaternen Stehn da wirklich dicht an dicht; »Abends muß,« so denkt der Fremde, »Hier ja sein ein Meer von Licht.«»Das ist würdig einer Großstadt; Und bei feinen Leuten auch Ist, den Vorplatz zu beleuchten Tageshell, ein guter Brauch.«Kommt er abends dann zum Bahnhof, Dann erblickt er weit und breit Eingehüllt Hannovers Vorplatz In ein Meer von Dunkelheit.",97,Naturalismus,Naturalismus
974,39012,"Sack, Gustav_UNTITLED_1900","Sack, Gustav",UNTITLED,1900,"Der Atem stockt; denn schwer und trunken schmiegt sich heut der Tag der Erde an und eines dummen Vogels Lied fliegt, fliegt, ein Ding das noch nicht fliegen kann und immer wieder gleich zur Erde fällt, ängstlich durch die wüstenwarme Weltund regt mich auf! Wie sich der Tag mit unerträglich weicher Schwere drängt in dieses jungen Vogels Lied! Und himmelan mit Hast und Flügelschlag flattert in die kühle braune Leere! Und ihn ewige Ermattung mit tausend Armen immer wieder niederzieht!Doch auf den Bergen lauert schon der Föhn und wird noch über Nacht aus seinen Höhn und Wolkenhallen brausend in die Ebne fallen!",112,Jahrhundertwende,Expressionismus
1685,7961,"Dehmel, Richard Fedor Leopold_Dichterfreundschaft_1891","Dehmel, Richard Fedor Leopold",Dichterfreundschaft,1891,"Euch suchte ich . O kindisch weich Bewegen , o stürmisch Wogen alter Liebeslust ! der schwellende Strom dem rollenden Meer entgegen , so stürz ' ich mich an eure Brust . Noch Einmal rauschen auf aus ihren Gründen der ersten Jugendsehnsucht scheue Laute , zur Brandung schäumend : in die Flut zu münden , die brausend lockende , die urvertraute ... O langer : die tausend Küsse , die er aufgesogen , wie Lenzhauch nun sein lockiges Haupt umflogen , umschlangen die geballten Fäuste , bogen sie spielend auf und kos'ten sie und zogen in seinen Schooß sie wieder , und ein Säumen und so rann er matt des Weges , wie in Träumen ... So fand ich Euch – und lauschte . O Erwachen ! o brüderlich Erkennen , jauchzend Lachen ! o Meeresstimmen , süße Schwesterlaute ! erfüllter Ahnung Klänge , urvertraute ! – Zur tiefen See des vollen Stromes Sehnen erfaßt mich , in die Arme euch zu fallen , zu fühlen eurer Herzensfluten Wallen , an eurer sturmgeworfnen Brust zu lehnen.In Eure Seele schütten will ich Meine mit allen Himmelswassern , die sie tränkten , mit allen Quellenpulsen , die mich drängten euch zu umhalsen : daß in Eine Eine glücksingende Woge unser Leben brande , die glanzumzittert von dem Strahlennetze der großen Sonne Liebe rings die Lande , die dürren , für denSchon keimt es sacht ; schon hör ' ich Osterglocken vom Strand der Zukunft grüßen übers Meer , – – der Dank der Menschheit , drüber her ...",256,Naturalismus,Jahrhundertwende
2004,46839,"Löns, Hermann_An die Spröde_1890","Löns, Hermann",An die Spröde,1890,"Gertrude, weiße Blume, Was bist du so stolz; Es wächst kein grünes Blättlein Am trockenen Holz.Die Nachtigall singt nicht In Schnee und in Eis; Die Liebe schmeckt am schönsten, Wenn niemand es weiß.Gertrude, weiße Blume, Der Flieder der blüht; Die Nachtigall im Walde Die singet ihr Lied.Sie singet von Liebe, Sie singet von Glück; Die Zeit, die verpaßt ist, Die kommt nicht zurück.Gertrude, weiße Blume, Und kurz ist der Mai; Was willst du noch warten – Bald ist es vorbei.",96,Naturalismus,Naturalismus
307,26406,Klabund_Mond und Mädchen_1909,Klabund,Mond und Mädchen,1909,"Es kriecht der kahle Mond durch Zweiggeäder, Ob wo im Haus ein Mädchen wohnt, Ein warmes Bett, ein daunenweicher Leib, Es wärmt zur Winternacht sich gern ein jeder.. O Mädel, bleib, du schlanke Zeder!Der Mond tastet am Fensterglase Und zittert vor Begier und Frost... Das Mädel schlägt ihm vor der Nase Die Läden zu und höhnt: Gib ruh! Alten Gliedern ziemt nicht junger Most!Er aber hat den Finger in der Fensterspalte, Ob ihrer Kissen eine Falte er nicht erspähe, Er ihre Blicke, braune Rehe, Über der Brüste Sommerhügel Zärtlich schreiten sehe.",109,Jahrhundertwende,Expressionismus
380,21130,"Stadler, Ernst_UNTITLED_1898","Stadler, Ernst",UNTITLED,1898,"In diesen Nächten friert mein Blut nach deinem Leib, Geliebte. O, meine Sehnsucht ist wie dunkles Wasser aufgestaut vor Schleusentoren, In Mittagsstille hingelagert reglos lauernd, Begierig, auszubrechen. Sommersturm, Der schwer im Hinterhalt geladner Wolken hält. Wann kommst du, Blitz, Der ihn entfacht, mit Lust befrachtet, Fähre, Die weit der Wehre starre Schenkel von sich sperrt? Ich will Dich zu mir in die Kissen tragen so wie Garben jungen Klees In aufgelockert Land. Ich bin der Gärtner, Der weich dich niederbettet. Wolke, die Dich übersprengt, und Luft, die dich umschließt. In deine Erde will ich meine irre Glut vergraben und Sehnsüchtig blühend über deinem Leibe auferstehn.",128,Jahrhundertwende,Expressionismus
1568,7923,"Dehmel, Richard Fedor Leopold_Frühlings Einzug_1891","Dehmel, Richard Fedor Leopold",Frühlings Einzug,1891,"Der Frühling stieg zur Erde nieder: o helle Lust, o stille Scheu! Im Herzen regt sich Alles wieder, so alt vertraut, so selig neu!So schnell geschah's – kaum kann ich's fassen, der graue Winter sei nun tot! Man fühlte sich so glückverlassen, manAch, Seligkeit: es scheint die Sonne! und schickt der Lenz auch er weint sich aus von seiner Wonne, daß er so klarer lächeln kann!Ich möchte alle Menschen fragen, ob sie nicht jauchzen woll'n mit mir! Nein, ganz verschwiegen will ich's tragen! Ach, Liebchen, nein! ich sag' es Dir!",120,Naturalismus,Jahrhundertwende
961,50255,"Ball, Hugo_Einer Verdammten_1906","Ball, Hugo",Einer Verdammten,1906,"Ha, wie sie heuchlerisch entrüstet, Sich hüllen in die Kutten der Moral Und wie Papa vertraulich flüstert: »Mama, dies ist ein offener Skandal«. Die hohe Gattin nickt verständlich Und vor »Empörung« brennend rot Ruft sie: »Von",47,Jahrhundertwende,Expressionismus
730,26373,Klabund_Winterschlaf_1909,Klabund,Winterschlaf,1909,"Indem man sich nunmehr zum Winter wendet, Hat es der Dichter schwer, Der Sommer ist geendet, Und eine Blume wächst nicht mehr.Was soll man da besingen? Die meisten Requisiten sind vereist. Man muß schon in die eigene Seele dringen – Jedoch, da haperts meist.Man sitzt besorgt auf seinen Hintern, Man sinnt und sitzt sich seine Hose durch, – Da hilft das eben nichts, da muß man eben überwintern Wie Frosch und Lurch.",82,Jahrhundertwende,Expressionismus
1311,45739,"Rilke, Rainer Maria_29._1900","Rilke, Rainer Maria",29.,1900,"Stiller Freund der vielen Fernen, fühle, wie dein Atem noch den Raum vermehrt. Im Gebälk der finstern Glockenstühle laß dich läuten. Das, was an dir zehrt,wird ein Starkes über dieser Nahrung. Geh in der Verwandlung aus und ein. Was ist deine leidendste Erfahrung? Ist dir Trinken bitter, werde Wein.Sei in dieser Nacht aus Übermaß Zauberkraft am Kreuzweg deiner Sinne, ihrer seltsamen Begegnung Sinn.Und wenn dich das Irdische vergaß, zu der stillen Erde sag: Ich rinne. Zu dem raschen Wasser sprich: Ich bin.",99,Jahrhundertwende,Jahrhundertwende
20,44878,"Heym, Georg_10._1899","Heym, Georg",10.,1899,"Wie dichte Wolken liegen Dunst und Hauch Des heißen Mittags auf der Ebnen Weiten. Die Sonnenstrahlen wie durch Nebel gleiten, Schwarz wälzt sich hin verbrannter Felder Rauch.Der Toten Blut und Wunden faulend stinken. Die Sterbenden, die Durst wahnsinnig macht, Kriechen auf Vieren durchs Gewühl der Schlacht Zu den schon Toten, um ihr Blut zu trinken.Hier haben zwei im Staube sich gefunden. Ein Perser und ein Grieche. Halb schon tot, Der in der Brust, der in dem Bauch die Wunden.Der stärkre Perser drosselt den Hellenen. Dann läßt er des Erstickten Blut sich munden, Das wie ein Bach tritt aus des Bauches Venen.",114,Jahrhundertwende,Expressionismus
2754,18442,"Wille, Bruno_UNTITLED_1894","Wille, Bruno",UNTITLED,1894,"Durch dunkle Grabzypressen haucht Geheimnisvolles Raunen ; Aus weißen Fliederdolden taucht Der Mond mit scheuem Staunen . Und sieh , vom frischen Grabe Hebt sich der Marmelstein , Die Höhlung klafft/ ein bleicher Mann Ersteht im Silberschein.An seine wirre Stirne greift Der Tote schlummertrunken ; Und wie sein Blick die Tafel streift , Da stutzt er , bohrt versunken Das Aug in seine Und gellt ; Da fährt er jäh empor.Zum Dörflein heimwärts will er gehn/ Wie ehedem/ und zaudert Und bleibt am Friedhofzaune stehn , Von fremder Scheu durchschaudert : » O Pilger , laß , was drüben liegt , Wo sattsam du gegangen ! Auf neuen Pfaden weide Geläutertes Verlangen ! « Bei Büschen , Hügeln , Dorf und Au Verweilt sein Aug mit Grüßen , Ade ! und schwimmt in Tränentau . Und wie er nun dem süßen Trostliede lauscht der Nachtigall , Da sucht er eine Gruft Und küßt von weißer Rose Erinnerungsvollen Duft. » Zur Rüste , Pilger ! Was so schwer Dir lastet auf dem Herzen , Tu ab von dir ! und schürfe leer Dein Herz von Schutt und Erzen ! Was du gelebet/ Schutt und Erz/ Sei nun gerecht gerichtet Und hier auf deiner Tafel , Zwei Hüglein , aufgeschichtet ! « Er wiegt das Haupt in stummem Weh/ Das gilt dem Schlackenhügel . Doch aus dem andern , rein wie Schnee , Formt er zwei Schwanenflügel ; Die fügt er an die Schultern Und spannt sie breit und hehr , Ein kühner Weltensucher/ Hinaus zum Sternenmeer .",257,Jahrhundertwende,Naturalismus
646,52719,"Lasker-Schüler, Else_Weltende_1903","Lasker-Schüler, Else",Weltende,1903,"Es ist ein Weinen in der Welt, Als ob der liebe Gott gestorben wär, Und der bleierne Schatten, der niederfällt, Lastet grabesschwer.Komm, wir wollen uns näher verbergen… Das Leben liegt in aller Herzen Wie in Särgen.Du! wir wollen uns tief küssen - Es pocht eine Sehnsucht an die Welt, An der wir sterben müssen.",62,Jahrhundertwende,Expressionismus
2562,24015,"Henckell, Karl_Am Brückenrande_1896","Henckell, Karl",Am Brückenrande,1896,"Grauweißer Nebel lastet kalt und feucht , Trüb flimmert 's von den schwarzen Schifferkähnen , Am Brückenrande laßt mich einsam lehnen , Im Arm gestützt , das Haupt hinausgebeugt ! Der Weltstadt Wirbel braust an mir vorüber , Laut donnernd rollt 's vor meinem Ohre hin , Die Schifferlampen flimmern trüb und trüber , In Nacht und Nebel weht mein Sinn.O stolzes Herz , Gestaltenlos umflort er meine Augen , Gebt Luft und Licht , sie brünstig einzusaugen ! Dies öde Nebelchaos trag ich nicht . Schwer , wie der Brockenriese , preßt 's mich nieder , Ich ringe , bete , flehe – laßt mich frei ! Fröstelnd erschauern meine müden Glieder – O , wär 's auf immerdar vorbei ! ... Und doch ! Wach auf aus deiner Seelenpein , Zieh stolz und freudig fürder deine Bahnen , Und zweifelst du , laß eines dich gemahnen : Nicht Lügnerin kann Mutter Erde sein . Aus ihrem Schoß ist auch dein Leib entsprungen , Ihr heißer Kuß drückt ' ein des Dichters Mal , Wenn , ihrer wert , du einst dein Lied gesungen , Freut sie sich segnend ihrer Wahl.Und sieh ! Die Nebelballen flattern scheu , Schon streift mein Blick die dunstgelösten Wogen , Und über , unter mir hinweggezogen Ist jäh der Schleier , und ich atme neu . Die Sterne glühn in ihrem milden Glanze , Im Wasser spiegelt sich ihr reines Licht , Nun auf , nun auf zum Geisteswaffentanze ! Hoch schwillt der Mut – ich zage nicht .",256,Jahrhundertwende,Naturalismus
445,44990,"Heym, Georg_UNTITLED_1899","Heym, Georg",UNTITLED,1899,"Es ist ganz dunkel. Und die Küsse fallen Wie heißer Tau im dämmernden Gemach. Der Wollust Fackeln brennen auf und wallen Mit roter Glut dem dunklen Abend nach.Das Fieber jagt ihr Blut mit weißem Brand, Daß sie sich halb schon seinem Durst gewährt. Sie bebt auf seinem Schoß, da seine Hand In ihrem Hemd nach ihren Brüsten fährt.Hinten, im Vorhang, in der Dunkelheit Steht auf das Bett, der Hafen ihrer Gier. Wie Wolken auf dem Meere lagert breit Darauf der Dunst von schwarzem Elixier.Wie wird es sein? Sie friert in seinem Arm, Der ihren nackten Leib hinüberträgt. Es zittert auf in ihrem Schoße warm, Um den er wild die beiden Arme schlägt.Ihr blondes Haar brennt durch die Nacht, darein Die tiefe Hand des feuchten Dunkels wühlt. Der Sturm der Wollust läßt sie leise schrein, Da seinen Biß sie in den Brüsten fühlt.",159,Jahrhundertwende,Expressionismus
788,39001,"Sack, Gustav_UNTITLED_1900","Sack, Gustav",UNTITLED,1900,"Er kam von Nirgendwo, er nahm mir leise der Dinge Metermaß und Stundenglas und gab mir, was ich lange schon vergaß, zurück in wundersam verzerrter Weise:Was einst ich stammelnd schrieb zu deinem Preise, wird nun ein Jauchzen ohne Ziel und Maß – oh deine Nacktheit, die ich nie besaß, tanzt um mich weiße fieberwilde Kreise!Sie tanzt –! du rast, du bist ganz tolle Glut, umwogt von deines Haars wildgoldnen Strähnen umkreist mich deine liebesgierige Wutgleich einem Roß mit sturmzerzausten Mähnen – – oh schönen Traumes heiße Bilderflut, aus der ich aufwach unter bitteren Tränen!",109,Jahrhundertwende,Expressionismus
589,10159,"Weissmann, Maria Luise_Gesang der Frühvollendeten_1914","Weissmann, Maria Luise",Gesang der Frühvollendeten,1914,"Wir denken euch im Gleiten manchmal, Lebende, Durch Traum und Ahnung und die Flut des Abends: Ihr Schmerzlichen, wenn ihr in schweren Taten Zur Tiefe sinkt. Wir stiegen steil empor, Da unserm Aufbruch keine Ziele standen, Uns grenzenlos die Wanderschaft empfing. Nun sind wir über euch, und euer fernstes Geschehen löscht, Erinnerung, vertan, Uraltes Lächeln unserer Vergangenheit.",70,Expressionismus,Expressionismus
1926,45649,"Rilke, Rainer Maria_Der Leser_1900","Rilke, Rainer Maria",Der Leser,1900,"Wer kennt ihn, diesen, welcher sein Gesicht wegsenkte aus dem Sein zu einem zweiten, das nur das schnelle Wenden voller Seiten manchmal gewaltsam unterbricht?Selbst seine Mutter wäre nicht gewiß, ob Getränktes liest. Und wir, die Stunden hatten, was wissen wir, wieviel ihm hinschwand, biser mühsam aufsah: alles auf sich hebend, was unten in dem Buche sich verhielt, mit Augen, welche, statt zu nehmen, gebend anstießen an die fertig-volle Welt: wie stille Kinder, die allein gespielt, auf einmal das Vorhandene erfahren; doch seine Züge, die geordnet waren, blieben für immer umgestellt.",114,Jahrhundertwende,Jahrhundertwende
1667,39898,"Ringelnatz, Joachim_Die Waisenkinder_1908","Ringelnatz, Joachim",Die Waisenkinder,1908,"Zwanzig grobe Strohhüte gehen Zwei und zwei wie Militär. Zwanzig schwarze Pelerinchen wehen, Als wenn's zum Begräbnis wär.Magre Lehrerin voraus, Hinten magre zweite, Eine dritte an der Seite, Also zieht aus engem Haus Eine Schlange in die Weite.Hilfe! Mideid! Und Beschwerde! Zwanzig arme Waisenkinder, Streng getrieben, eine Herde Junger Rinder –.Weil mich meine Mutter knufft, Und um Stärkres zu vermeiden, Sag ich: »Ja, man läßt sie weiden In der frischen, freien Luft.«»Weiden? – Dummheit! Siehst du nicht, Was hier vorgeht, roher Bengel! Junge Blumen brauchen Licht, Wärme, Erde, Wurzel, Stengel –.«»Manche brauchen Mist, Mama, Weil sie anderes vermissen, Und der ist – wer kann es wissen – Hier vielleicht sehr reichlich da.«»Treibt mit diesen Engeln Spott! Und mich will er nicht verstehen. Warte, dir wird's schlimm ergehen! Und das wünsch ich dir. Bei Gott.«Meine Mutter dreht Rücken zu und geht.Und nun sauf ich wo, wo keine Rinder, Blumen, Engel sind, Bin für mich oder für meine Mutter Naseweisenkind.",209,Jahrhundertwende,Jahrhundertwende
