Unnamed: 0,pid,filename,poet,title,year,poem,poemlength,epoch_year,epoch_poet
101,21071,"Stadler, Ernst_UNTITLED_1898","Stadler, Ernst",UNTITLED,1898,"Wie sie rings mich umflattern , Die platten Kobolde des Alltags ! Wie sie sich an mich hängen , Glatt und klein , Am Rock mich zerren , Mich nieder zu stürzen von meiner sonnigen Felsenhöhe Hinab in 's Thal , Bis ich auch so bin , So klug und fromm und matt und kalt Wie die Andern ... O du brausende Sturmnacht , morschen Angeln , Bauern ziehen singend zur Arbeit : Morgengrauen. » Heut ' Nacht in meiner Kammer lag In Ängsten ich und Bangen : Nun führen Licht und Lerchenschlag Von Osten her den jungen Tag , All Sorgen ist vergangen . Gelobt sei Gott der Herr ! « Plötzlich kommt mir die Erinnerung wieder , Und ich fahre empor : So war 's umsonst , daß ich vor dir auf den Knieen lag , Grausamer Gott ? Umsonst , daß an deiner Seite ich durch die Sturmnacht fuhr , Umsonst , daß dein Feueratem mich durchdrang ? Ein Zeichen fleh ' ich , gieb mir ein Zeichen , Gottheit ! Hin gesunken bin ich in 's morgenjunge Gras , Und die Hände falten sich zu wildem Beten ... Da – plötzlich rauscht 's über mir : Zwei Raben flattern auf , Kreisen langsam mir über dem Haupt und verschwinden Weit in 's Blau . Da sink ' ich in die Kniee , und all mein Trotz Schmilzt hin in heißen Dankesthränen . Dann richt ' ich mich auf und leuchtenden Auges Steig ' ich hinab zu den Menschen , meinen Brüdern ...",257,Jahrhundertwende,Expressionismus
27,26116,Klabund_Wünsche_1909,Klabund,Wünsche,1909,"Wenn du des Nachts die große Stadt durchstreifst, Und deine Wünsche in den Ampeln hängen, Versuche, daß den Willen du begreifst, Aus dem sie ins erhaben Dunkle drängen. Sie flüchten früh vor ihrer Blondheit Glanz, Aus der sie gerne Mörderstricke flöchten. Ihr Dasein ist auf Strahlenschuhn ein Tanz – Sie bringen Leben, wo sie sterben möchten.",65,Jahrhundertwende,Expressionismus
669,39052,"Sack, Gustav_Der Speer_1900","Sack, Gustav",Der Speer,1900,"Was ich auch seh und höre, glaub ich nicht, und was ich glaube, glaub ich nimmermehr, doch diese Weisheit, die sich selbst zerbricht, wirft mich wie einen blanken Eschenspeer, der tönend an der Scheibe Erz zerspellt, mitten hinein ins tiefe Herz der Welt.",52,Jahrhundertwende,Expressionismus
1417,39980,"Ringelnatz, Joachim_Lebhafte Winterstraße_1908","Ringelnatz, Joachim",Lebhafte Winterstraße,1908,"Es gehen Menschen vor mir hin Und gehen mir vorbei, und keiner Davon ist so, wie ich es bin. Es blickt ein jedes so nach seiner Gegebenen Art in seine Welt.Ich sehe sie getrieben treiben. Warum sie wohl nie stehenbleiben, Zu sehen, was nach ihnen sieht? Warum der Mensch vorm Menschen flieht?Und eine weiße Weite Schnee Verdreckt sich unter ihren Füßen. So viele Menschen. Mir ist weh: Keinen von ihnen darf ich grüßen.",86,Jahrhundertwende,Jahrhundertwende
152,26227,Klabund_UNTITLED_1909,Klabund,UNTITLED,1909,"Ich ging übers Feld und suchte einen Menschen. Ich traf sieben tote Engländer. Ich begab mich in das Dorf. Wollte ein Weib. Liebte eine Ziege.Erhob den Blick und suchte die Sonne. Sie war von Granatennebel umdunkelt. Ich fiel zur Erde. Meine Knie Stiessen auf Eisen und Beton.Gänse schnattern. Zum Teufel: dreht ihnen die Hälse ab! Laternen leuchten. Auslöschen! Mädchen lächeln von unten herauf. Begattet sie Mit Messern oder sonst einem Tod.Den Fliegen reisse man einzeln die Flügel aus. Blende den Hasen und jage ihn ins Feld. Menschen ohne Beine mögen laufen, Wohin immer es ihnen gefällt.Leben wird unerträglich dem Sterbenden. Sonne: ich spei dir in dein goldnes Gesicht Die Eiterfetzen meiner Lunge. Mutter – Warum immer gebärst du Tod!",139,Jahrhundertwende,Expressionismus
878,44932,"Heym, Georg_1._1899","Heym, Georg",1.,1899,"Der Wintermorgen dämmert spät herauf. Sein gelber Turban hebt sich auf den Rand Durch dünne Pappeln, die im schnellen Lauf Vor seinem Haupte ziehn ein schwarzes Band.Das Rohr der Seen saust. Der Winde Pfad Durchwühlt es mit dem ersten Lichte grell. Der Nordsturm steht im Feld wie ein Soldat Und wirbelt laut auf seinem Trommelfell.Ein Knochenarm schwingt eine Glocke laut. Die Straße kommt der Tod, der Schifferknecht. Um seine gelben Pferdezähne staut Des weißen Bartes spärliches Geflecht.Ein altes totes Weib mit starkem Bauch, Das einen kleinen Kinderleichnam trägt. Er zieht die Brust wie einen Gummischlauch, Die ohne Milch und welk herunterschlägt.Ein paar Geköpfte, die vom kalten Stein Im Dunkel er aus ihren Ketten las. Den Kopf im Arm. Im Eis den Morgenschein, Das ihren Hals befror mit rotem Glas.Durch klaren Morgen und den Wintertag Mit seiner Bläue, wo wie Rosenduft Von gelben Rosen, über Feld und Hag Die Sonne wiegt in träumerischer Luft.Ein alter Schädel flattert aus der Gruft, Mit einem feuerroten Haar beschwingt, Das um sein Kinn, hoch oben in der Luft, Der Wind zu feuriger Krawatte schlingt.Die leere Grube lacht aus schwarzem Mund Sie freundlich an. Die Leichen fallen um Und stürzen in den aufgerissenen Schlund. Des Grabes Platte überschließt sie stumm.",227,Jahrhundertwende,Expressionismus
1613,12082,"Falke, Gustav_Zwischen Tag und Abend_1884","Falke, Gustav",Zwischen Tag und Abend,1884,"Dämmerung bringt mit weichen Händen Friedevolle Ruh, Träumen ohne Ende, Wandeln ohne Wende, Schönern Sternen zu.Und ich fühl mich hingetragen, Wo die reinen Flammen wehn, Singend um den Sonnenwagen Selig heitere Scharen gehn. Über Wolken, über Welten, Triumphatorschritt, Ziehen sie den Neugesellten, Den Erhöhten, den Erhellten, Ihre goldne Straße mit.",63,Naturalismus,Jahrhundertwende
2090,70464,"Holz, Arno_UNTITLED_1886","Holz, Arno",UNTITLED,1886,"Noch blüht ja unsre Noch heilt der Zeit gewaltge Frage Ein Titel und ein Portemonnaie.Noch wachsen täglich unsre Zöpfe, Der „Glaube“ ist des Pudels Kern, Das Militär putzt seine Knöpfe Und das Antike wird modern.Noch scharr'n vor meinem Cap vier Pferde, Zu Fuß zu gehn ist ja gemein — „O wunderschön ist Gottes Erde Und werth, darauf vergnügt zu sein!“",71,Naturalismus,Naturalismus
2681,46575,"Löns, Hermann_Absagebrief_1890","Löns, Hermann",Absagebrief,1890,"Betrogen hast du mich, mein Schatz, Und fühlst dich hoch und stolz dabei, Daß eines Dichters großes Herz Um deinetwillen gebrochen sei.So traurig ist es doch noch nicht, Die Wunde heilt in kurzer Zeit Und das Gefühl, das mich durchtobt, Ist nur verletzte Eitelkeit.Gemüt und Seele – deine Brust Besaß davon nicht eine Spur: Du hattest einen schönen Leib Und warst mein Freudenmädchen nur.Doch dankbar bin für alles ich, Für jeden Kuß und jeden Blick, An all die süßen Stunden denk Ich immer gerne noch zurück.Adjüs! wir scheiden ohne Pein, Kein Antlitz bleich, kein Auge naß – Schön bist du, doch ich trinke nie Mit andern ausPostscriptum: Dies noch wünsch' ich dir: Daß deine Damit auch du erfahren mögst,",136,Naturalismus,Naturalismus
987,21074,"Stadler, Ernst_UNTITLED_1898","Stadler, Ernst",UNTITLED,1898,"Aus heiligen Grotten , wo sie sich barg vor dem grellen Rauschen des Tages , kam leise die Nacht . Schweigend blickt sie um sich mit den sehnsuchtsstillen Augen , in deren dämmernde Tiefen du tauchst wie in des ewigen Meeres verschwimmende , dunkle Fernen . Scheu flieht vor ihrem milden Glanze der harte Tag . Langsam gleitet sie und schweigend heran , und den Vögeln : Nehmet , nehmet hin meiner Seele tiefinnerstes Wogen . Siehe , der Mond sprüht über euch bleichen , süßen Tau der Stille ... Siehe , vor euch ausgegossen liegt schimmernde Schönheit ... Trinket , o trinket der überquellenden Fülle ! « Raunen und Rauschen wandert über die Welt . Über Fels und Moor , Baum und Berg , Blumen und Haide . Eine aber kann 's nicht länger bergen . Die Nachtigall . Aufjauchzen muß sie . Aller Welt künden hehrsten Glückes Überschwang . Jauchzen entquillt ihr – aber es schluchzt hervor wie zehrendes Klagen . Wie das höchste Glück Thränen erpreßt , und reinste Schönheit einhaucht den Atem süßester Wehmut . Und sie klagt ... Klagt und lauscht und klagt wieder ... Sank ich dämmernd nieder dir zu Füßen , milde Königin ? Wache ich , oder legtest leise du deine Hand mir aufs Auge und löstest sanft die Spangen schwerenden Sinnens , daß ich lächelnd hingleite durch die stillen Gewässer des Traumes ? Ich weiß es nicht . – Aber schmeichelnd wie junger Lenzwind flüstert mir ins Ohr deine Stimme und das schluchzende Jauchzen der Nachtigall ...",256,Jahrhundertwende,Expressionismus
2565,69044,"Holz, Arno_UNTITLED_1898","Holz, Arno",UNTITLED,1898,"In einen brennenden Abendhimmel, aus Staub und Dunkel, steigt der Dom.Die Glocken läuten.Die kleinen Linden stehen schwarz, vor ihren Thüren sitzen alte Leute.Feierabend!Die Gassen schweigen.Die Gluth erlischt, am Himmel leise ziehn die ewigen Sterne auf.",42,Jahrhundertwende,Naturalismus
967,39056,"Sack, Gustav_Der Federkiel_1900","Sack, Gustav",Der Federkiel,1900,"Gleich einem umgestülpten Glas, das von der Lerchen Liederschlag in endlosem Bibrieren tönt, hängt nun der Himmel jeden Tag über dem strotzend fetten Gras.Doch mir ward diese blaue Welt feindlich zu einem Satyrspiel, das meiner Nöte lächelnd höhnt und mich gleich einem Federkiel in seinen losen Händen hält.",52,Jahrhundertwende,Expressionismus
1697,8007,"Dehmel, Richard Fedor Leopold_UNTITLED_1891","Dehmel, Richard Fedor Leopold",UNTITLED,1891,"Und doch, und doch, du stolzes Kind, viel stolzer fühlt mein kleines Lied, das kindlich vor dir niederkniet und fromm beginnt: Wärst du im Ehrenkleide der Hohen höchste Zier, ich fühlte doch trotz Seide und Hohheit und Geschmeide als deiner Ehren erste Zier die Gleichheit zwischen dir und mir.Und doch, und doch, noch stolzer schwebt, du stolzes Kind, mein kleines Lied, das nun auf dich herniedersieht und fühlt und bebt: Wärst du in Schmach gefallen, du die Gemeinste hier, und Mein Herz rein vor Allen, ich dächte Dein vor Allen, weil meiner Reinheit reinste Zier die Gleichheit zwischen dir und mir.Und doch, und doch, du stolzes Kind, viel stolzer fühlte wol mein Lied, das stolz vor Deinem Stolze flieht, wenn still und blind wol nun ein Bangen käme, wol zwischen dir und mir, nun ein Verlangen käme, dich wild gefangen nähme, daß wir vergäßen – fühlst du? die Gleichheit zwischen dir und mir.",180,Naturalismus,Jahrhundertwende
448,26291,Klabund_Prolog zu einem Schauspiel_1909,Klabund,Prolog zu einem Schauspiel,1909,"Ich neige mich vor aller Bühnen Auditorien : Es ist so schwer , ein Mensch zu sein . Selbst in der Heiligkeit ersehnter Glorien Fühlt schmerzlich sich der Einzelne allein.Die Einsamkeit beschattet seine Seele ; Sie lässt erzittern seines Herzens Schlag . Und selbst der Sang der süssen Philomele Verdunkelt nur den überwölkten Tag.Da hebt am Abend leicht vor einem jeden Der Vorhang sich gleitet puppenspielerisch an Fäden Der Hass , der Hohn , die Liebe und das Geld.Gestaltung wird die lächelnde Gebärde , Zur Totenbahre neigt sich die Monstranz . Und die gelobte , die geliebte Erde Bevölkert sich mit Rausch und Traum und Tanz.Wie dunkler Wein ist Wahrheit zu geniessen ; Die Wirklichkeit ist leerer Winde Schall . Die Tränen , die aus unsern Augen fliessen , Empfangt sie in des Herzens Blutkristall ! Das Lachen , das in eure Ohren töne , Es fiel vom Himmel ; ein metallner Stern . Und es verkläre klingend , es verschöne Die edlen Damen und die stolzen Herrn.So klug ist keiner , dass ihn Liebe schände . So schön ist niemand , dass ihn Schmerz entehrt . Es zeigt der Bühne buntestes Gelände Den Götterjüngling mit dem Rosenschwert.Es hebe seinen Stab nun der Ephebe Und rühre euer Herz zum frommen Schaun . Ein jeder ahne freundlich , dass er lebe , Und ihn beglücke Nymphe , Gott und Faun.Es sinken eines trüben Tages Dünste , Wie eine Blume blüht Gemeinsamkeit , Umarmt euch angesichts der goldnen Künste Und fühlt beseligt , dass ihr Brüder seid .",256,Jahrhundertwende,Expressionismus
2967,46626,"Löns, Hermann_Kopf oben_1890","Löns, Hermann",Kopf oben,1890,"Laß doch das Wimmern und das Weinen, Das Winseln über Qual und Not, Nicht immer kann die Sonne scheinen, Nicht immer glänzt das Morgenrot, Es muß auch Regenwolken geben Und Sturmgeheul und Wetterschein, Langweilig wär das Menschenleben, Wollt' es ein ew'ger Maitag sein.Und wird die Welt zu ungezogen Und stichelt grob an dir herum, Brauch' deine derben Ellenbogen Und deinen Mund, doch blei nicht stumm; Wozu das rücksichtsvolle Zieren, Hau dem Gesindel ins Gesicht, Das wird der Menge imponieren, Und Jubel erntet dein Gedicht.Und wenn die lauen Winde kosen, Dann werde nicht sentimental, Mit beiden Händen pflück die Rosen, Bekränz' damit dein Ideal, Die Qualen, die am Herz dir saugen, Versenk in des Vergessens Grab, Und wenn dir lächeln liebe Augen, Dann küss' die roten Lippen ab.Und kommt die Zeit an dich, zu sterben, Erhe kein großes Wehgeschrei, Jedwedes Leben muß verderben Und eingehn in das Einerlei, Steh auf – ein Schwarm von neuen Gästen, Der drängt dich weg aus deinem Raum, Du zahlst noch lange nicht am besten, Geh' ab und schlaf' den ew'gen Traum.",214,Naturalismus,Naturalismus
421,26278,Klabund_Grete G._1909,Klabund,Grete G.,1909,"So lauf ich mit dem Winde um die Wette Und borge von den Sternen meinen Schein. Die Erde ist mein Bette Und soll mein Himmel sein.Komm: Mädchen, Jüngling – beides mir. Noch fühl ich unter deiner Brüste Früchten Das Herz sich wie ein scheues Tier Ins Dickicht deines Leibes flüchten.Ach wenn ich wie der Pelikan Die Brüste beide dir zerreissen dürfte Das Blut aus deinem Herzen schlürfte! Wie wär ich selig dran!",78,Jahrhundertwende,Expressionismus
1046,45455,"Rilke, Rainer Maria_Das Lied des Blinden_1900","Rilke, Rainer Maria",Das Lied des Blinden,1900,"Ich bin blind, ihr draußen, das ist ein Fluch, ein Widerwillen, ein Widerspruch, etwas täglich Schweres. Ich leg meine Hand auf den Arm der Frau, meine graue Hand auf ihr graues Grau, und sie führt mich durch lauter Leeres.Ihr rührt euch und rückt und bildet euch ein anders zu klingen als Stein auf Stein, aber ihr irrt euch: ich allein lebe und leide und lärme. In mir ist ein endloses Schrein und ich weiß nicht, schreit mir mein Herz oder meine Gedärme.Erkennt ihr die Lieder? Ihr sanget sie nicht nicht ganz in dieser Betonung. Euch kommt jeden Morgen das neue Licht warm in die offene Wohnung. Und ihr habt ein Gefühl von Gesicht zu Gesicht und das verleitet zur Schonung.",136,Jahrhundertwende,Jahrhundertwende
921,26401,Klabund_Das Meer_1909,Klabund,Das Meer,1909,"Ich schwelle in meiner Flut über die Erde. Es wirft meine wilde Welle Tang an den Strand, Muscheln, violette Quallen und kleine Seepferde.Aber der Ekel zischt, daß ich mich gezeigt. Ich krieche in mich zurück, Und der Nordwind schweigt.Ebbe ist... Kinder gehen, sammeln, suchen Und sehen Krabben, nasse Sterne, Erstaunlichstes Getier.Und was ich an den Strand warf, stirbt in der Luft Oder in des Menschen Hand. – Nur die Taschenkrebse graben sich Mit ihren Scheren in den Sand. Sechs Stunden warten sie bis zur nächsten Flut. – Die Taschenkrebse kennen mich gut.",108,Jahrhundertwende,Expressionismus
1837,8034,"Dehmel, Richard Fedor Leopold_Venus Gloria_1891","Dehmel, Richard Fedor Leopold",Venus Gloria,1891,"Ich träume oft von einer bleichen Rose. Hell ragt ein Berg; sie blüht in seinem Schatten, zum fernen Lichte schmachtend, mit dem matten dem Blumenblick, aus ihrem dunklen Loose.Dann bangt sie mich; tief stockt mein Fuß im Moose. Doch weiter muß ich, muß das Ziel erreichen, den Gipfel mit den immergrünen Eichen; so steh ich schwankend zwischen Berg und Rose.Denn wie sich auch mein Fuß bemüht zu kämpfen, ich kann die bange Sehnsucht nicht mehr dämpfen, aus ihrem Schooß den reinen Duft zu schlürfen.Da –: Flügel –: frei! und an der Brust die Blume! schon naht der Hain mit seinem Heiligtume, wo auch die Rosen immergrünen dürfen ...",125,Naturalismus,Jahrhundertwende
1873,7891,"Dehmel, Richard Fedor Leopold_Mädchens Sehnsucht_1891","Dehmel, Richard Fedor Leopold",Mädchens Sehnsucht,1891,"Möcht' ein Lied dem Liebsten singen, daß er tief ins Herz mir sieht; doch es will mir nicht gelingen, und mein Sinn ins Weite flieht. Ob es mir an Tönen fehle? ob zu ist ein einzig Sehnsuchtslied.",44,Naturalismus,Jahrhundertwende
2499,23893,"Henckell, Karl_Wandlung_1896","Henckell, Karl",Wandlung,1896,"Einst sprach das Leid zu mir : du bist verloren , Zu fest umklammert hält dich meine Hand . Du glaubtest dich zur Herrlichkeit erkoren , Nun lähm ' ich dir mit Schrecken den Verstand . Einst sprach das Leid zu mir : du bist verloren.O schwere Zeit der finsteren Gewalten , Da ich in Qualen lag , die niemand weiß ; Da mich stürzte – Frag keiner mich , wohin geriet mein Gram ! Als Ekel mir das Mahl des Lebens würzte Und die Verzweiflung mir den Schlummer nahm . Ich taumelte , ich strauchelte , ich stürzte.Wer löst das Rätsel , wie ich auferstanden ? Geheime Hände hoben mich empor . Das Leben heilte mich mit neuen Banden , Und alles ward erfüllt , was ich verlor . Wer löst das Rätsel , wie ich auferstanden ? Ich bin ein Wundergläubiger geworden , Seit mir so Wunderwirkendes geschah . Das Lied der Kraft mit segnenden Akkorden Umrauschte mich – ein Sieger stand ich da . Ich bin ein Wundergläubiger geworden.Verwandelt ist mein Fühlen und mein Sinnen , Und keiner Wolke Dunst umarm ' ich mehr . Das Nichts verlieren und das All gewinnen : Gewaltig ist des Lebens Wiederkehr . Verwandelt ist mein Fühlen und mein Sinnen.Einst sprach das Leid zu mir : du bist verloren . Das Spiel war aus und meine Seele tot . Nun bin ich doch zur Herrlichkeit erkoren , Zur höchsten Wonne ward die tiefste Not . – Einst sprach das Leid zu mir : du bist verloren !",256,Jahrhundertwende,Naturalismus
2956,23975,"Henckell, Karl_UNTITLED_1896","Henckell, Karl",UNTITLED,1896,"Leben, du glotzest mich grausig an, Wie'n Ungetüm, das mich zerreißen kann.Schleichst gar gefährlich um mich herum – Ein Fehltritt: Fressen fürs Publikum!Ob ich vor dir zu straucheln mich hüte! Hast Zähne von ausgezeichneter Güte.Wie hold dein Gebiß! Wie zart deine Krallen! Man möchte dir gleich vor die Füße fallen.Gelt, so 'nen harmlosen Träumer packt Man im Umdrehn? Der wird zerfetzt und zerhackt.Leben, du süße Bestie – ich denke, Man achtet ein wenig auf seine Gelenke ...",92,Jahrhundertwende,Naturalismus
806,16654,"Engelke, Gerrit_UNTITLED_1913","Engelke, Gerrit",UNTITLED,1913,"Ich pfeife schon den ganzen Morgen Und döse für mich hin. Die Sonne ist in Regenlust verborgen – Doch irgendwas erheitert meinen Sinn.Die Menschen sehn heute anders aus, Das Zeitungsmädchen hüpft so niedlich, – Die lange Straße, Haus an Haus, So regengrau – und schläfert doch so friedlich.Was gestern hier lärmte, roh und fuselkehlig, Das ist heute alles stumm. – Wie bin ich heute selig – Und weiß doch nicht warum –Ihr lieben Leute, ich schalt euch: unausstehlich, Fluchte manchmal, schalt euch: schlecht und dumm, Vergebt mir heute, ich bin so selig Und weiß doch nicht warum.",113,Expressionismus,Expressionismus
437,26176,Klabund_Der arme Kaspar_1909,Klabund,Der arme Kaspar,1909,"Ich geh – wohin? Ich kam – woher? Bin aussen und inn, Bin voll und leer. Geboren – wo? Erkoren – wann? Ich schlief im Stroh Bei Weib und Mann. Ich liebe dich, Und liebst du mich? Ich trübe dich, Betrübst du mich? Ich steh und fall, Ich werde sein. Ich bin ein All Und bin allein. Ich war. Ich bin. Viel leicht. Viel schwer. Ich geh – wohin? Ich kam – woher?",93,Jahrhundertwende,Expressionismus
111,16710,"Engelke, Gerrit_UNTITLED_1918","Engelke, Gerrit",UNTITLED,1918,"Allmächtig prächtig Glutgestirn , Überwältigend emporwirbelnd , aufdonnernd vor Licht über Wolkenfirn In flutblau schäumende Himmelshallen , Die aus unendlichem ewig herniederfallen : Unter dir sind : Waldmeere , der Flüsse Geäder , Felsballen , Und der grenzenlos hindunstende Tag Von Anfang zu Anfang . Erster Tag der Farnwälder und Saurier ; ersten Blutes , Pulses Schlag , Da aus der Mutter gewölbtem Leib Dunstdämmer , Rhode-Island-Dampfer , Hudson-Pinassen an Mole und Pier : Stündliche Schlacht , Lebenseroberung , Gold-Wut , Brot-Gier . Darüber , bogenspringend , tragend Bahnen , Männer , ohne Lücke : Fein schütternde , kilometerlange Brookliner Hängebrücke ! Alles , alles : brausend , stoßend in tausendfach spielendem Licht , Das aus der Eisensäulen Wolkenkronen bricht ! Allmächtig , prächtig Glutgestirn , Emporwirbelnd , aufdonnernd vor Helle über Wolkenfirn : Es ist kein Tag , der nicht von dir zerglüht , versengt , erbleicht In Meere , Prärieen , Städte sich abendmüde , leblos neigt und schweigt . Und keine Sterne – Nacht , die sich in blindem Durste schnell verblüht , Bis wieder Morgen ! Morgen ! Wolken , Wellen Menschenhäupter übersprüht.Du Gottgestirn , flammensausender Blick und Auge ungeheuer : Du hältst , umwärmst und brennst mit deiner Güte Feuer : Gewölk , Getier , Gezeiten , Menschheit aller Zonen , Erdniedersingend , himmelüberschwingend in Aeonen , Äquator , Pol – Europa und auch Asien ? O , unser aller , meine deine lebenheiße Welt Von unaufhörlich gutem , ewig großem Tage überhellt , Von Sonne ! Sonne , Sonne !",256,Expressionismus,Expressionismus
815,44967,"Heym, Georg_UNTITLED_1899","Heym, Georg",UNTITLED,1899,"Die Menschen stehen vorwärts in den Straßen Und sehen auf die großen Himmelszeichen , Wo die Kometen mit den Feuernasen Um die gezackten Türme drohend schleichen.Und alle Dächer sind voll Sternedeuter , Die in den Himmel stecken große Röhren . Und Zaubrer , wachsend aus den Bodenlöchern , In Dunkel schräg , die einen Stern beschwören.Krankheit und Mißwachs durch die Tore kriechen In schwarzen Feld gelegen.Noch manchmal zappelnd . Und der Felder Tiere Stehn um sie blind , und stoßen mit dem Horne In ihren Bauch . Sie strecken alle viere Begraben unter Salbei und dem Dorne . [ Das Jahr ist tot und leer von seinen Winden , Das wie ein Mantel hängt voll Wassertriefen , Und ewig Wetter , die sich klagend winden Aus Tiefen wolkig wieder zu den Tiefen . ] Die Meere aber stocken . In den Wogen Die Schiffe hängen modernd und verdrossen , Zerstreut , und keine Strömung wird gezogen Und aller Himmel Höfe sind verschlossen.Die Bäume wechseln nicht die Zeiten Und bleiben ewig tot in ihrem Ende Und über die verfallnen Wege spreiten Sie hölzern ihre langen Finger-Hände.Wer stirbt , der setzt sich auf , sich zu erheben , Und eben hat er noch ein Wort gesprochen . Auf einmal ist er fort . Wo ist sein Leben ? Und seine Augen sind wie Glas zerbrochen.Schatten sind viele . Trübe und verborgen . Und Träume , die an stummen Türen schleifen , Und der erwacht , bedrückt von andern Morgen , Muß schweren Schlaf von grauen Lidern streifen .",256,Jahrhundertwende,Expressionismus
406,44000,"Stramm, August_Wunder_1894","Stramm, August",Wunder,1894,Du steht! Du steht! Und ich Und ich Ich winge Raumlos zeitlos wäglos Du steht! Du steht! Und Rasen bäret mich Ich Bär mich selber! Du! Du! Du bannt die Zeit Du bogt der Kreis Du seelt der Geist Du blickt der Blick Du Kreist die Welt Die Welt Die Welt! Ich Kreis das All! Und du Und du Du Stehst Das Wunder!,73,Jahrhundertwende,Expressionismus
2164,24188,"Henckell, Karl_UNTITLED_1896","Henckell, Karl",UNTITLED,1896,"Schon steht es im »Tripstriller Tageblatt«: »Verfault ist der Gesellschaft Kern!« Schon schlägt man zur Zeitungsphrase platt Den Stein des Anstoßes vor dem Herrn. Schon machen die Literaten Im Mute der Wahrheit – potz Kohn! Die Würmer pfeifen vom Braten: »Siehe, er stinket schon!«",57,Jahrhundertwende,Naturalismus
696,39048,"Sack, Gustav_Frühlingsmorgen_1900","Sack, Gustav",Frühlingsmorgen,1900,"Von diesen frühlingskitschigen Vergnügen mag mir der reine Himmel nur genügen – wie liegt er keusch und ewig unbewegt, der mich aus dieser geilen Zeugungskraft hoch in die quellenfrische Kühle rafft und meine Sehnsucht in die Berge trägt!",40,Jahrhundertwende,Expressionismus
623,44026,"Stramm, August_Feuertaufe_1894","Stramm, August",Feuertaufe,1894,Der Körper schrumpft den weiten Rock Der Kopf verkriecht die Beine Erschrecken Würgt die Flinte Ängste Knattern Knattern schrillen Knattern hieben Knattern stolpern Knattern Übertaumeln Gelle Wut. Der Blick Spitzt Zisch Die Hände spannen Klaren. Das Trotzen ladet. Wollen äugt Und Stahler Blick Schnellt Streck Das Schicksal.,51,Jahrhundertwende,Expressionismus
2459,20024,"Müller-Jahnke, Clara_Die eine Saite_1882","Müller-Jahnke, Clara",Die eine Saite,1882,"Und wieder spielt der Abend auf den Wogen in seiner herbstlich sonnenroten Pracht. Auf goldner Straße kommt dahergezogen die stille Sehnsucht, die so selig macht. In lila Purpurdämmrung träumt der Strand.Ein lauer Wind aus rosenroter Weite: und mir im Herzen tönt die eine Saite, – – die du gespannt.",55,Naturalismus,Naturalismus
606,12770,"Lichtenstein, Alfred_Prophezeiung_1913","Lichtenstein, Alfred",Prophezeiung,1913,"Einmal kommt – ich habe Zeichen – Sterbesturm aus fernem Norden. Überall stinkt es nach Leichen. Es beginnt das große Morden.Finster wird der Himmelsklumpen, Sturmtod hebt die Klauentatzen: Nieder stürzen alle Lumpen, Mimen bersten. Mädchen platzen.Polternd fallen Pferdeställe. Keine Fliege kann sich retten. Schöne homosexuelle Männer kullern aus den Betten.Rissig werden Häuserwände. Fische faulen in dem Flusse. Alles nimmt sein ekles Ende. Krächzend kippen Omnibusse.",77,Expressionismus,Expressionismus
