Unnamed: 0,pid,filename,poet,title,year,poem,poemlength,epoch_year,epoch_poet
2776,70453,"Holz, Arno_UNTITLED_1886","Holz, Arno",UNTITLED,1886,"Das Volk hat lange, graue Ohren, Und seine Treiber nennen sich Rabbiner, Pfarrer und Pastoren.Verhaßt ist mir der Schwindelbau Der jesuitelnden Sophisten, Und überleg ich's mir genau, Hab ich Talent zum Atheisten.Tagtäglich schürt in mir den Spott Das fade Weihrauchduftgeträufel, Denn schließlich ist der liebe Gott Doch nur ein dummer Antiteufel!",59,Naturalismus,Naturalismus
2103,72551,"Holz, Arno_UNTITLED_1899","Holz, Arno",UNTITLED,1899,"Die Diele knackt!Mir graut vor meinem Schatten.Es hat einen dicken Krötenbauch, Geierkrallen, lange, schlenkernde Affenarme und Schweinsaugen . . .Ich leuchte in alle Winkel.Staub, abgeblätterter Kalk, tote Fliegen und Spinnweben.Wie ich mich endlich unter das Bett bücke, die Haare sträuben sich mir, das Licht schlottert, in eine Ecke geklemmt, sitzt das Biest da.Aus seinem Maul, halb zerkaut, hängt mein Pantoffel.Entsetzt stieren wir uns an.Leise, hin und her, ringelt sich sein Rattenschwanz.",87,Jahrhundertwende,Naturalismus
511,39035,"Sack, Gustav_Einsam_1900","Sack, Gustav",Einsam,1900,"Ich habe niemals Du zu euch gesagt – wohin ich kam und wen ich immer sprach und wenn er auch in meinen Armen lag, ich habe niemals Du zu ihm gesagt.Und doch hab ich mich nie darob beklagt und wenn die Sehnsucht auch mit wildem Schlag mein selbstgewähltes Klausnertum durchbrach, hab ich doch niemals Du zu euch gesagtund hatte immerdar an mir genug, berg ich doch ewig in mir Gott und Tier und Licht und Kot und heiligste Begier,und hielt mein stilles Zwiegespräch mit mir, bis über mir gleich einem Totentuch der Schrei der Einsamkeit zusammenschlug.",103,Jahrhundertwende,Expressionismus
2649,12497,"Wedekind, Frank_Abschied_1891","Wedekind, Frank",Abschied,1891,"Glück und Segen und alles Gute Gieß dir hernieder ein schützender Stern; Könnt ich's erkaufen mit meinem Blute, Oh, wie erkauft ich es dir so gern.Freu dich sorglos der sonnigen Tage! Klarblauer Himmel verkläret den Blick; Aber mit weicher melodischer Klage Dämpfe die Schmerzen im Mißgeschick.Durch die Täler und über die Höhen Wandr ich indessen die steinige Bahn; Fernher winkendes Wiedersehen Spornt die ermüdeten Schritte an.Breitet sich abends dann mir zu Füßen Reich die herrliche Lenzesflur, Drüben die dunklen Berge grüßen Und der Flüsse leuchtende Spur.Seh ich's alles weit übergossen Von der sinkenden Sonne Glut, Oh, wie wird mir das Herz erschlossen, Dein gedenkend mit neuem Mut.Dein gedenkend, steig ich zu Tale, Nacht umfängt mich mit düstren Wehn; Aber im Morgensonnenstrahle Weiß ich ein freudiges Wiedersehn.",142,Naturalismus,Naturalismus
1973,44046,"Lautensack, Heinrich_UNTITLED_1900","Lautensack, Heinrich",UNTITLED,1900,"Mir liegt die Welt, ein Buch voll Sprüchen, aufgeschlagen. Ihr, ihr könnt Verse sagen, wo mir ein Weisheitsspruch.Mir ist das Weib ein Bild, ein ungestilltes Sehnen, wo euch mit ein paar Tränen das Höchste sich erfüllt.Mir ist der Gott ein Traum. Ich bin des Traums Verkünder ... Ihr, ihr seid Gottes Sünder und eßt von seinem Baum ...",67,Jahrhundertwende,Jahrhundertwende
218,44952,"Heym, Georg_UNTITLED_1899","Heym, Georg",UNTITLED,1899,"Deine Wimpern, die langen, Deiner Augen dunkele Wasser, Laß mich tauchen darein, Laß mich zur Tiefe gehn.Steigt der Bergmann zum Schacht Und schwankt seine trübe Lampe Über der Erze Tor, Hoch an der Schattenwand,Sieh, ich steige hinab, In deinem Schoß zu vergessen, Fern, was von oben dröhnt, Helle und Qual und Tag.An den Feldern verwächst, Wo der Wind steht, trunken vom Korn, Hoher Dorn, hoch und krank Gegen das Himmelsblau.Gib mir die Hand, Wir wollen einander verwachsen, Einem Wind Beute, Einsamer Vögel Flug,Hören im Sommer Die Orgel der matten Gewitter, Baden in Herbsteslicht, Am Ufer des blauen Tags.Manchmal wollen wir stehn Am Rand des dunkelen Brunnens, Tief in die Stille zu sehn, Unsere Liebe zu suchen.Oder wir treten hinaus Vom Schatten der goldenen Wälder, Groß in ein Abendrot, Das dir berührt sanft die Stirn.Göttliche Trauer, Schweige der ewigen Liebe. Hebe den Krug herauf, Trinke den Schlaf.Einmal am Ende zu stehen, Wo Meer in gelblichen Flecken Leise schwimmt schon herein Zu der September Bucht.Oben zu ruhn Im Hause der durstigen Blumen, Über die Felsen hinab Singt und zittert der Wind.Doch von der Pappel, Die ragt im Ewigen Blauen, Fällt schon ein braunes Blatt, Ruht auf dem Nacken dir aus.",234,Jahrhundertwende,Expressionismus
906,10207,"Weissmann, Maria Luise_Schnee_1914","Weissmann, Maria Luise",Schnee,1914,"Träne des Himmels: der Regen fiel Tödlich wie Schwermut fällt Auf das geliebte zerbrochene Spiel Auf die verwesende Welt.Herbst schon rollte sie schwelgend hinab, Purpurner Untergang, Sanft nun wiegt sie zu Grab Eigener Wehmut Gesang.Da: im silbernen Blitz der Fröste Sieh, Erstarrung fällt, Selige Form; es tanzt im Kristall die erlöste Tanzt die gerettete Welt.",63,Expressionismus,Expressionismus
773,44963,"Heym, Georg_UNTITLED_1899","Heym, Georg",UNTITLED,1899,"Die Finsternis raschelt wie ein Gewand, Die Bäume torkeln am Himmelsrand.Rette dich in das Herz der Nacht, Grabe dich schnell in das Dunkele ein, Wie in Waben. Mache dich klein, Steige aus deinem Bette.Etwas will über die Brücken, Es scharret mit Hufen krumm, Die Sterne erschraken so weiß.Und der Mond wie ein Greis Watschelt oben herum Mit dem höckrigen Rücken.",68,Jahrhundertwende,Expressionismus
2720,46907,"Löns, Hermann_UNTITLED_1890","Löns, Hermann",UNTITLED,1890,"Harzkäse ist nicht jedermanns Sache, Ich aber finde riesig nett Als Zubiß zu der kleinen Lage Ein sogenanntes Schneider-Kot'lett.Harzkäse mit Schmalzbrot nennt man nämlich Im Volke so; und ich bestellt' Mir kürzlich das; kurz vor dem Ersten, Denn weiter langte nicht das Geld.»Woll'n Sie nun Vietz'schen oder Noah'schen?« So sprach der Wirt, und langte her Die Käse: »Ich kann Ihnen versichern, Daß durchgebrannt sie beide sehr.«Ich überlegte, dann streckte ich zeigend Nach der Marke Noah aus meine Hand: »Von diesem geben Sie mir, Herr Gastrat, Denn der ist schon länger durchgebrannt!«",115,Naturalismus,Naturalismus
1959,45677,"Rilke, Rainer Maria_Die dritte Elegie_1912","Rilke, Rainer Maria",Die dritte Elegie,1912,"Eines ist , die Geliebte zu singen . Ein anderes , wehe , jenen verborgenen schuldigen Fluß-Gott des Bluts . Den sie von weitem erkennt , ihren Jüngling , was weiß er selbst von dem Herren der Lust , der aus dem Einsamen oft , ehe das Mädchen noch linderte , oft auch als wäre sie nicht , ach , von welchem Unkenntlichen triefend gelächelt , Mutter . Wie sollte er es nicht lieben , da es ihm lächelte . hat ers geliebt , denn , da du ihn trugst schon , war es im Wasser gelöst , das den Keimenden leicht macht.Siehe , wir lieben nicht , wie die Blumen , aus einem einzigen Jahr ; uns steigt , wo wir lieben , unvordenklicher Saft in die Arme . O Mädchen , das zahllos Brauende ; nicht ein einzelnes Kind , sondern die Väter , die wie Trümmer Gebirgs uns im Grunde beruhn ; sondern das trockene Flußbett einstiger Mütter – ; sondern die ganze lautlose Landschaft unter dem wolkigen oder reinen Verhängnis – : Und du selber , was weißt du – , du locktest Vorzeit empor in dem Liebenden . Welche Gefühle wühlten herauf aus entwandelten Wesen . Welche Frauen haßten dich da . Was für finstere Männer regtest du auf im Geäder des Jünglings ? Tote Kinder wollten zu dir ... O leise , leise , tu ein liebes vor ihm , ein verläßliches Tagwerk , – führ ihn nah an den Garten heran , gieb ihm der Nächte Übergewicht ... ...",256,Expressionismus,Jahrhundertwende
601,44888,"Heym, Georg_20._1899","Heym, Georg",20.,1899,"Die Griechen halten am befreiten Strand. Sie sehn die Fahrt der Schiffe vor den Winden, Sie sehn sie langsam in das Graue schwinden, Wo Meer und Himmel läuft in eine Wand.Sie schauen auf, und sehn den Genius thronen Der Freiheit Hellas' und der Nachwelt Zeiten, Die Götter sehn sie nach den Hallen schreiten, Vom Schlachtfeld kehrend, wo im Licht sie wohnen.Greis, Mann und Knabe halten sich umschlungen, Vom Glanz geblendet, von den Himmels-Strahlen. Den Göttern Dank, die Asien bezwungen.Ein frommes Weihelied entsteigt den Talen, In tausend Stimmen wird es fortgesungen. Und Pheidippides bindet die Sandalen.",111,Jahrhundertwende,Expressionismus
2381,73573,"Liliencron, Detlev von_UNTITLED_1883","Liliencron, Detlev von",UNTITLED,1883,"Einmal ist er grün geworden, Als ein heißes Land im Süden Sandte seinen Gruß nach Norden, Kuß und Trost dem Lebensmüden. Einmal blühten seine Zweige, Einmal zog ein Cymbelzug, Als in roter Sonnenneige Dort ein Herz am andern schlug.Leise kam die Flut gezogen, Trümmer hob sie von den Watten, Dunkle Halligwerften trogen, Todesfeuchte Kasematten. Durch die Luft, wie müde Greise, Schleppt ein weiß Gewölke sich, Abgemattet von der Reise, Marsch aus fremdem Himmelstrich.Bleicher Stern im Wolkenspalte, Wild phantastische Gebilde, Menschen, nordisch nüchtern kalte, Odins Schwert und Asenschilde. Hohe Flut, gelispellose, Spielt herauf zu Deich und Baum. Meine blasse Küstenrose Lehnt an mir, ein süßer Traum.Nun von meinem Fenster seh’ ich Oft den Baum mit toten Zweigen. Unter seinen Ästen steh’ ich Oft im tiefen Winterschweigen. Oft, ich halt’ des Hutes Krempe, Freut mich dort der Wetterstreit, Singt der Sturm, der rasche Kämpe, Grenzenloser Einsamkeit.Einmal ist er grün geworden, Als ein heißes Land im Süden Sandte seinen Gruß nach Norden, Kuß und Trost dem Lebensmüden. Einmal blühten seine Zweige, Einmal zog ein Cymbelzug, Als in roter Sonnenneige Dort ein Herz am andern schlug.",220,Naturalismus,Naturalismus
2635,46726,"Löns, Hermann_Die Prinzessin von Ahlden_1890","Löns, Hermann",Die Prinzessin von Ahlden,1890,"Ein Vogel singt im hohen Holz, Wie schön ist doch der Mai, Der Vogel, der ist gelb und stolz, Die Liebe, die ist frei; Die ganze Welt ist aufgeblüht, Der gelbe Vogel singt sein Lied, Liebe, Liebe, Wie süß ist doch die Liebe.Da drunten in dem Blumengrund, Wie schön ist doch der Mai, Dort kost ein Pärchen Mund an Mund, Die Liebe, die ist frei; Das Mädchen ist aus Bauernstand Und er ein Knecht aus fremdem Land, Liebe, Liebe, Wie süß ist doch die Liebe.Ein Vogel singt im hohen Holz, Wie schön ist doch der Mai, Der Vogel, der ist gelb und stolz, Die Liebe, die ist frei; Die Julirosen blühten rot, Bei meiner Liebe stand der Tod, Liebe, Liebe, Wie süß ist doch die Liebe.Das ist schon dreißig Jahre her, Wie schön ist doch der Mai, Und ich vergess' es nimmermehr, Die Liebe, die ist frei; Das Wasser blitzt, die Wiese blüht, Das Blut in meinen Wangen glüht, Liebe, Liebe, Wie süß ist doch die Liebe.",207,Naturalismus,Naturalismus
2215,23838,"Henckell, Karl_UNTITLED_1896","Henckell, Karl",UNTITLED,1896,"Du, brausend aus ewig schwangerer Nacht Und ewig zeugendem Lichte, Aus feuchtem Brodem und Glut entfacht, Verwegenstes der Gedichte: Geträumt von Gott, dem ursprünglichen Geist, Dem Grund des Abgrunds entquollen, Du, das da schäumt und zittert und kreist –Geheimnisvoll die Rhythmen des Alls Durch deine dämonischen Fluten, Im Wirbel der Wollust, im Schrei des Metalls, In gewitterflammenden Ruten! Im adlerschwebenden Gletschersang Der unbesieglichen Seelen, Im schattendämmernden Untergang –Der schwelenden Wut und des heimlichen Leids, Im Feuer der stolzen Empörung, In blühender Rosen berückendem Reiz, In seliger Sehnsucht Erhörung. In lachender Laune weltheiterem Laut, In Genien, der Urkraft ergeben, Was da atmet und schwingt, was da leuchtet und taut:",130,Jahrhundertwende,Naturalismus
2404,70408,"Holz, Arno_UNTITLED_1886","Holz, Arno",UNTITLED,1886,"So seid doch endlich still davon! Ihr ändert's ja Die alte Hure von Babylon!Das Eisen der Kraft hat sie spielend zerbrochen, Sie schnitzt sich Heroen aus jedem Wicht Und saugt uns das Mark aus unsern Knochen Mit ihrem weißen Sirenengesicht.Die Flammen der Freiheit sind lange vergluthet, Die Herzen schlagen, die Herzen schrein — Eh der neue Messias sich verblutet, O heilige Sintfluth, brich herein!",74,Naturalismus,Naturalismus
701,44909,"Heym, Georg_UNTITLED_1899","Heym, Georg",UNTITLED,1899,"Die in der großen Gruft des Todes ruhen, Wie schlafen sie so stumm im hohlen Sarg. Des Todes Auge schaut auf stumme Truhen Aus schwarzem Marmorhaupte hohl und karg.Sein dunkler Mantel starrt von Staub und Spinnen. Vor alters schlossen sie der Toten Gruft. Vergessen wohnen sie. Die Jahre rinnen Ein unbewegter Strom in dumpfer Luft.Nach Weihrauch duftet es und morschen Kränzen, Von trocknen Salben ist die Luft beschwert. Und in geborstnen Särgen schwimmt das Glänzen Der Totenkleider, dran Verwesung zehrt.Aus einer Fuge hängt die schmale Hand Von einem Kind, wie Wachs so weiß und kalt, Die, balsamiert, sich um das Sammetband Der schon in Staub zerfallnen Blumen krallt.Durch kleine Fenster hoch im Dunkel oben Verirrt sich gelb des Winterabends Schein. Sein schmales Band, mit blassem Staub verwoben, Ruht auf der Sarkophage grauem Stein.Der Wind zerschlägt ein Fenster. Aus den Händen Nimmt er der Toten dürre Kränze fort Und treibt sie vor sich hin an hohen Wänden, In ewigen Schatten weit und dunklen Ort.",181,Jahrhundertwende,Expressionismus
2142,24116,"Henckell, Karl_UNTITLED_1896","Henckell, Karl",UNTITLED,1896,"Sausende Funken , Rollende Räder , Mühende Massen Wandeln die Welt ... Wenn ich mich flüchte , Bin ich ein Feiger , Wenn ich mich nahe , Trägt es die Feder , Oder wird sie vom riesigen Schwungrad zerschellt ? Ich steh inmitten Kampfheißer Tage , Ich bin geworfen In wirbelnde Flut . Die Seele blutet , Die weiche Seele , Wie kann von am Baugerüst , Sei es am Pflug – Sei 's auf der Berge Höh , Sei 's in der Grube , Sei es im Männerrat , Sei es am Herd – Wo nur mein Blick hinschweift Über die Lande weit , Wächst eine neue Welt Drunten empor . Säh sie mein Auge nicht , Müßt ' ich ein Blinder sein Oder ein Heuchler , Wollt ' ich 's nicht sehn : Kommendes Erdgeschlecht Hebt schon das Haupt empor , Mächtiger Nacken trägt Trotzigen Mut . Neuer Gesetze Sinn Zieht durch die Tiefen hin , Was die Erkenntnis weckt , Regt sich im Blut . Menschen der Erde , Jochesentspannt , Grüßen die Sonne frei , Frei Luft und Land . Meister der Erde , Herrn der Maschinenkraft , Grüßen das Leben frei , Muskelgestrafft . Töchter der Erde , Mütter der Zukunftsschar , Taufen das junge Volk , Kränzend ihr Haar : » In all-einigem Leben , Von selbstsüchtigem Unrecht rein , Schwungkraft soll eure Herzen durchbeben , Schönheitschaffende Menschen zu sein ! « ... Wird sie vom riesigen Triebrad zerschellt ? Sei 's drum ! Meine Feder der winkenden Welt !",256,Jahrhundertwende,Naturalismus
2909,73495,"Liliencron, Detlev von_UNTITLED_1883","Liliencron, Detlev von",UNTITLED,1883,"Herzog Abel schwor beim Himmel weit Und ließ dem Mörder wenig Zeit,Herzog Abel schob nichts auf die lange Bank, In die Königsburg ritt er frech und frank,",31,Naturalismus,Naturalismus
902,39046,"Sack, Gustav_Liebe_1900","Sack, Gustav",Liebe,1900,"Dann wacht ich auf und sah den Ziegelschlot vor meinem Fenster leuchten frühlichtrotund über ihm und über Dach und Wand den Morgen kalt und stählern ausgespannt.Und während sie sich noch in Träumen wiegte und fester sich in meine Schulter schmiegte,überfiel mich Schauer über Schauer der Einsamkeiten namenlose Trauer,und wie sie dann aufstöhnte lustverloren, wünschte ich, ich wäre nie geboren.",66,Jahrhundertwende,Expressionismus
673,26262,Klabund_4._1909,Klabund,4.,1909,"Der Mondschein glänzt wie deine Haut, Dein schwarzes Haar ist weinbetaut.Wer will den Wein? wer schuf die Hand? Land wurde Leib, Leib wurde Land.In braunen Augen wächst der Wald Mit Reh und Baum zur Herbstgestalt.Die Fliegen auch auf deiner Stirn Im Flug der Liebe sich verirrn.Ein jedes Gute findet leicht In deinem Lächeln sich erreicht.Ein jedes Elend fliesst als Blut Aus deinem Schoss. Wird Kind. Wird gut.",74,Jahrhundertwende,Expressionismus
866,39057,"Sack, Gustav_Die Flamme_1900","Sack, Gustav",Die Flamme,1900,"Auch ich weiß, woher ich stamme; schwälend trüb gleich einer Flamme,die das Moor zum Schwälen brachte – dieses Moor, das ich verachte,Not und Plage heißt dies Moor – glimm ich in die Nacht empor;diese Nacht, die sturmdurchwütet, in der Graun und Ekel brütet,die mich giftig schweigend tötet, eh der Tag sich mir gerötet.",68,Jahrhundertwende,Expressionismus
294,12822,"Lichtenstein, Alfred_UNTITLED_1902","Lichtenstein, Alfred",UNTITLED,1902,"Schon kommen Sonntage und Abende, In denen ich ganz leer und lustlos schreite, Ganz gläsern bin, zum Spaß mit Hunden spiele, Ach, oder kleine Steine, die ich fand, Mühsam und sinnlos durch die Straßen schleife. Oft steh ich auch an meinen Fenstern faul herum, Unschlüssig: soll ich nun in Bierlokalen Mit Kameraden runden Stumpfsinn pflegen, In flinken Kinos meine müden Elenden Stunden töten und zum Zeitvertreib Gutwillge Mädchen suchen: oder soll ich nur In meiner Stube endlos auf und ab gehn.Ich, der die Nächte wie ein Narr durchlief, Zum Himmel schreiend tausend Wunder suchte.",109,Jahrhundertwende,Expressionismus
233,16673,"Engelke, Gerrit_UNTITLED_1904","Engelke, Gerrit",UNTITLED,1904,"Unter Tag und Tagen, Tief, tief im Erdefleisch, wo kein Sonnlicht gleißt, Tief in eingebohrten Schächten, vorgetriebenen Stollen, Wo die Lämpchen wandern, Glocken schrillen, Hacken schlagen: Da lebt die Kraft, die Männermüh und Kohlenschollen, Minenschüsse, Hämmern, Kohlenwagenrollen Zu Einem dunklen, unruhvollen Rhythmus schweißt: Der Weltgeist!Und oben, wo im Hafen Lärm und Handel branden, Wo der Handel Menschen, Geld und Güter durcheinander schmeißt, Wo Docks und Hellinge Schiffsbauten umkrampfen, Wo die Auslanddampfer Riesenfrachten landen, – Oben, wo um die Großstadt tausend Schlote dampfen, Wo Eisenzüge qualmend von Stadt zu Städten stampfen: Da rast die Kraft, die Alles in Einen Arbeitswirbel reißt: Der Weltgeist!Wo auf dem Flugplatz steigbereit die Äroplane liegen: Angespannte Drähte sirren, der Propeller kreist Immer schneller, plötzlich treibt das Schraubensurren Den Lärmvogel schrägauf – fernhoch ist er schon im Fliegen – – Wo die Luftschiffe, die Riesenluft-Torpedos knurren, Sieghaft sicher näherkommend stärker, dumpfer schnurren, Da steigt, da fliegt, da siegt über Erdenschwere der Unruh-Geist: Der neue Schönheit, neue Tatenwege weist: Der Weltgeist!",206,Jahrhundertwende,Expressionismus
2864,23882,"Henckell, Karl_Müßiggang_1896","Henckell, Karl",Müßiggang,1896,"Heut ging ich müßig Den ganzen Tag, Nun bitter büß' ich Den Mißertrag. Umhergetrieben In Markt und Stadt, Und nichts geblieben, Was Tiefe hat.Ein flaches Tändeln Mit der und der, Ein schwaches Pendeln Die Kreuz und Quer. Bei Büchsenschießen Und Budenschrein Ein halb Verdrießen Und Nichtsgedeihn.Der Schwarm der Grillen Schwirrt stechend um, Mich einzuhüllen Mit Summ und Brumm: »Was gingst du müßig Den langen Tag?« Und bitter büß' ich Den Mißertrag.",85,Jahrhundertwende,Naturalismus
2906,46813,"Löns, Hermann_Das Wahrzeichen_1890","Löns, Hermann",Das Wahrzeichen,1890,"Die Sommervögel singen Jetzt über Wald und Feld, Nun heißt es Abschied nehmen, Ich fahre in die Welt.Die Rosen in dem Garten, Die blühen alle weiß, Mein Schatz hat sie begossen Mit Tränen allzuheiß.Die allzugroße Liebe Bringt allzugroße Pein, Ich wäre gern geblieben, Es sollte nicht so sein.Ums Jahr, da kehr ich wieder, Dann blühn die Rosen rot, Doch sind es lauter weiße, Mein Schatz, dann bin ich tot.",81,Naturalismus,Naturalismus
157,41366,"Trakl, Georg_1_1900","Trakl, Georg",1,1900,"Vollkommen ist die Stille dieses goldenen Tags. Unter alten Eichen Erscheinst du, Elis, ein Ruhender mit runden Augen.Ihre Bläue spiegelt den Schlummer der Liebenden. An deinem Mund Verstummten ihre rosigen Seufzer.Am Abend zog der Fischer die schweren Netze ein. Ein guter Hirt Führt seine Herde am Waldsaum hin. O! wie gerecht sind, Elis, alle deine Tage.Leise sinkt An kahlen Mauern des Ölbaums blaue Stille, Erstirbt eines Greisen dunkler Gesang.Ein goldener Kahn Schaukelt, Elis, dein Herz am einsamen Himmel.",91,Jahrhundertwende,Expressionismus
572,41391,"Trakl, Georg_Untergang_1900","Trakl, Georg",Untergang,1900,Über den weißen Weiher Sind die wilden Vögel fortgezogen. Am Abend weht von unseren Sternen ein eisiger Wind.Über unsere Gräber Beugt sich die zerbrochene Stirne der Nacht. Unter Eichen schaukeln wir auf einem silbernen Kahn.Immer klingen die weißen Mauern der Stadt. Unter Dornenbogen O mein Bruder klimmen wir blinde Zeiger gen Mitternacht.,56,Jahrhundertwende,Expressionismus
2717,24177,"Henckell, Karl_UNTITLED_1896","Henckell, Karl",UNTITLED,1896,"Ich kann die schrillen Pfiffe nicht mehr hören Der schweren Wagen, die voll Schergen sind, Und sehne mich nach sausend stillen Föhren, In ihren Harfen spielt der Sommerwind.Hier schwankt das Herz von jähestem Empören Zu grausigstem Entsetzen. Wahnesblind Zerfleischen sich die Menschen und zerstören Der Freiheit Werk für Kind und Kindeskind.Hier weht es von zerrissnen Trauerflören, Auf die das rote Blut der Brüder rinnt – Ich sehne mich nach ewigen Wipfelchören Und heiligem Frieden, der den Sieg gewinnt.",85,Jahrhundertwende,Naturalismus
1766,68643,"George, Stefan_UNTITLED_1897","George, Stefan",UNTITLED,1897,Noch zwingt mich treue über dir zu wachen  Und deines duldens schönheit dass ich weile  Mein heilig streben ist mich traurig machen  Damit ich wahrer deine trauer teile Nie wird ein warmer anruf mich empfangen ·  Bis in die späten stunden unsres bundes  Muss ich erkennen mit ergebnem bangen  Das herbe schicksal winterlichen fundes. ,80,Jahrhundertwende,Jahrhundertwende
2913,14449,"Lachmann, Hedwig_UNTITLED_1891","Lachmann, Hedwig",UNTITLED,1891,"O wüsst ich meiner Sehnsucht einen Fergen, Dass er ihr eine sanfte Fährte weise! So kehrt sie mir zurück aus hohen Bergen, Todmatt vom Flug und fast erstarrt im Eise.Ich wollte, dass ein leichter Kahn mich führe Den Strom entlang in ebene Gelände, Und dass ich dort durch eine niedre Türe In einem stillen Hause Eingang fände.Und drinnen nur von abendlichen Kerzen Ein mildes Dämmerlicht am eignen Herde. Ein warmer Raum, ein Kind an meinem Herzen, Und eine Seele mein auf dieser Erde.",92,Naturalismus,Naturalismus
177,41298,"Trakl, Georg_1_1900","Trakl, Georg",1,1900,"Oft am Brunnen, wenn es dämmert, Sieht man sie verzaubert stehen Wasser schöpfen, wenn es dämmert. Eimer auf und nieder gehen.In den Buchen Dohlen flattern Und sie gleichet einem Schatten. Ihre gelben Haare flattern Und im Hofe schrein die Ratten.Und umschmeichelt von Verfalle Senkt sie die entzundenen Lider. Dürres Gras neigt im Verfalle Sich zu ihren Füßen nieder.",65,Jahrhundertwende,Expressionismus
2722,70407,"Holz, Arno_UNTITLED_1886","Holz, Arno",UNTITLED,1886,"Ich käu nicht wieder wie das liebe Vieh; Längst hab ich von den Schuhen ihn geschüttelt, Den grauen Schulstaub eurer Poesie!Ich hab mich umgesehn in meinem Volke Und meiner Zeit bis tief ins Herz geschaut Und nächtlich ist aus dunkler Wetterwolke Ein heilig Feuer in mein Lied gethaut.Ich käu nicht wieder wie das liebe Vieh; Längst hab ich von den Schuhen ihn geschüttelt, Den grauen Schulstaub eurer Poesie!",75,Naturalismus,Naturalismus
2426,36759,"Holz, Arno_UNTITLED_1896","Holz, Arno",UNTITLED,1896,Dihß ist die schönste Zeit: das lihbe Lufft-Volck schreyt/ sanft rauscht der silbre Bach die Veilgens wach!Den süssen Hyazinth wihgt weich ein Westen-Wind/ der Tau/ der Bluhmen-Mann/ hänckt Bärlckens dran.Von Qwändel/ Klee und Poll ist jedes Blätzgen voll/ Dorant und Saturey seynd auch darbey.Frau Der saure auß Wacks bleibt sein Gesicht/ er draut sich nicht.Du lang geöhrter Dropff/ du grober Esels-Kopff/ willstu itzt gantz allein nicht frölig seyn?Wirff in den dikken Klee die dikkre Dorile! Gläubstu/ du thummpes Thier/ sie sträubt sich dir?,90,Jahrhundertwende,Naturalismus
1977,44053,"Lautensack, Heinrich_UNTITLED_1900","Lautensack, Heinrich",UNTITLED,1900,"Dies brennende Mal in allen meinen Träumen , vom Tod selbst eingebrannt , aus Niedertracht ! Dies brennende Mal in allen meinen Träumen : Noch wagte ich es nicht , danach zu fragen , ob dieser Schein , der umgeht , Hand zu Hand – – Noch wagte ich es nicht , danach zu fragen , ob dies Papier denn einzuwechseln wäre für just Weib geblieben ! so : wie der Abglanz deiner nackten Füße , wenn sie am Abend ( weißt du noch ? ) hinliefen , so : wie der Abglanz deiner nackten Füßedem nächsten Morgen erst ganz Glanz und Süße aufdrückte , da die Blumen noch alle schliefen ... dem nächsten Morgen erst ganz Glanz und Süße ! und wie dein Haar den gelben Flimmer auslieh , daß sich der neue Tag fein schmücken konnte ! oh , wie dein Haar den gelben Flimmer auslieh , daß sich die ganze , ganze Welt draus sonnte ! – – – – – – – –Es ist nicht ! Kann nicht sein ! ich darf 's nicht glauben ! und ob ich hunderttausend Tränen wein ' ... es ist nicht ! Kann nicht sein ! ich darf 's nicht glauben ! und meine Träume sollen mir nichts lügen – und sein sie millionenmal vom Tod – und meine Träume sollen mir nicht mehr lügen –dein Leib ist Brot , dein Leib ist heilig Brot , und deine Küsse sind wie Kypernwein , und – – also harr ' ich , wurzelnd tief im Glauben ,",256,Jahrhundertwende,Jahrhundertwende
