Unnamed: 0,pid,filename,poet,title,year,poem,poemlength,epoch_year,epoch_poet
2389,36800,"Holz, Arno_UNTITLED_1896","Holz, Arno",UNTITLED,1896,Das Feld steht Kräutter-leer/ Frau der Wald hat allbereit sein bundtes Stärbe-Kleid/ ein schönes Schau-Gerüst/ das bald Verwehsung küsst . Wo blihb die Amstel hin/ das Singe-Vögelgin ? Der Fröschgen ihr beschehmbt nicht mehr Hannß Sachs . Drümb sey es endlich hihr geklagt/ waß mir das Hertz benagt ! Unsre Gaben/ süsses Kind/ flüchtig wie Narzissen sind/ und es fährt mit uns die Zeit sie seynd Aeffgen ! Laß sie pappeln/ laß sie plarren/ sie seynd Narren ! Ob Jüde/ Heyde/ oder Christ/ er wird zu Mist ! Morgen lengst ist alles auß/ Mäntsch/ du bist nur eine Lauß/ morgen/ oder gar schon heut/ dröhnt vom Thurm dein Grab-Geläut ! Eins nur ist uns dan gewiß : schwartz-polihrte Fünsterniß ! Laß uns alles drümb vergessen/ Rohsen pflantzen ümb Zypressen/ die dein Auge/ wenn es strahlt/ gleichsahm wie mit Goldt bemahlt ! Deinen weichen Alabaster trukk ihn auff mich rächt alß Pflaster/ Mund an Mund und Brust an Brust/ in verschwihgner Götter-Lust/ biß ihr Pärlen-Safft dich/ Kind/ gantz durchrinnt ! Ob sie Jungffern oder Huren/ alle in die Grube fuhren/ nichts mehr war ihr Schön-Seyn nüzze in der schwartzen Lethe-Pfüzze ! Selbst ist Stanck und Gifft seit dausend Jahren ! Drümb so künt es fast geschehn/ daß die Augen mir voll Wasser stehn ! Waß ist die Welt und ihr berühmbtes Gläntzen ? Ein Blizz bey Nacht . Eh welcke Rohsen eure Scheitel kräntzen/ singt/ drinckt und lacht ! Heut sind wir noch jung und roht/ morgen hat uns schon der Dodt/ morgen sind wir Asche !,256,Jahrhundertwende,Naturalismus
504,10215,"Weissmann, Maria Luise_Dann, wenn du gehst..._1914","Weissmann, Maria Luise","Dann, wenn du gehst...",1914,"Dann, wenn Du gehst, scheinst Du mir nie gewesen. Ich finde mich, wie der vom Traum erwacht, Versehnt nach einer nächsten tiefern Nacht, Zur alten Lüge lächelnd zu genesen.Dann, wenn Du kommst, weiß ich mich nicht erhalten Je ohne Dich, Du Herz der toten Welt: Du Brand, vor dessen Glut mich das Erkalten, Dem ich entrann, erinnernd überfällt –So schwank ich, willig immer zu verlachen Der frühern Stunde Armut; find ich mich Zwischen Phantomen taumelnd; in den RachenGleit ich der Zeit, unwissend: liebt ich Dich Eben im Traum, eben im Traum-Erwachen? Dies nur: ich tats, blieb unabänderlich.",120,Expressionismus,Expressionismus
2214,14439,"Lachmann, Hedwig_UNTITLED_1891","Lachmann, Hedwig",UNTITLED,1891,"In meinem Zimmer ein paar frische Blumen, Die allen Wintermissmut mir vertreiben. Ein Vöglein pickt vor meinem Fenster Krumen Und guckt dabei zutraulich durch die Scheiben.In Stroh und Bast die Bäume eingeschlagen, Damit der strenge Frost sie nicht berühre, Die Beete wohl verwahrt vor kalten Tagen – Und, blossen Haupts, ein Bettler vor der Türe.",62,Naturalismus,Naturalismus
1829,7836,"Dehmel, Richard Fedor Leopold_Im Regen_1891","Dehmel, Richard Fedor Leopold",Im Regen,1891,"In langen Tropfen rinnt es um mich nieder, sie schlagen prasselnd durch die schlaffen Blätter, die Vögel sträuben triefend das Gefieder: es stimmt zu mir! es ist ein artig Wetter!Trübsel'ger rauscht es in den Lüften immer, der Himmel brütend scheint zu überlegen das Loos der Erde – nirgend stört ein Schimmer: versunken Laub und Licht, – nur Regen, Regen.Die Welt fühlt grämlich ihres Alters Schwere: kein Schein von Freude rings, kein Hauch von Trauer. Und ziellos starr' ich, – schreit' ich, – fort, – ins Leere: in mir und um mich grau – – und immer grauer.",117,Naturalismus,Jahrhundertwende
488,12809,"Lichtenstein, Alfred_Der Sohn_1914","Lichtenstein, Alfred",Der Sohn,1914,"Mutter, halte mich nicht, Mutter, dein Streicheln tut weh, Sieh durch mein Gesicht, Wie ich glüh und vergeh.Gib den letzten Kuß. Laß mich frei. Schick mir Gebete nach. Daß ich dein Leben zerbrach, Mutter, verzeih.",46,Expressionismus,Expressionismus
2842,24159,"Henckell, Karl_UNTITLED_1896","Henckell, Karl",UNTITLED,1896,"Du Volk, das heut in Waffen Sich einer Welt erwehrt, Die Wesen, Wollen, Schaffen Zu schänden dir begehrt – Du Volk, das überfallen Von Feindes Trug und List, Den falschen Neidern allen Zum Schimpf geworden bist.Durch schwere Schicksalsstunden, Von heiliger Glut entbrannt, Hast du mit Blut und Wunden Dein künftig Bild bekannt: Daß nur noch gelten werde Dem Manne gleich der Mann ... Dann bricht auf deutscher Erde Das Reich der Freiheit an.",83,Jahrhundertwende,Naturalismus
1371,12043,"Falke, Gustav_Der Trauermantel_1884","Falke, Gustav",Der Trauermantel,1884,"Einsamer Mohn glühte am Grabenrand, Ein Falter zog um ihn zitternde Ringe. Ein Trauermantel. Sonnig lag das Land, Der einzige Schatten war die schwarze Schwinge Des dunklen Gauklers dort, der um die Glut Des roten Mohns, ein traumhaft Wesen, flog. Und mählich schien es mir, als ob das Blut Der Blume aus den Wangen wich; sie zog Erblassend, welkend, sich in sich zusammen, Doch immer noch um die erloschnen Flammen Zuckten die schwarzen Flügel, bis ein Wind, Der übern Weg lief, sie ins Feld entführte. War ich vom Licht, vom Flügelflimmern blind? War es ein Schlaf, ein Traum, der mich berührte, Erzeugt in jenem Purpurkelch, der jetzt Wie vorher flammte, sommerheißer Glut? Ein Nichts. Ein Spuk. Blendwerk. Und doch, zuletzt, Es blieb ein leises Frösteln mir im Blut, Und als ich abends mit den Freunden trank, Die heiterm Tag ein heitres Ende machten, Sprach ich von Herbst und Tod; sie aber lachten Und stießen fröhlich an. Ein Glas zersprang.",195,Naturalismus,Jahrhundertwende
860,10202,"Weissmann, Maria Luise_Auszug der Tiere_1914","Weissmann, Maria Luise",Auszug der Tiere,1914,"Es waren eingekreist die ahnungslosen Verirrten Tiere eh sie sich versahn Von Wand und Wand. Ganz fern im Grenzenlosen Zog noch von Himmel eine blasse Bahn.In einer Nacht war Mond in ihren Träumen. Sie brachen auf, gezogen in das fahle Trügende Licht. Und wie ins Laub von Bäumen Stiegen sie ins Geäst der Kathedrale.Und stiegen träumend fort bis in das letzte Gezweig der Giebel und erwachten kaum Als sich ihr Fuß hinaus ins Leere setzte: Sie fanden sich verstiegen in dem Raum,Der Erde nicht und der nicht Himmel hieß, Ganz heimatlos. Sie starrten in des Lichts Ziehenden Strahl bis sie der Blick verließ Und sie versteinten, irren Angesichts.",119,Expressionismus,Expressionismus
1304,8002,"Dehmel, Richard Fedor Leopold_1._1891","Dehmel, Richard Fedor Leopold",1.,1891,"Damals , Seele , ja ; ich war ein Kind – und das alte Forsthaus dumpf und eng . Und in hellen und in dunkeln Nächten , wenn ich so am Kammerfenster stand und die großen Eichen schwarz erschauern hörte , wurde mir das Dach noch dumpfer . Denn immer sah ich , drüben , drüben fern , wo aus der Waldnacht um die Stahlschild oder mild und gelb wie Kronengold ; und ich wollte König werden . Meine Mutter aber sagte mir 's , dort lag Berlin ... Damals wußt'ich nicht , warum mir bangte , als sie mir die Stirne küßte . Dort lag die Lichtstadt und straalte ... Heute ist auch Nacht ; der Mond will in mein Fenster , und ich sehe über tausend Dächer . Im schweren , weichen Schnee ruhn und horchen mit verhaltnem Atem die Schatten der Stadt . Bis in den blauen Silberschein der Ferne schwillt in langen Falten weiß und zart die sanfte Decke hin , wie über die Kissen eines Täuflings . Die aber , die darunter schlafen – und wachen ? – – Schwarz und scharf stechen die Türme , Kirche neben Kirche , in den kühlen Himmel ; stahlspitz flittert ein Glanz um die finsterhohe Kuppelkrone jenes Palastes , und über einem dicken Schlote stockt ein Schild von Qualm . Jetzt , unten an der Ecke drüben , wo eine Gaslaterne trübgelb mit dem Mondlicht kämpft , schimpft ein frierender Schutzmann ein betrunknes Straßenmädchen aus . Seele , ja : da liegt Berlin ...",256,Naturalismus,Jahrhundertwende
1513,39857,"Ringelnatz, Joachim_Anstachelung beim Zahnstochern_1908","Ringelnatz, Joachim",Anstachelung beim Zahnstochern,1908,"Ich biete euch Troglodyten die Spitze. Heraus mit euch! Wer sich in Löcher Verkrümelt, ist feig. Ich besitze Der Pfeile genug in meinem Köcher.Mit dem Pfeil, dem Bogen Durch Gebirg und Tal Kommt Odysseus gezogen Und säubert den Augiasstall.Nein, ich schieße euch freche Brut nicht. Ich steche!Ihr macht mich krank Mit eurem Gestank. Ihr freßt an mir, anstatt Mich zu nähren. Ich bin noch nicht satt.Heraus aus dem Loch! Ich hülle in Spucke euch Und schlucke euch – Pieks-quieks – doch.Oder schnipse euch aufs Geratewohl In ein unbekanntes Hilfdirselber. – Ach mein Backenzahn ist schrecklich hohl Und wird täglich bröckliger und gelber.Keine Hand vors Gesicht. Komm, Zahnstöcherchen, Piek die Peiniger Aus den Löcherchen! Schäme dich nicht, Denn du bist ein kluger Reiniger.Immer wacker gespießt! Wenn auch mal Blut fließt. Ich bin nicht bang.",155,Jahrhundertwende,Jahrhundertwende
2300,46900,"Löns, Hermann_Feiner_1890","Löns, Hermann",Feiner,1890,"So ist es doch geschehen, So hat man es doch gemacht, Den Heckengang, den hat man Um seinen Namen gebracht.Es liegen in den Museen Alte Sachen aller Art, Die man mit vielen Kosten Sammelt und aufbewahrt.Doch alte Straßennamen Bewahren fällt keinem ein, Heckengang klingt gewöhnlich, Arnswaldtstraße klingt fein.Und wenn man schon einmal umtauft, So sei man konsequent, Ich weiß nicht, warum man die Straße Nicht Philisterstraße nennt.",77,Naturalismus,Naturalismus
2684,12509,"Wedekind, Frank_Lebensregel_1891","Wedekind, Frank",Lebensregel,1891,"Du kannst einzig mit dem Guten Dauernd gut Geschäfte machen. Schlechte schuften und verbluten, Schwindler jubeln und verkrachen.Auf der ganzen Erde Gottes Wird die Pflicht das Glück beneiden – Doch am schönsten ist ein flottes Todesringen zwischen beiden.Nur beherzige die Lehre Von der Wiege bis zum Grabe: Der Besiegte hat die Ehre, Den Besieger ehrt die Habe.",62,Naturalismus,Naturalismus
2129,18395,"Wille, Bruno_UNTITLED_1894","Wille, Bruno",UNTITLED,1894,"Die Sonne neigt sich abe Zum blauen Hügelgrabe. So leb denn wohl, du rotes Liebesfeuer! Ich stehe ganz allein Auf ödem Berggestein. Wohl heime möcht ich gahn Und weiß doch nicht, wo Herberg han ... Schon dräun die Wolken schwarz wie Ungeheuer.Da mahnt die Sonn im Sinken: Sieh dort die Zinnen winken! Den irren Wandrer laden sie, zu hausen. Des Burgherrn Trostlicht wacht Getreu die ganze Nacht. Entzünde dran dein Herze Als eine fromme Klausenkerze! Ums Fenstergitter laß Unholde sausen!",92,Jahrhundertwende,Naturalismus
948,41333,"Trakl, Georg_3_1900","Trakl, Georg",3,1900,"Ein altes Wiegenlied macht dich sehr bang. Am Wegrand fromm ein Weib ihr Kindlein stillt. Traumwandelnd hörst du wie ihr Bronnen quillt. Aus Apfelzweigen fällt ein Weiheklang.Und Brot und Wein sind süß von harten Mühn. Nach Früchten tastet silbern deine Hand. Die tote Rahel geht durchs Ackerland. Mit friedlicher Geberde winkt das Grün.Gesegnet auch blüht armer Mägde Schoß, Die träumend dort am alten Brunnen stehn. Einsame froh auf stillen Pfaden gehn Mit Gottes Kreaturen sündelos.",84,Jahrhundertwende,Expressionismus
356,50257,"Ball, Hugo_Die Ersten_1906","Ball, Hugo",Die Ersten,1906,"Die Ersten sinds, sie sind im besten Zug Vom willenlosen Haufen sich zu lösen. Erkennend eitel Schimmer, seichten Trug Der großen Reden abgenützte Blößen, Klangvolle Phrasen, ein vereinter Schwall Der überflutet Erdehöhen und Täler, Allüberall der gleiche Wiederhall, Der gleiche Köder und der gleiche Wähler. Wohl wächst der Massen Schrei nach Glück und Brot Doch übertönt er nicht die Worte der Vertreter, Es fallen Opfer tiefster Seelennot, Die Masse fällt dein Zeichen der Verräter. So lausch ich freudig, wenn mit wildem Schrei Die Brust erfüllt von froher Zukunft ahnen Sich einer ringt vom Heerdentaumel frei Kraftvoll empor auf selbstgewollten Bahnen.",113,Jahrhundertwende,Expressionismus
300,26270,Klabund_Winkelried_1909,Klabund,Winkelried,1909,Wie es dich zum Kampfe zieht! Und du stürmst in goldner Wehre – Wenn sie lächelnd dir ins Auge sieht: Wo ist Trotz und Dolch und Ehre? – Drückst du dir wie Winkelried Tief ins eigne Blut der Feindin Speere ...,44,Jahrhundertwende,Expressionismus
1980,8593,"Thoma, Ludwig_Die tapferen Hamburger Schutzleute und ihr glorreicher Sieg am 17. Januar 1906_1894","Thoma, Ludwig",Die tapferen Hamburger Schutzleute und ihr glorreicher Sieg am 17. Januar 1906,1894,"Ja , ihr tapfern Hanseaten , Ihr vollbrachtet Heldentaten , Und ihr wart so fürchterlich Als wie Anno siebenzich.Und ihr ließt die Fahne flattern , Schluget drauf , bis Wasserblattern Jeder hatte an der Hand , Die er um den Säbel wand.Alte Weiber , Kinder , Greise Stacht ihr auf Soldatenweise Und zwar meistenteils von hint ' , Wo sie stark verletzlich sind.Eure wackern Jahren Hat es alsobald erfahren , Daß der tapfre Hanseat Einen scharfen Säbel hat.Ihrer vier Schandarmen haben Einen kleinen Waisenknaben Treu gemeinsam so lädiert , Daß er nie mehr revoltiert.Höniger hieß ein Privater , Der auch als Familienvater Damals auf die Straße ging Und dabei fünf Hiebe fing.Reindel hieß ein Frauenswesen , Das man ohne Federlesen Durch den Hut und falschen Zopf Haute auf den Hinterkopf.Den Verleger Martoschecken Wollte einer niederstrecken , Doch er traf ihn diesmal nicht , Weil er hinters Gitter flücht'.Tischler Wittmann fand als Bayer Hierorts seine Leichenfeier , Denn ein Hieb , den man ihm gab , Rief ihn von der Erde ab.Als er sich am Boden wälzte , Kam ein Schutzmann noch und pelzte Mit den Stiefeln ihn und sprach : » Knödelbayer , gibst du nach ? « Frauen wurden weggetragen , Finger wurden abgeschlagen , Kinder schrieen blutbespritzt , Ob ein Gott im Himmel sitzt.In der Berg- und Schmiedegassen War ein starkes Aderlassen , Und das stolze Heldenschwert Traf nur den , der sich nicht wehrt.Dieses sind die Heldentaten Von den tapfren Hanseaten , Die so kampfbegierig sind Gegen Greis und Weib und Kind .",256,Jahrhundertwende,Jahrhundertwende
2830,28741,"Hartleben, Otto Erich_[Die jubelnd nie den überschäumten Becher]_1885","Hartleben, Otto Erich",[Die jubelnd nie den überschäumten Becher],1885,"Die jubelnd nie den überschäumten Becher gehoben in der heiligen Mitternacht, und denen nie ein dunkles Mädchenauge, zur Sünde lockend, sprühend zugelacht –die nie den ernsten Tand der Welt vergassen und freudig nie dem Strudel sich vertraut – o sie sind klug, sie bringens weit im Leben ... Ich kann nicht sagen,",57,Naturalismus,Naturalismus
1134,11935,"Falke, Gustav_UNTITLED_1884","Falke, Gustav",UNTITLED,1884,"Mein Kind, ich bin ein Dichter. Weißt du, was das heißt? Jedermann ist mein Richter, Sei er so dumm als dreist.Ich muss mich belächeln lassen Von jedem Krämerkommis. Was gilt dem Volk auf den Gassen Das bischen Poesie?Sie haben Goethe im Schranke Und schöne Worte im Mund, Aber ihr höchster Gedanke Ist Skat bis zur Morgenstund'.",67,Naturalismus,Jahrhundertwende
924,44907,"Heym, Georg_UNTITLED_1899","Heym, Georg",UNTITLED,1899,"Sie trampeln um den Hof im engen Kreis. Ihr Blick schweift hin und her im kahlen Raum. Er sucht nach einem Feld, nach einem Baum, Und prallt zurück von kahler Mauern Weiß.Wie in den Mühlen dreht der Rädergang, So dreht sich ihrer Schritte schwarze Spur. Und wie ein Schädel mit der Mönchstonsur, So liegt des Hofes Mitte kahl und blank.Es regnet dünn auf ihren kurzen Rock. Sie schaun betrübt die graue Wand empor, Wo kleine Fenster sind, mit Kasten vor, Wie schwarze Waben in dem Bienenstock.Man treibt sie ein, wie Schafe zu der Schur. Die grauen Rücken drängen in den Stall. Und klappernd schallt heraus der Widerhall Der Holzpantoffeln auf dem Treppenflur.",127,Jahrhundertwende,Expressionismus
2331,20003,"Müller-Jahnke, Clara_UNTITLED_1882","Müller-Jahnke, Clara",UNTITLED,1882,"Flirrend spielt der Mondenschein über dem Balkone – in den roten Capriwein preß ich die Limone.Lachend bis zur Rebenfirst schleuderst du den Becher: meiner Küsse Herbheit wirst du noch kosten, Zecher!",34,Naturalismus,Naturalismus
594,21066,"Stadler, Ernst_UNTITLED_1898","Stadler, Ernst",UNTITLED,1898,Der Korb die Schäfertasche und das Band das an dem Stab die Hirtenflöte hält das Medaillon das rund mit schmalem Rand ein graues Antlitz trägt auf weißem Feld –Die Stutzuhr flink der Pendel säumig singend drauf Stund um Stunde tändelnd nach sich hinkt des Spiegels Glas das feucht wie Wasser blinkt das Tor halb offen und im Wind der Vorhang schwingend:Ein lässig Gehen und ein lässig Kommen Gedächtnis und Erinnerung verglommen zögernder Schritte Lauf der seltsam klingt –ein Fenster das den Duft ins Zimmer trägt von Buchs und Rosen. Und der Wind bewegt den Leuchter der am blanken Estrich blinkt.,104,Jahrhundertwende,Expressionismus
17,41369,"Trakl, Georg_1_1900","Trakl, Georg",1,1900,"Mutter trug das Kindlein im weißen Mond, Im Schatten des Nußbaums, uralten Hollunders, Trunken vom Safte des Mohns, der Klage der Drossel; Und stille Neigte in Mitleid sich über jene ein bärtiges AntlitzLeise im Dunkel des Fensters; und altes Hausgerät Der Väter Lag im Verfall; Liebe und herbstliche Träumerei.Also dunkel der Tag des Jahrs, traurige Kindheit, Da der Knabe leise zu kühlen Wassern, silbernen Fischen hinabstieg, Ruh und Antlitz; Da er steinern sich vor rasende Rappen warf, In grauer Nacht sein Stern über ihn kam;Oder wenn er an der frierenden Hand der Mutter Abends über Sankt Peters herbstlichen Friedhof ging, Ein zarter Leichnam stille im Dunkel der Kammer lag Und jener die kalten Lider über ihn aufhob.Er aber war ein kleiner Vogel im kahlen Geäst, Die Glocke lang im Abendnovember, Des Vaters Stille, da er im Schlaf die dämmernde Wendeltreppe hinabstieg.",161,Jahrhundertwende,Expressionismus
2529,46634,"Löns, Hermann_Kleine Station_1890","Löns, Hermann",Kleine Station,1890,"Die Sonne brütet auf dem Straßenstaube, Im Schädel brütet die Erinnerung, Um mich die kühle Trauereschenlaube, Vom Wiesengraben tönt es: »unk, unk, unk.«Die Kellnerin entkorkt die lange Flasche, Das braune Auge potipharisch blickt, Mit schnellem Aufblick ich die Falten hasche, In die ihr Schürzchen unterm Gurt sich knickt.Kein Menschenwort dringt in den kleinen Garten, Der Wein ist alt, das Mädel rund und jung, Drei Stunden muß ich auf den Zug noch warten – Greif zu – vergiß das dumme: »unk, unk, unk.«",102,Naturalismus,Naturalismus
1727,11933,"Falke, Gustav_UNTITLED_1884","Falke, Gustav",UNTITLED,1884,"Er ward über Nacht ein berühmter Mann. Die guten Leute starren ihn an, Grüßen tief und zeigen mit Fingern: Seht den, ist keiner von den Geringern. Ein Fremder fragte nach seinen Thaten, Da wussten sie sich nur halb zu raten. Sein Name wär' Müller, gedichtet hätt' er Geniales, so schrieben es alle Blätter. Zwar hätten sie's selber noch nicht gelesen, Doch wär' es trotzdem sehr schön gewesen. So sind sie! Wird's schwarz auf weiß gesetzt, Sie plappern es nach und glauben's zuletzt. Aus eigener Meinung lassen sie selten Was Rechtes gelten.",113,Naturalismus,Jahrhundertwende
1464,39974,"Ringelnatz, Joachim_Chemnitzer Bußtag 1928_1908","Ringelnatz, Joachim",Chemnitzer Bußtag 1928,1908,"Ich aber ging zum Tambour hin, Weil ich nicht gern im Trüben bin, Und weil im Tambour Lou verkehrt Und immer vieler Männer harrt. Und dennoch ist die Lou apart Und wird von mir verehrt.Die Lou hat hoch im Hinterbein Flecken, die biß ein junger Fratz von Kollegin ihr hinein, Aus Liebe nicht, aus Hunger.Wenn ich nicht mehr in Chemnitz bin, Geht ihr einmal zum Tambour hin Und schaut nach meiner Lou! Doch wer mir diese Lou verführt, Behandle sie, wie's ihr gebührt, Und zahle zehn Mark zu.",101,Jahrhundertwende,Jahrhundertwende
970,44969,"Heym, Georg_UNTITLED_1899","Heym, Georg",UNTITLED,1899,"Sehr weit ist diese Nacht. Und Wolkenschein Zerreißet vor des Mondes Untergang. Und tausend Fenster stehn die Nacht entlang Und blinzeln mit den Lidern, rot und klein.Wie Aderwerk gehn Straßen durch die Stadt, Unzählig Menschen schwemmen aus und ein. Und ewig stumpfer Ton von stumpfem Sein Eintönig kommt heraus in Stille matt.Gebären, Tod, gewirktes Einerlei, Lallen der Wehen, langer Sterbeschrei, Im blinden Wechsel geht es dumpf vorbei.Und Schein und Feuer, Fackeln rot und Brand, Die drohn im Weiten mit gezückter Hand Und scheinen hoch von dunkler Wolkenwand.",100,Jahrhundertwende,Expressionismus
1592,8550,"Thoma, Ludwig_UNTITLED_1894","Thoma, Ludwig",UNTITLED,1894,"Muß ich als Deutscher Stellung fassen Zu diesem Krieg? Er läßt mich kühl. Ich kann nicht lieben, kann nicht hassen, Es schweigt mein hohes Pflichtgefühl.Wär' ich genauer unterrichtet, Wohin man in Berlin sich neigt, So wäre dieser Streit geschlichtet Und mir der rechte Weg gezeigt.Ich bin auch durchaus nicht imstande, Mir klar zu werden, wie es geht, Und welchem p.p. Vaterlande Der liebe Gott zur Seite steht.Er muß sich wohl sehr bald entschließen, Wen er zu Sieg und Ehre führt, Und wer in diesem Blutvergießen Sein hohes Walten dankbar spürt.So seh' ich aus der Perspektive Die Sache an mit Wissensdurst. Für einen geht es sicher schiefe, Für wen, ist mir vors erste wurst.",131,Jahrhundertwende,Jahrhundertwende
2579,36570,"Holz, Arno_11._1896","Holz, Arno",11.,1896,"Der Sonne letzter Schein Umspielt das schwanke Ried, Der Thürmer bläst sein Lied Ins Abendroth hinein.Von fernher weht ein Duft Berauschend mir ums Haar, Ein weisses Taubenpaar Durchflattert noch die Luft.Nun taucht mein Geist ins Bad Und stärkt sich im Gebet, Ein Engel Gottes geht Stillsegnend durch die Stadt.Für Jeden, der ihn sieht, Hat er im Herzen Raum: Dir gab er einen Traum, Und mir gab er dies Lied.",77,Jahrhundertwende,Naturalismus
190,26162,Klabund_21_1909,Klabund,21,1909,"Die Sanduhr rinnt. Das Licht verbrennt. Man färbt sich den Bart mit Listen. So richt ich denn mein Testament Wie alle guten Christen.Wo ist mein fester Blick? Ich bin Ein Säufer und taumle und stiere. Ich vermache mein Doppel- und Stoppelkinn Meinem Hofbarbiere.Hier dieses Herz: es zuckte und hing An allem Erlauchten und Edeln. Es mag ein fünfzehnjähriges Ding Die Fliegen sich damit wedeln.Hier diese Hand: einst Hieb und Stich Beim Becher und beim Degen - Sie mag versteint und verknöchert sich An eines Bischofs Wange legen.Mein Liebeswerkzeug sei vermacht Der lieben süßen Margot. Sie betet es an um Mitternacht Im fürchterlichsten Argot.Und meinen Haß: ich schenke ihn An jedermann und alle. Sie sollen ihn sich auf Flaschen ziehn Als Gift und grüne Galle.Mein Wappen und mein Rittertum Einem unehlichen Kinde: Es schrei meine Ehre und meinen Ruhm In alle Budiken und Winde.Gegeben Gefängnis Meung sur Loire, Verlaust, wie ein Tier hinter Stäben, Von einem, der einst ein Dichter war In diesem und jenem Leben.",182,Jahrhundertwende,Expressionismus
1022,12069,"Falke, Gustav_UNTITLED_1884","Falke, Gustav",UNTITLED,1884,"Herr Wirt , heut hab ich zwei Zehner im Sack , Dafür kann ich den König nicht kaufen , Und könnt ich ihn kaufen , zwei Zehner im Sack , Den König mit Krone und Orden und Frack , Ich lachte und ließ ihn laufen . Zwei goldene Zehner macht zwanzig Mark , Ja , zwanzig Mark , Und die , die will ich Sack , Wie köstlich das klimpert und klappert ! Zwei goldene Zehner heraus aus dem Sack , Zwei silberne Flaschen , herunter den Lack , Kein Tröpfchen werde verlappert . Zwei goldene Zehner macht zwanzig Mark , Ja , zwanzig Mark , Doch vor allem , Herr Wirt , nicht geplappert ! Denn hört es ein Dritter , zwei Zehner im Sack , Die Stadt gleich wird es durchlaufen , Der Schneider , der Schuster , zwei Zehner im Sack , Die Wirtin , die Waschfrau , o Weiberschnack , Sie kommen und zetern in Haufen : Zwei goldene Zehner macht zwanzig Mark , Ja , zwanzig Mark , Und die , die will er versaufen ! Und darum , Herr Wirt , zwei Zehner im Sack , Was rund ist , was rund ist , muß laufen , So lauf denn , mein Freund , zwei Zehner im Sack , He , tummel dich , hurtig ! zwei Zehner im Sack , Zwei » Witwen « will ich mir kaufen . Zwei goldene Zehner macht zwanzig Mark , Ja , zwanzig Mark , Und die , die will ich versaufen !",256,Naturalismus,Jahrhundertwende
2366,28901,"Scheerbart, Paul_UNTITLED_1889","Scheerbart, Paul",UNTITLED,1889,"Meine ganze Welt ist kantig, Und die Bäume sind verrückt. Sage, Wilhelm, sage, Sauhirt, Warum gehst du so gebückt?",26,Naturalismus,Naturalismus
935,21116,"Stadler, Ernst_UNTITLED_1898","Stadler, Ernst",UNTITLED,1898,"Flut, die in Nebeln steigt. Flut, die versinkt. O Glück: das große Wasser, das mein Leben überschwemmte, sinkt, ertrinkt. Schon wollen Hügel vor. Schon bricht gesänftigt aus geklärten Strudeln Fels und Land. Bald wehen Birkenwimpel über windgesträhltem Strand. O langes Dunkel. Stumme Fahrten zwischen Wolke, Nacht und Meer. Nun wird die Erde neu. Nun gibt der Himmel aller Formen zarten Umriß her. Herzlicht von Sonne, das sich noch auf gelben Wellen bäumt – Bald kommt die Stunde, wo dein Gold in grünen Frühlingsmulden schäumt – Schon tanzt im Feuerbogen, den der Morgen übern Himmel schlägt, Die Taube, die im Mund das Ölblatt der Verheißung trägt.",128,Jahrhundertwende,Expressionismus
343,44666,"Däubler, Theodor_Zur Feier_1905","Däubler, Theodor",Zur Feier,1905,"Ein Kytharöde singt zur Hochzeitsfeier: So holder Hymenäos, Argos' Sohn, Wo Töchter Attikas, vor altem Thron Der Demeter, sich wiegten nach der Leier,Erschienen Jünglinge, als kecke Freier, Poseidon lehrte sie des Schwachen Hohn: Für Seegefahr, ergriffen sie, zum Lohn, Die Mädchen und zerzausten ihre Schleier.So stolzer Hymenäos, kühner Retter, Du pfeiltest, ein Apollo, in den Troß: Die Räuber schreckten weg, wie böses Wetter.Wo goldenes Geschoß ihr Blut vergoß, Verehrt dich Attika: der Braut als Better Zu gutem Hochzeitsbund, bleib uns Genoß!",105,Jahrhundertwende,Expressionismus
