Unnamed: 0,pid,filename,poet,title,year,poem,poemlength,epoch_year,epoch_poet
2982,14490,"Lachmann, Hedwig_UNTITLED_1891","Lachmann, Hedwig",UNTITLED,1891,"Von dem Glanz, der auf dem Morgen lag, Ging mein Herz in freudigerem Schlag.Von der Wolke, die am Mittag kam, Ward er überschattet wie mit Gram.Von dem Licht, das aus dem Abend quoll, Ward er bis zu Tränen schwermutsvoll.Von dem Schimmer, der die Nacht umwand, Ward er still und selig bis zum Rand.",62,Naturalismus,Naturalismus
2906,46813,"Löns, Hermann_Das Wahrzeichen_1890","Löns, Hermann",Das Wahrzeichen,1890,"Die Sommervögel singen Jetzt über Wald und Feld, Nun heißt es Abschied nehmen, Ich fahre in die Welt.Die Rosen in dem Garten, Die blühen alle weiß, Mein Schatz hat sie begossen Mit Tränen allzuheiß.Die allzugroße Liebe Bringt allzugroße Pein, Ich wäre gern geblieben, Es sollte nicht so sein.Ums Jahr, da kehr ich wieder, Dann blühn die Rosen rot, Doch sind es lauter weiße, Mein Schatz, dann bin ich tot.",81,Naturalismus,Naturalismus
1244,45449,"Rilke, Rainer Maria_UNTITLED_1900","Rilke, Rainer Maria",UNTITLED,1900,"Noch immer schauen in den Silberplatten wie tiefe Frauenaugen die Saphire , Goldranken schlingen sich wie schlanke Tiere , die sich im Glanze ihrer Brünste gatten , und sanfte Perlen warten in dem Schatten wilder Gebilde , daß ein Schimmer ihre stillen Gesichter finde und verliere . Und das ist Mantel , Strahlenkranz und Land , und ein Bewegen geht von Rand zu Rand Jungfrauenhand sich aus dem Silbersaum . Die beiden Hände , seltsam still und braun , verkünden , daß im köstlichen Ikone die Königliche wie im Kloster wohne , die überfließen wird von jenem Sohne , von jenem Tropfen , drinnen wolkenohne die niegehofften Himmel blaun.Die Hände zeugen noch dafür ; aber das Antlitz ist wie eine Tür in warme Dämmerungen aufgegangen , in die das Lächeln von den Gnadenwangen mit seinem Lichte irrend , sich verlor . Da neigt sich tief der Zar davor und spricht : Fühltest Du nicht , wie sehr wir in Dich drangen mit allem Fühlen , Fürchten und Verlangen : wir warten auf Dein liebes Angesicht , das uns vergangen ist ; wohin vergangen ? : Er bebte tief in seinem steifen Kleid , das strahlend stand . Er wußte nicht , wie weit er schon von allem war , und ihrem Segnen wie selig nah in seiner Einsamkeit.Noch sinnt und sinnt der blasse Gossudar . Und sein Gesicht , das unterm kranken Haar schon lange tief und wie im Fortgehn war , verging , wie jenes in dem Goldovale , in seinem großen goldenen Talar .",256,Jahrhundertwende,Jahrhundertwende
2069,24077,"Henckell, Karl_Vom Rigi_1896","Henckell, Karl",Vom Rigi,1896,"Wolkenklumpen Umrollen den Rigi, Kreuchende Chaosschlangen Ringeln sich, Graue Riesenleiber Knäueln sich zu ... Ätheratmende Alpenjungfrau, Wo winkt dein schimmernder Bergesbusen? Daß ich dich grüße! Dich grüße hell Über die lieblichen Seen der Täler Mit der Freiheit zitterndem, Sehnsuchtmächtigem Sonnengruß! Jungfrau Freiheit, Himmelanglänzende, Wohin mir birgst du Dein lichtverschüttet Erhabenes Haupt? Es rasen die Nebel, Du thronst in den Wolken, Es lastet die Knechtschaft, Du träufelst Tränen ... Tief trauerverschleiert Entgegenharrst du Deinem nebelmähenden, Strahlensäenden, Morgenlichten Erlöser Helios Apollo.",95,Jahrhundertwende,Naturalismus
12,26208,Klabund_Auf ein Kaninchen_1909,Klabund,Auf ein Kaninchen,1909,"Weisse Felle, die ich streicheln durfte: Vorhang vor dem Heiligtum. Im Getön der spitzen Ohren schlurfte Eine Reisigsammlerin: der Ruhm.Sonne sass im Dschungel deiner Lende, Wiegte sich als goldne Möwe weit Auf den Meeren der gekalkten Wände, Wenn der Hund im Hellen schreit.Stäbe stürzten: aus den Katakomben Deiner Höhlung, die das Grüne barg. Deine Augen, rote Rhomben, Schliefen in der Müdigkeiten Sarg.Dich zertrat der grosse Bernhardiner, Aus dem Maule schwebte Kohl und Strunk. Als des Todes allezeit getreuer Diener Sprangst du pfeifend in die Dämmerung.",99,Jahrhundertwende,Expressionismus
833,10168,"Weissmann, Maria Luise_Ein Leichnam ist ans Land gespült_1914","Weissmann, Maria Luise",Ein Leichnam ist ans Land gespült,1914,"Ich grüßte ihn vertraut. Und seinen Namen »Tod« sprach ich brüderlich. Da hob er sich, Da fing er mich am tödlicheren Hamen, Da warf er Diesen hin, da bog er mich An das erstarrte Herz, den Schlag zu suchen, Schloß Mund auf Mund, ob er nicht Atem fand, Da hieß er mich mir rasender zu fluchen...Ich grub ihn ein, der mir der Freund gewesen, Das liebste Du ward Feind: der Teure trug Sich Jenem an, von dem ich fast genesen; Er stand beim Tod. O, Stärke, die mich schlug!",111,Expressionismus,Expressionismus
732,16705,"Engelke, Gerrit_UNTITLED_1917","Engelke, Gerrit",UNTITLED,1917,"Ich bin Soldat und steh im Feld Und weiß von niemand in der Welt. Drum kann ich diesen Regentag nicht feiern, So kummerzärtlich, feucht und bleiern, Da mir dein Bild zur Nacht den Schlaf zerschlug Und mich in deine Nähe trug.Ich bin Soldat und steh im Feld, Gewehr im Arm, und fern der Welt. Wär ich zu Haus, ich schlösse Tür und Scheiben Und wollte lange einsam bleiben; Im Sofawinkel sitzend mich versenken, Geschlossnen Auges deiner denken.Ich bin Soldat im trüben Feld. Hier endet alte Menschenwelt. Der Regen singt, die nassen Strähnen fließen. Ich kann nichts tun – nur Blei verschießen. Weiß nicht warum, tu's doch als ob ich's muß: Ins graue Wetter kracht ein Schuß!",136,Expressionismus,Expressionismus
1562,39809,"Ringelnatz, Joachim_UNTITLED_1908","Ringelnatz, Joachim",UNTITLED,1908,"Wenn ich die Gesichter rings studiere, Frage ich mich oft verzagt: Wieviel Menschen gibt's und wieviel Tiefe? – Und dann hab' ich – unter uns gesagt – Äußerst dumm gefragt.Denn die Frage interessiert doch bloß Länderweis statistische Büros, Und auch diese würden sich sehr quälen, Um zum Beispiel Läuse nachzuzählen.Dummer Mensch spricht oft vom dummen Vieh, Doch zum Glück versteht das Vieh ihn nie. In dem neuen Korridor von Polen Gaben sich zwei Pferde einen Kuß, Und die Folge war ein dünnes Fohlen, Welches stundenlang Immer anders, als man dachte, sprang.Wenn es auch in Polen Sehr viel Läuse gibt, – – Aber wer ein solches Fohlen Sieht und dann nicht liebt, Bleibe mir gestohlen.",130,Jahrhundertwende,Jahrhundertwende
1124,45638,"Rilke, Rainer Maria_Die Sonnenuhr_1900","Rilke, Rainer Maria",Die Sonnenuhr,1900,"Selten reicht ein Schauer feuchter Fäule aus dem Gartenschatten, wo einander Tropfen fallen hören und ein Wander- vogel lautet, zu der Säule, die in Majoran und Koriander steht und Sommerstunden zeigt;nur sobald die Dame (der ein Diener nachfolgt) in dem hellen Florentiner über ihren Rand sich neigt, wird sie schattig und verschweigt –.Oder wenn ein sommerlicher Regen aufkommt aus dem wogenden Bewegen hoher Kronen, hat sie eine Pause; denn sie weiß die Zeit nicht auszudrücken, die dann in den Frucht- und Blumenstücken plötzlich glüht im weißen Gartenhause.",99,Jahrhundertwende,Jahrhundertwende
772,39018,"Sack, Gustav_Der Stein_1900","Sack, Gustav",Der Stein,1900,"So bist du mir das Symbolum der Welt, ein Zwitter frostiger Erhabenheit und zynisch schweigender Gleichgültigkeit; gefährlich nahe schon dem Nichts gesellthast du dich auf den höchsten Stolz gestellt und hebst dich herrisch aus dem Strom der Zeit und über des Geschehns Formlosigkeit bleibst du der Einzige, der Form behält.Oh kalten Gleichmuts lautberedter Hohn, des Unbegreifbarn greifbare Erscheinung hast du gepreßt in einen Klumpen Tonund – nur ein Ding, ein Nichts in unsrer Meinung stehst du auf deiner Weisheit kahlem Thron als dieser Welt sarkastischste Verneinung.",92,Jahrhundertwende,Expressionismus
2400,24014,"Henckell, Karl_UNTITLED_1896","Henckell, Karl",UNTITLED,1896,"Ich bin kein Minister, Ich bin kein König, Ich bin kein Priester, Ich bin kein Held; Mir ist kein Orden, Mir ist kein Titel Verliehen worden Und auch kein Geld.Dich will ich kriegen, Du harter Plocken, Die Splitter fliegen, Der Sand stäubt auf – »Du armer Flegel«, Mein Vater brummte, »Nimm meinen Schlägel!« Und starb darauf.Heut hab ich Armer Noch nichts gegessen, Der Allerbarmer Hat nichts gesandt; Von goldnem Weine Hab ich geträumet Und klopfe Steine Fürs Vaterland.",96,Jahrhundertwende,Naturalismus
1864,12038,"Falke, Gustav_UNTITLED_1884","Falke, Gustav",UNTITLED,1884,"Ich ging im Feld. Die Drossel schlug. Ein lindes weiches Wehen trug Von einem wilden Apfelbaum Ein Blütenblatt, einen Frühlingsflaum. Da kam aus Osten, hügelab, Trug keinen Hut und keinen Stab Und führte keinen Ranzen mit, Der Tag im leichten Wanderschritt.Auf seine helle Stirne fiel Ein frei Gelock, des Windes Spiel. Kein Kleid umgab der Glieder Pracht, Nackt schritt er, wie ihn Gott erdacht. Nur eine Sonnenblume hielt Er in der Linken. Hochgestielt, Der goldne Sternkelch scheitelnah Ihm schwankend über die Schulter sah.So ging er strahlend gradeaus, Und über ihm zog mit Gebraus Ein Schwarm von weißen Schwänen mit. Er wuchs, wie er das Feld durchschritt, Und stand zuletzt am Horizont, Ein Riese, flammend übersonnt. Um ihn, wie lichte Wölkchen sahn Die Vögel aus, Schwan neben Schwan. Und aus dem weißen Glitzermeer Grüßte die gelbe Blume her.",162,Naturalismus,Jahrhundertwende
2583,23850,"Henckell, Karl_Meiner Mutter_1896","Henckell, Karl",Meiner Mutter,1896,"Mutter, aus der Ferne eilst du, Deinen Sohn zu sehen, Ach, die kranke Seele heilst du, Linderst ihre Wehen.Bin zermartert, bin zerschlagen Wie im Sturm die Eiche, Doch bei dir vergeht mein Klagen, Gute, Milde, Weiche.Wer der Zeit Meduse schaute Schon mit jungen Jahren, Wem's in Höllenschlünden graute, Früh hinabgefahren:Laßt ihn in die treuen Augen Seiner Mutter blicken, Reine Wonne wird er saugen Und sich tief erquicken.",84,Jahrhundertwende,Naturalismus
808,26103,Klabund_O gieb_1909,Klabund,O gieb,1909,"O gieb mir deine Hände, Der Frühling brennt im Hag, Verschwende dich, verschwende Diesen Tag.Ich liege dir im Schoße Und suche deinen Blick. Er wirft gedämpft den Himmel, Der Himmel dich zurück.O glutend über Borden Verrinnt ihr ohne Ruh: Du bist Himmel geworden, Der Himmel wurde du.",55,Jahrhundertwende,Expressionismus
1483,40022,"Ringelnatz, Joachim_Wer hat gewonnen?_1908","Ringelnatz, Joachim",Wer hat gewonnen?,1908,"Weil du berühmt bist und mir Wahrheit sagst, Zerschlag ich dir ein Stück von deinen Zähnen. Nun du mich meidest und sogar verklagst, Bitt ich dich um Verzeihung unter Tränen.Du lächelst siegreich, läßt mich also leiden. – – Ich werde reich und gut. Du wirst senil. Ich frech. – Und wir versöhnen uns und meiden Und plagen uns im wechselschroffen Spiel.Doch immer ruhiger und mehr besonnen Legt sich der Kampf. Die Wahrheit steht. Es fragt Jeder von uns und jeder neu verzagt: »Wer hat gewonnen?!«",100,Jahrhundertwende,Jahrhundertwende
2489,14498,"Lachmann, Hedwig_UNTITLED_1891","Lachmann, Hedwig",UNTITLED,1891,"Lenzwärme streift um Niederung und Hänge, Der Früh- und Abendwind weht ohne Strenge, Was sich an Leben regt, entstrebt dem Zwang; Die Sonne flimmert auf Gebüsch und Hecken Und lässt nicht nach, zu wirken und zu wecken, Bis alles Knospendasein sich entrang.In Kraft und Fülle will es sich ergiessen – Nehmt hin, nehmt hin, ihr könnt euch nicht verschliessen, In euren eignen Herzen schwillt die Saat; Sie werden wie die Äcker stehn in Garben, Gebt auch den Brüdern, dass sie nicht mehr darben, Lenzlust und Frühlingsglaube werde Tat.Denn unfruchtbare Elemente fahren Vernichtend über das Gewächs von Jahren Und tilgen alle Frucht bis auf den Keim; Die Ungezählten stranden auf den Schiffen Und scheitern in den Wellen, an den Riffen Und fallen Rach- und Mordbegier anheim.Die Erde beut, der Strom reisst es von hinnen: Wir säen aus, wir planen, wir beginnen, So wie das Frühlingswetter braust und gärt – Die ungezähmten Erdenkräfte schaffen Und streuen aus – wir wollen nichts erraffen, Als was der Mensch dem Menschen gern gewährt.",190,Naturalismus,Naturalismus
1457,44049,"Lautensack, Heinrich_Zeugung_1900","Lautensack, Heinrich",Zeugung,1900,"Wieder fesselt mich dein Bild, Mutter meines jungen Weibes, an der Frühfrucht deines Leibes blieb ich seltsam ungestillt.Komm, mit deinen Frauenhänden: kniend küßt du meinen Schoß, kniend löst du meiner Lenden unterbundne Wünsche los, du, mit deinen Frauenhänden. – – – – – – – – – – – – – – – – – –Leben, das aus Leben drängt, Säfte, Kräfte, ohne Ende: sieh, nun sind dir deine Hände lebenswundervoll besprengt.Leben, das das Leben sucht, heiße Blüten, weiße Brände: bald, bald tragen deine Hände Frucht ...",106,Jahrhundertwende,Jahrhundertwende
1809,39819,"Ringelnatz, Joachim_Landflucht_1908","Ringelnatz, Joachim",Landflucht,1908,"Fort vom Lande, aus dem engen Städtchen in die Großstadt flieht der Geist, Wo im Kampf der Mengen Er zerreißt. Dort, wo Puls und Uhr Schneller ticken, Wird er sich zusammenflicken, Wenn er's erst versteht, Daß die unbezwingliche Natur Auch auf Radiowellen, Schienenspur Und Propellerschwingen weitergeht.Wenn ihm das gelingt, Wenn er nicht darüber ganz verkommt, Wenn ihm die Erkenntnis frommt, Daß die Nachtigall genau so singt Wie ein Spatz Am Alexanderplatz, – – – Ja, dann wird ihn wohl von Zeit zu Zeit Eine Sehnsucht wieder landwärts tragen In die Enge, in die Einsamkeit. – – Bis die simplen, friedlichen, gesunden Bauern ihn nach Tagen Oder Stunden Wiederum verjagen; In die große Stadt zurück. Und dort wird er sagen: Nur im Ruhelosen ruht das Glück.",147,Jahrhundertwende,Jahrhundertwende
696,39048,"Sack, Gustav_Frühlingsmorgen_1900","Sack, Gustav",Frühlingsmorgen,1900,"Von diesen frühlingskitschigen Vergnügen mag mir der reine Himmel nur genügen – wie liegt er keusch und ewig unbewegt, der mich aus dieser geilen Zeugungskraft hoch in die quellenfrische Kühle rafft und meine Sehnsucht in die Berge trägt!",40,Jahrhundertwende,Expressionismus
757,41346,"Trakl, Georg_Nähe des Todes_1900","Trakl, Georg",Nähe des Todes,1900,"O der Abend, der in die finsteren Dörfer der Kindheit geht. Der Weiher unter den Weiden Füllt sich mit den verpesteten Seufzern der Schwermut.O der Wald, der leise die braunen Augen senkt, Da aus des Einsamen knöchernen Händen Der Purpur seiner verzückten Tage hinsinkt.O die Nähe des Todes. Laß uns beten. In dieser Nacht lösen auf lauen Kissen Vergilbt von Weihrauch sich der Liebenden schmächtige Glieder.",73,Jahrhundertwende,Expressionismus
407,12736,"Lichtenstein, Alfred_Der Traurige_1911","Lichtenstein, Alfred",Der Traurige,1911,"Nein, dies Leben faß ich nicht mehr an. Mag man mich für närrisch halten – Heute geh ich nicht ins Gasthaus. Müde bin ich längst der Kellnerkerle, Die uns mit blasierten Fratzen, Höhnisch, schwarze Biere bringen Und uns ganz verworren machen, Daß wir nicht nach Hause finden Und die törichten Laternen Mit den schwachen Händen stützen Müssen. Heute hab ich größre Dinge vor – Ach, ich will den Sinn des Daseins suchen.Und am Abend werd ich etwas Rollschuh laufen Oder mal in einen Judentempel gehn.",95,Expressionismus,Expressionismus
773,44963,"Heym, Georg_UNTITLED_1899","Heym, Georg",UNTITLED,1899,"Die Finsternis raschelt wie ein Gewand, Die Bäume torkeln am Himmelsrand.Rette dich in das Herz der Nacht, Grabe dich schnell in das Dunkele ein, Wie in Waben. Mache dich klein, Steige aus deinem Bette.Etwas will über die Brücken, Es scharret mit Hufen krumm, Die Sterne erschraken so weiß.Und der Mond wie ein Greis Watschelt oben herum Mit dem höckrigen Rücken.",68,Jahrhundertwende,Expressionismus
1373,7953,"Dehmel, Richard Fedor Leopold_Der Reim_1891","Dehmel, Richard Fedor Leopold",Der Reim,1891,"Wir sollen Herz und Schmerz nicht reimen, und Glück und Blick macht daß aus der Liebe Triebe keimen, will nicht in euern Kopf hinein.Ich will's euch weiter nicht verwehren und laß euch gern, verehrte Herr'n, die Schalen schält ihr nur recht heraus den – Kern.",53,Naturalismus,Jahrhundertwende
2048,69055,"Holz, Arno_UNTITLED_1898","Holz, Arno",UNTITLED,1898,"Mich schuf Korinth, ich sah das Meer.Tausend Jahre unter Schutt und Tempeltrümmern lag ich in schwarzer Erde.Zwischen roten Disteln im Abendschein weideten Ziegen, über mein blühendes Grab bliesen Hirten.Tausend Jahre war ich tot.Heut scheint die Sonne, der Himmel lacht, ich lebe!Im alten Park steh ich nackt aus weissem Marmor.Auf meine Schultern durch gezacktes Laub fallen zitternde Tupfen.Meine Augen, weit geöffnet, starren auf ein grünes Wasser.In breiten, überhängenden Kastanienblättern spiegelt sich und zuckt sein Licht.",84,Jahrhundertwende,Naturalismus
2360,36588,"Holz, Arno_29._1896","Holz, Arno",29.,1896,"Nein, nein! Im Ernst, mein Herz! Dein Marquis Posa Hat bitter unrecht. Dieses Leben ist Durchaus nicht schön. Denn Stunden schickt es dir auf deinen Hals, In denen du dich wüthend drüber ärgerst, Dass Con-Fu-Tse, der Bhudda der Chinesen, Kein Droschkenkutscherssohn aus Zwickau war. Auch will es dir durchaus nicht in den Kopf, Dass die Pastoren weisse Bäffchen tragen. Warum nicht pfeffer- oder ferkelfarbne? Pflanz dir dies Eine zolltief in den Schädel Und lass ihm Zeit, zu wachsen, und ich wette, Dein ganzer Kerl platzt prasselnd wie ein Frosch, Den man zum Schluss auf einem Jahrmarkt abbrennt, In fünfmalhunderttausend kleine Stücke. Dann bist du futsch, und deinem Publikum, Das sein Entree nur ungern gratis zahlt, Bleibt nichts als eine Nase voll Gestank. Zuletzt verpufft auch der, die Bande brüllt, Schimpft, pfeift, krakehlt und prügelt sich Und johlt dann schliesslich knüppeldick besoffen Durch Vollmondschein und Fliederduft nach Hause. Dort liegt das dann wie ein gestochnes Kalb Idyllisch da in seinem Himmelbett Und schnarcht gemüthlich sich die Sterne runter. Nein, nein! Es ist nur Eins: entsetzlich albern. Nichts weiter.",212,Jahrhundertwende,Naturalismus
2802,72527,"Holz, Arno_UNTITLED_1899","Holz, Arno",UNTITLED,1899,"Das kleine Jöhr in mir, das nach jedem Sonnenstrahl greift und nach jedem Schmetterling, das Vergissmeinnichtaugen hat und das mir vor meinem Tode hoffentlich nicht sterben wird, entzückt sich noch immer über Ludwig Richter.Der Grosspapa liebt Walter Scott.Mein Schläfchen, sonntags, wenn es zu Mittag Nelson-Cotteletts, Karpfen in Bier, oder vielleicht gar eine Gans gegeben, erledige ich auf einem blauen, grüngestreiften Biedermannssopha,",71,Jahrhundertwende,Naturalismus
2923,12505,"Wedekind, Frank_Der Prügelheini_1891","Wedekind, Frank",Der Prügelheini,1891,"Der Prügelheini, der ist mein Mann, Der ist eine Menschenplage; Der prügelt, was er mich prügeln kann, Die Nächte sowie die Tage.Heut mittag stürzt er noch auf mich los: »Du bist mir untreu gewesen! Das steht in Buchstaben riesengroß Auf deiner Stirne zu lesen!« –»Bei Gott, mein Heini, dir blieb ich treu! Sonst steht mir nichts auf der Stirne.« – Da schwang er seinen Prügel aufs neu: »Dich schlag ich nieder, du Dirne!« –Und als ich ihm zitternd zu Füßen sank, Ich ärmste von allen Frauen, Da warf er mich hin auf die Gartenbank Und hat mich zusammengehauen.",122,Naturalismus,Naturalismus
2221,70380,"Holz, Arno_UNTITLED_1886","Holz, Arno",UNTITLED,1886,"Und grau in grau verschwimmt die Luft , Und um den Herd und um sein Feuer Webt Winterduft.Das ist die Zeit , wo sich die Seele Stilleinsam auf sich selbst besinnt Und wie im Lenz einst Philomele Auf Lieder sinnt.Doch draußen , welch ein grauses Wetter Durchrast gespensterhaft die Nacht ? Mir däucht , so klingt das Horngeschmetter Der wilden Jagd ! Der Regen spielt in blauen Flammen , Es lacht dein Mund.Aus Ost und Westen , Süd und Norden , Von Steinen , Blumen und Gethier , Warum und wie sie so geworden , Erzählst du mir : Und was einst vor so manchem Jährchen Die Welt erlebt in Lust und Leid , Und wenn ich bitte , auch ein Märchen Aus alter Zeit.Wie Siegfried einst die Maid Brunhilde Durch seinen Kuß vom Schlaf erweckt , Und wie sich hinter diesem Bilde Ein Sinn versteckt.Drum laß den Tod nur draußen dräuen , Wir zwei sind gegen ihn gefeit ; Das Leben wird sich schon erneuen Zu seiner Zeit.Und grau in grau verschwimmt die Luft , Und um den Herd und um sein Feuer Webt Winterduft.Das ist die Zeit , wo sich die Seele Stilleinsam auf sich selbst besinnt Und wie im Lenz einst Philomele Auf Lieder sinnt.Doch draußen , welch ein grauses Wetter Durchrast gespensterhaft die Nacht ? Mir däucht , so klingt das Horngeschmetter Der wilden Jagd ! Der Regen peitscht in jähem Grimme Ans Fenster , daß der Laden wankt , Und durch die Luft heult eine Stimme Und ächzt und bangt .",256,Naturalismus,Naturalismus
2266,36795,"Holz, Arno_UNTITLED_1896","Holz, Arno",UNTITLED,1896,All dein Glantz der jungen Jahre/ deine mehr alß göldnen Hahre/ haben mich mit Hertz und Hand dir zugewandt!auch stekkt in dem belihbten Kinn ein Grübgen drin.Deine recht saffirnen Blikke fässeln gleichsahm mich wie Strikke/ für allem aber nimbt mich ein dein Freundlig-seyn.Deine süssen Worte lallen/ alß ob Rohsen-Blätter fallen; zu deinen Knieen reissts mich hin/ du Zäuberin!Laß mich nicht wie laß mich dich nicht blohß bedrachten; nichts Schönres gibt es/ alß zu Zweyn vergnügt zu seyn!Alle Engel hört man lachen/ wenn zwei Lihbste Hochzeit machen. Drümb/ du Auszug aller Zihr/ gelihbt es dir?,104,Jahrhundertwende,Naturalismus
172,44683,"Däubler, Theodor_Die Göttin der Gestirne_1905","Däubler, Theodor",Die Göttin der Gestirne,1905,"Wir müssen, als Mond, zu der Sternen-Vertrauten, – Uns funkelnde Göttin – den Aufschwung beflügeln, Gehimmelter Weltwunsch entwand sich aus Zügeln, Die blitzlich in schlingernde Schiefen zerblauten.Erblick du dich, Schmachter, bei Perlen und Rauten! Wenn bändernde Bäche den Heimschlich erklügeln, Entgeister, mit gleißendem Mondglanz, den Hügeln – Wohl Mündungen zu – wo sich Sehnsuchten stauten!Wir müssen, als Mond, zu der Sternengeliebten, Die Urbrunst zur kommenden Sonne beschwichtigt: So spür, wie ihr kränkelnde Möndchen entstiebten!Wenn bloß uns ein Herz junge Weisung berichtigt, So schweift mich Beruf durch die sternsteilen Bauten, Wo ernst wir die Braut, vor den Müttern, erschauten!",123,Jahrhundertwende,Expressionismus
2862,19930,"Müller-Jahnke, Clara_1._1882","Müller-Jahnke, Clara",1.,1882,"Ich fliege mit euch, ihr Winde, weit in die Welt hinaus bis unter die grüne Linde vor meines Vaters Haus.Ich eile durch Himmelshallen euch, wandernde Wolken, nach und höre die Tropfen fallen auf meines Vaters Dach.Heimkehrend von langer Reise, voll Sehnsucht für und für, klopfe ich bang und leise an meines Vaters Tür.Mir ist, als müßte von innen ertönen ein traut »Herein« – als blühte noch immer da drinnen die liebe Heimat mein!Als träte mir grüßend entgegen manch lächelnde Gestalt, die lang schon auf den Wegen des ewigen Friedens wallt, –als dürfte ich wieder lauschen dem Knistern des Feuerherds – und die Regentropfen rauschen eintönig niederwärts.Der Sturm singt vor den Toren, die See grollt dumpf und schwer, meine Heimat ist verloren, ich finde sie nimmermehr . . .",144,Naturalismus,Naturalismus
2302,70440,"Holz, Arno_UNTITLED_1886","Holz, Arno",UNTITLED,1886,"Ist doch der Quark von all den Versverbrechern, Die heut mit selbstgefälligem Behagen Das Tretrad schwingen und das Tamtam schlagen!Nur du schwingst nicht das Weihrauchfaß der Mode Und beugst vor deinem Publikum das Knie, Du weihst dich als begeisterter Rhapsode Dem Hohenpriesterdienst der Poesie!Die Zeit ist eisern, eisern ihr Beruf, O, daß sie endlich ihres Sohns gedächte, Des Sohns, der ihr die „Weihgesänge“ schuf, Sie und des Orients wundervolle „Nächte“!Seit mir die Muse lächelnd zugenickt, Hab ich mit Staunen zu dir aufgeblickt Und winde dir nun in dein Kranzgeflecht: „Ich danke dir!“",115,Naturalismus,Naturalismus
693,12767,"Lichtenstein, Alfred_Nebel_1913","Lichtenstein, Alfred",Nebel,1913,"Ein Nebel hat die Welt so weich zerstört. Blutlose Bäume lösen sich in Rauch. Und Schatten schweben, wo man Schreie hört. Brennende Biester schwinden hin wie Hauch.Gefangne Fliegen sind die Gaslaternen. Und jede flackert, daß sie noch entrinne. Doch seitlich lauert glimmend hoch in Fernen Der giftge Mond, die fette Nebelspinne.Wir aber, die, verrucht, zum Tode taugen, Zerschreiten knirschend diese wüste Pracht. Und stechen stumm die weißen Elendsaugen Wie Spieße in die aufgeschwollne Nacht.",88,Expressionismus,Expressionismus
2791,36662,"Holz, Arno_Einstweilen!_1896","Holz, Arno",Einstweilen!,1896,"Die alte Welt ist ein altes Haus Und furchtbar ungemüthlich, Der Nordwind pustet die Lichter aus – Ich wollte, wir lägen mehr südlich!Ich wollte .... Puh Teufel, wie das zieht! Der Hagel prallt an die Scheiben, Drum singt nur einstweilen das tröstliche Lied: Es kann ja nicht immer so bleiben!",60,Jahrhundertwende,Naturalismus
787,26101,Klabund_Der Springbrunn_1909,Klabund,Der Springbrunn,1909,"Im Stadtpark wird der Springbrunn angedreht. Der Strahl schießt auf, tönt, steigt und steht Für einen Augenblick, Gehalten von der Sonnenfaust. Und wie der Strahl dann in die Tiefe saust: Wasser stieg auf, Glanz fällt zurück.",44,Jahrhundertwende,Expressionismus
834,39002,"Sack, Gustav_Das Moor_1900","Sack, Gustav",Das Moor,1900,"Oh du Geliebte, wenn ich je gedächte, dich einem Erdendinge zu vergleichen, so wählte ich den Berg unzähliger Leichen, so wählte ich das Moor und seine Nächte.Du schmutziger Knäuel bodenloser Schächte verborgen unter sammetseidenweichen und tief türkisenblaun Nymphäenteichen – daß dich dein eigener Gestank umbrächte!Denn arg hast du mein Tölpelherz verführt mit deiner glatten Haut Melancholie und deinem gramdurchtränkten Liebesschwureund mitternachts mir einen Trank gerührt aus Kot, Gestank und Teufelspoesie – vergib mir! – oh vergib mir, große Hure!",89,Jahrhundertwende,Expressionismus
