pid,filename,poet,title,year,poem,poemlength,epoch_year,epoch_poet
21072,"Stadler, Ernst_UNTITLED_1898","Stadler, Ernst",UNTITLED,1898,"Doch einmal – weiß ich – reißt 's mich fort , Eh ' meiner Jugend letzte Blüte fiel , Aus dumpfer Städte eklem Hüttenqualm Hinauf zu jenem lichten Zauberland , Das früh der Sehnsucht Finger mir gewiesen.Ein plumper Nachen schwimmt auf schwarzer Flut , Gleichförmig klatscht der Ruder schwerer Takt . Jetzt schürft der Sand , hart fliegt der Kahn an 's Ufer , ihren Leib , Schweigend und grau . Kein leiser Windhauch wellt sie auf Zu kosendem Gebuhl Wie an des Südens schmeichelnden Gestaden Kein Vogel flattert singend drüber hin : Ruhe ist alles – Einsamkeit und – Tod.Und langsam schreit ' ich so bergan . Und immer höher , Bis zur höchsten Kuppe : Da halt ' ich Rast.Fels und Geröll ringsher Und weite , weite Felder , Drauf ew'ger Winter weiße Aussaat hält . Unten tief Das Meer , In das die Sonne Purpurnes Blut aus glühenden Wunden tropft ... Und schweigend seh ' ich in der Nordlandsnacht Leuchtendes Wachen , Und meines Lebens ferne Sage Klingt mir wie süßer Glockenklang herauf Ganz leise , leise , Vom Golde der Vergangenheit durchquollen.Ewigkeitsschauern schwebt herab , Brennende Wunden schließen sich , es ebbt Der Strom der Leidenschaft , Und meines Herzens Bitternis Verklärt sich still zu reifem Manneslächeln Vor dieser Sonne mit dem Feuerblick.Und so , mein Aug ' in ihren Glanz getaucht , Zu stummer , brünstig-heißer Andacht Gleit ' ich hinab In sonnenblutdurchströmte Nordlandsfluten , Die flüsternd leis , gleich einem kranken Kind , Zu ew'gem Schlummer mich hinüber träumen ...",256,Jahrhundertwende,Expressionismus
28823,"Hartleben, Otto Erich_1_1888","Hartleben, Otto Erich",1,1888,"In das Land der Moabiter zogen Elimelech und sein Weib Naemi und mit ihnen ihre beiden Söhne . Eine Theurung , die der Herr gesendet , trieb sie aus dem Lande ihrer Väter.Doch in fremdem Boden kein Gedeihen fand der Stamm , aus Judas Grund gerissen , und es sank zu Grabe Elimelech und es starben seine beiden Söhne . Einsam blieb die Mutter , und es thu der Herr an euch das Gute , das ihr thatet mir und meinen Toten . Kann euch fürder Kinder nicht gebären , die euch wieder Männer werden möchten.Kehret um , o ihr geliebten Töchter ! Euer Jammer frisst an meinem Herzen : denn des Herren Hand hat mich geschlagen , und des Herren Hand hat euch getroffen ! Laut erhoben jene ihre Klagen , Arpa küsste sie und wandte weinend drauf sich um zu ihrem Gott und Volke . Ruth blieb bei ihr und Naemi sagte : Siehe , Ruth ! So thu auch du , wie jene , gehe nun und lass mich weiter wandern ! Rede mir von gehen nicht noch lassen ! Wo du hingehst , will ich auch hingehen , wo du bleibst , da werd ich bei dir bleiben . Dein Volk ist das meine nun geworden , dein Gott soll auch mein Gott fürder heissen . Wo du stirbst , da werd auch ich begraben , und der Herr , der unser Leben leitet , möge dies und jenes mir verhängen – doch der Tod muss kommen , uns zu scheiden !",256,Naturalismus,Naturalismus
20018,"Müller-Jahnke, Clara_UNTITLED_1882","Müller-Jahnke, Clara",UNTITLED,1882,"Nun fällt der tollen Narrenwelt das bunte Kleid in Lumpen , – und klirrend auf den Estrich schellt der Freude voller Humpen . Lautkrachend springt ins Schloß das Tor , kein Lichtschein mehr am Fenster – ein grauer Morgen kriecht empor , der Morgen der Gespenster.Da ist im tiefen Straßenstaub ein stolzes Weib gestanden – von ihrem Odem rauscht das Laub , des Meeres , was blüht und weint und lacht – mein ist die ganze Erde ! Was bimmelt ihr vom Kirchenturm und predigt Reu und Buße ? Ihr seid das Sandkorn vor dem Sturm , der Staub mir unterm Fuße . Was schiert mich eurer Sünde Scham und eurer Hölle Flammen ? Ich blas den ganzen Maskenkram mit einem Hauch zusammen.Mir gilt die Dirne unterm Tor , das Hündlein in der Gossen mehr als der schönste Damenflor in euren Staatskarossen . Und Blumen und Konfettischlacht ? Wie jäh verstummt die Harfe , versprüht der Witz , verblaßt die Pracht , löst meine Hand die Larve.Mir gilt des Bettlers hohle Hand und gramzerfressne Miene mehr als der Fürstenhöfe Tand und blutige Hermeline . – Und tobt im Ost der Schwertertanz , und saust das Blei , das rasche – auf aller Kronen Faschingsglanz streu ich die Handvoll Asche ! Ob Kirchen- oder Festungssturm , sie wanken beid auf Erden und werden einst vom Wirbelsturm zu Staub zerblasen werden . Und reißt der letzten Narretei der bunte Rock in Fetzen , dann soll die Menschheit , nackt und frei , sich an die Tafel setzen .",256,Naturalismus,Naturalismus
10165,"Weissmann, Maria Luise_Robinson tanzt_1914","Weissmann, Maria Luise",Robinson tanzt,1914,"Heut aber grüß ich dich, o Gott, im Brand Des frühen Morgens, da ich mich befreit Aufschwang im Tanz wie eine Welt, verwandt Dir Gleichgewicht; da, ein vermorschtes Kleid, Hinsanken Trauer, Lust. Nichts war, das blieb Aus dem gebundnen Sein; wie fiel Gewicht Von Arm und Fuß: ein leerer Raum, so trieb Ich hin im Raum, ins Leere, es durchbricht Mich Luft, mich Licht, mich ungeheurer Glanz, In den ich barst, Gott; bin ich, bin ich nicht?!",100,Expressionismus,Expressionismus
50227,"Morgenstern, Christian_UNTITLED_1892","Morgenstern, Christian",UNTITLED,1892,"Wir müssen immer wieder uns begegnen und immer wieder durch einander leiden, bis eines Tages wir das alles segnen.An diesem Tage wird das Leiden weichen, das Leiden wenigstens, das Blindheit zeugte, das uns wie blinden Wald im Sturme beugte.Dann werden wir in neues Ziel und Leben wie Flüsse in ein Meer zusammenfließen, und kein Getrenntsein wird uns mehr verdrießen.Dann endlich wird das » ... suchet nicht das Ihre« Wahrheit geworden sein in unsern Seelen. Und wie an Kraft wird's uns an Glück nicht fehlen.",93,Jahrhundertwende,Jahrhundertwende
7990,"Dehmel, Richard Fedor Leopold_UNTITLED_1891","Dehmel, Richard Fedor Leopold",UNTITLED,1891,"Ueber unsre Liebe hängt eine tiefe Trauerweide. Nacht und Schatten um uns beide; unsre Stirnen sind gesenkt.Wortlos sitzen wir im Dunkeln; einstmals rauschte hier ein Strom, einstmals sahn wir Sterne funkeln ...Ist denn Alles tot und trübe? – Horch: ein ferner Mund! vom Dom!",53,Naturalismus,Jahrhundertwende
39995,"Ringelnatz, Joachim_Zu dir_1908","Ringelnatz, Joachim",Zu dir,1908,"Sie sprangen aus rasender Eisenbahn Und haben sich gar nicht weh getan.Sie wanderten über Geleise, Und wenn ein Zug sie überfuhr, Dann knirschte nichts. Sie lachten nur. Und weiter ging die Reise.Sie schritten durch eine steinerne Wand, Durch Stacheldrähte und Wüstenbrand, Durch Grenzverbote und Schranken Und durch ein vorgehaltnes Gewehr, Durchzogen viele Meilen Meer. –Ihr Kurs ging durch, ging nie vorbei. Und als sie dich erreichten, Da zitterten sie und erbleichten Und fühlten sich doch unsagbar frei.",89,Jahrhundertwende,Jahrhundertwende
41402,"Trakl, Georg_In Venedig_1900","Trakl, Georg",In Venedig,1900,"Stille in nächtigem Zimmer. Silbern flackert der Leuchter Vor dem singenden Odem Des Einsamen; Zaubrisches Rosengewölk.Schwärzlicher Fliegenschwarm Verdunkelt den steinernen Raum Und es starrt von der Qual Des goldenen Tags das Haupt Des Heimatlosen.Reglos nachtet das Meer. Stern und schwärzliche Fahrt Entschwand am Kanal. Kind, dein kränkliches Lächeln Folgte mir leise im Schlaf.",59,Jahrhundertwende,Expressionismus
10215,"Weissmann, Maria Luise_Dann, wenn du gehst..._1914","Weissmann, Maria Luise","Dann, wenn du gehst...",1914,"Dann, wenn Du gehst, scheinst Du mir nie gewesen. Ich finde mich, wie der vom Traum erwacht, Versehnt nach einer nächsten tiefern Nacht, Zur alten Lüge lächelnd zu genesen.Dann, wenn Du kommst, weiß ich mich nicht erhalten Je ohne Dich, Du Herz der toten Welt: Du Brand, vor dessen Glut mich das Erkalten, Dem ich entrann, erinnernd überfällt –So schwank ich, willig immer zu verlachen Der frühern Stunde Armut; find ich mich Zwischen Phantomen taumelnd; in den RachenGleit ich der Zeit, unwissend: liebt ich Dich Eben im Traum, eben im Traum-Erwachen? Dies nur: ich tats, blieb unabänderlich.",120,Expressionismus,Expressionismus
12742,"Lichtenstein, Alfred_Ärgerliches Mädchen_1913","Lichtenstein, Alfred",Ärgerliches Mädchen,1913,"Es ist schon spät . Ich muß verdienen . Aber die gehn heute alle vorbei mit blasierten Mienen . Nicht einen Glücksgroschen wolln sie mir geben . Es ist ein jämmerliches Leben . Komme ich ohne Geld nach Haus , Wirft mich die Alte hinaus . Fast kein Mensch ist auf der Straße mehr . Ich bin todmüde und friere sehr.So elend zumute war an : Ein ganz anständig angezogener Mann – Doch auf das Äußere darf man in diesem Leben Nicht viel geben . Er ist auch schon älter . [ Die haben mehr Geld , Von den Jungen wird man eher geprellt . ] Er ist mir vis-à-vis . Ich heb die Kleddage bis über das Knie . Ich kann mir dies leisten . Es zieht am meisten . Die Kerle kommen wie Fliegen Ins Licht zu uns Ziegen ... Der Kavalier bleibt wirklich drüben stehen . Er glotzt . Er winkt . Ich will schon bei ihm hingehn ... Ich denke : der wird mir ein großes Goldstück schenken . Dann besauf ich mich heimlich mit teuren Getränken . Das ist noch das schönste : einmal – allein Still für sich besoffen sein –Oder ich kann neue Schuhe kaufen ... Muß nicht mehr in gestopften Strümpfen laufen – Oder ... ich geh einmal nicht auf den Bummel hinaus . Und ruhe mich von den Kerlen aus – Oder ... ach , ich freu mich schon so ... Ich bin so froh – Da kommt die Kitti an . Und versaut den Mann .",256,Expressionismus,Expressionismus
46782,"Löns, Hermann_Das Bickbeernpflücken_1890","Löns, Hermann",Das Bickbeernpflücken,1890,"Jetzt woll'n wir Bickbeer'n pflücken gehn In dem grünen, grünen Wald; Wollen in dem grünen Walde gehn, Wo die vielen, vielen Bickbeer'n stehn In dem grünen, grünen Wald.Das Bickbeerpflücken darf man nicht In dem grünen, grünen Wald; Denn der Förster ist ein böser Mann, Der zeigt die jungen Mädchen an In dem grünen, grünen Wald.Der Förster ist bloß halb so schlimm In dem grünen, grünen Wald; Denn der Förster ist ein junges Blut, Der weiß es wohl, wies Lieben tut In dem grünen, grünen Wald.Ein alter Förster ist nicht schlimm In dem grünen, grünen Wald; Doch wen der junge Förster kriegt, Der behält sein grünes Kränzlein nicht In dem grünen, grünen Wald.Mein Kränzlein hab ich längst nicht mehr In dem grünen, grünen Wald; Denn als ich Bickbeeren pflücken tat, Der Förster mich gefangen hat In dem grünen, grünen Wald.",168,Naturalismus,Naturalismus
36611,"Holz, Arno_Bibelbiereifrig!_1896","Holz, Arno",Bibelbiereifrig!,1896,"Hier Genie und dort Talent! Jeder Mensch hat sein Pläsirchen – So ein armer Recensent Ist das ärmste aller Thierchen.Wenn es pfaucht und wenn es zischt, Lass es, lass es sich nur schinden, Denn dem Ochsen, der da drischt, Sollst du nicht das Maul verbinden!",52,Jahrhundertwende,Naturalismus
44957,"Heym, Georg_UNTITLED_1899","Heym, Georg",UNTITLED,1899,"Die Stirnen der Länder, rot und edel wie Kronen Sahen wir schwinden dahin im versinkenden Tag Und die rauschenden Kränze der Wälder thronen Unter des Feuers dröhnendem Flügelschlag.Die zerflackenden Bäume mit Trauer zu schwärzen, Brauste ein Sturm. Sie verbrannten, wie Blut, Untergehend, schon fern. Wie über sterbenden Herzen Einmal noch hebt sich der Liebe verlodernde Glut.Aber wir trieben dahin, hinaus in den Abend der Meere, Unsere Hände brannten wie Kerzen an. Und wir sahen die Adern darin, und das schwere Blut vor der Sonne, das dumpf in den Fingern zerrann.Nacht begann. Einer weinte im Dunkel. Wir schwammen Trostlos mit schrägem Segel ins Weite hinaus. Aber wir standen am Borde im Schweigen beisammen In das Finstre zu starren. Und das Licht ging uns aus.Eine Wolke nur stand in den Weiten noch lange, Ehe die Nacht begann, in dem ewigen Raum Purpurn schwebend im All, wie mit schönem Gesange Über den klingenden Gründen der Seele ein Traum.",175,Jahrhundertwende,Expressionismus
29405,"Dauthendey, Max_Alles wird wertlos_1892","Dauthendey, Max",Alles wird wertlos,1892,"Als ich Abschied nahm von deinem Mund, Hielt mich noch dein Haar wie Arme fest; Ich ward stumm von der Stille jener Stund, Und von deiner Träne blind, Die mich nicht mehr verläßt.Wenn du mich verläßt, Kann mein Herz nicht fliegen, Und sitzt wie ein nasser Vogel im Nest.Sonst seh ich in alle Kammern hinein, Doch wenn du mich verläßt, Steh ich an Türen von Stein.Alles wird wertlos, Auch's Gold in der Hand, Und die Sehnsucht führt mich Hinkend durchs Land.",93,Jahrhundertwende,Jahrhundertwende
45457,"Rilke, Rainer Maria_Das Lied des Selbstmörders_1900","Rilke, Rainer Maria",Das Lied des Selbstmörders,1900,"Also noch einen Augenblick. Daß sie mir immer wieder den Strick zerschneiden. Neulich war ich so gut bereit und es war schon ein wenig Ewigkeit in meinen Eingeweiden.Halten sie mir den Löffel her, diesen Löffel Leben. Nein ich will und ich will nicht mehr, laßt mich mich übergeben.Ich weiß das Leben ist gar und gut und die Welt ist ein voller Topf, aber mir geht es nicht ins Blut, mir steigt es nur zu Kopf.Andere nährt es, mich macht es krank; begreift, daß man's verschmäht. Mindestens ein Jahrtausend lang brauch ich jetzt Diät.",106,Jahrhundertwende,Jahrhundertwende
121,"Flaischlen, Cäsar_UNTITLED_1892","Flaischlen, Cäsar",UNTITLED,1892,"Dem einen macht es Spaß, bei Reichen zu Gast zu sein, dem andern mehr bei seinesgleichen zu Rast zu sein und in erträumten Königreichen auf goldenem Thron Phantast zu sein.",33,Jahrhundertwende,Naturalismus
45544,"Rilke, Rainer Maria_1._1900","Rilke, Rainer Maria",1.,1900,"Die nächste Flut verwischt den Weg im Watt, und alles wird auf allen Seiten gleich; die kleine Insel draußen aber hat die Augen zu; verwirrend kreist der Deichum ihre Wohner, die in einen Schlaf geboren werden, drin sie viele Welten verwechseln, schweigend; denn sie reden selten, und jeder Satz ist wie ein Epitaphfür etwas Angeschwemmtes, Unbekanntes, das unerklärt zu ihnen kommt und bleibt. Und so ist alles was ihr Blick beschreibtvon Kindheit an: nicht auf sie Angewandtes, zu Großes, Rücksichtsloses, Hergesandtes, das ihre Einsamkeit noch übertreibt.",103,Jahrhundertwende,Jahrhundertwende
26242,Klabund_5._1909,Klabund,5.,1909,"Und heut in der Nacht / da bin ich erwacht, Es schrieb eine Hand an der Wand. Und die Schrift war rot / wie Blut so rot, Und wie Wachs so weiss war die Hand.Und ich sahs und vergass / meine Ängste und las, Was die Hand, die silberne, schrieb. Bedarfst du mein? / Du bist nicht allein Und ich hab dich ewig lieb.Vergiss nicht die Fei / und die heilige Drei Und den Schrei und den endlosen Kuss. Der Kerker zerbricht / es naht das Gericht, Und zur Quelle empor fliesst der Fluss.Die Nacht und der Tag / der Mond und der Hag, Wir lieben uns immer neu. Du küsst meine Stirn / wie Sonne den Firn Und als Bettler hüllt uns die Streu.Bleibe du, bleibe ich / so singe, so sprich, Sprach ich recht, sprach ich dich, sprach ich du? Ich ergriff an der Wand / die silberne Hand, Und sie zog mich den Sternen zu.",178,Jahrhundertwende,Expressionismus
46891,"Löns, Hermann_UNTITLED_1890","Löns, Hermann",UNTITLED,1890,"Vom Baume fiel das letzte Blatt, Frau Musika fröstelt im Freien Und labt uns im geheizten Saal Mit ihren Melodeien.Schön ist ein Symphoniekonzert Mit Kaffee und mit Kuchen. »Frau Schulze, probieren Sie meinen mal, Ich werd' dafür Ihren versuchen.«Die Tassen klappern, die Damen auch, Stricknadeln klimpern nicht minder, Dazwischen plärren und weinen laut Die mitgenommenen Kinder.Schön ist ein Symphoniekonzert, Wenn nur die Musik nicht wäre, Man klagt darüber, daß sie zu sehr Die Unterhaltung störe.",90,Naturalismus,Naturalismus
10177,"Weissmann, Maria Luise_UNTITLED_1914","Weissmann, Maria Luise",UNTITLED,1914,"Doch war es frühe, daß dies Ich entglitt, Das Spiegelbild sich wandelte zum Du: Da war ein alter Mann, und Freitag litt Angst und ertrug Gefahr und fand nicht Ruh Um diesen Greis. Mir war er fremd. Ich ließ Ihm den Geliebten und brach auf zu jagen, Ein böser Geist; Ich tötete. Ich stieß Die Lämmer von der Mutter. Einmal lag Mir Freitag jäh im Wurf, rief: »Töte mich, O Herr, du zürnst!« Mich überfiel die Scham. Ich rief ihn an. Er blieb und weihte sich Dem Tod in Anmut. Als ich näher kam, Lächelte er nach meinem Kuß. Ich hob Ihn sühnend auf, zum reineren Geschick Des Bruders. Er nahms hin. Doch es verwob Seither sich Trauer seinem fremdern Blick.",147,Expressionismus,Expressionismus
39881,"Ringelnatz, Joachim_Letzter Ritt_1908","Ringelnatz, Joachim",Letzter Ritt,1908,"Ein Mädchen ritt Ihren Schimmel Zum Schlachter Im Schritt Nach dem Städtchen. Gott regnete Und segnete Das traurige Mädchen.Da vergoß es Eine Träne In die Mähne Des Rosses Und ritt weiter hin. Als der Schlachtersknecht, Etwas angezecht, Jener Reiterin Guten Morgen bot, War sie tot.Ein Gewitter Brach vom Himmel. Und der Schimmel Schmeckte bitter.",61,Jahrhundertwende,Jahrhundertwende
10176,"Weissmann, Maria Luise_Robinson findet Freitag_1914","Weissmann, Maria Luise",Robinson findet Freitag,1914,"Er blieb, da er mich sah, erschrocken stehn, Ich stand, der ihn erblickte, Stein, verblieben In der Gebärde: himmlischem Vergehn. O Menschen-Wohlgestalt! O Glück, zu lieben Im Blick Verwandtes: Auge, Lippe, Knie, Ein Ohr wie meines, Füße, fünfgespalten, Und Hände, ganz vertraute Form, wie die Sich breitend jetzt, der Schritt, nun aufzuhalten Länger nicht mehr und dort erwidert, scheu... Antwort jetzt meinem Ruf. O süß Getön Von Stimme! Schuf mir zum Gespielen neu Spiegelnd mich Einsamkeit? Bin ich so schön?!",108,Expressionismus,Expressionismus
24168,"Henckell, Karl_UNTITLED_1896","Henckell, Karl",UNTITLED,1896,"Seit die grünen Flammen erglommen Aus den Wäldern vom weichen Wind – Herzen, starr und schicksalbeklommen, Habt ihr wohl, trostlauschend, vernommen, Was durch heilende Lüfte der Erde rinnt?Lindernd durch leidende Lande Rinnt es, wie hoffnungschwellend Geläut: »Löst euch, lähmende Bande, Die ihr mit Schmach und mit Schande Nachtdämonisch das Leben quält und bedräut!«Seit die grünen Flammen erglommen Aus den Wäldern vom weichen Wind – Haben Herzen ein Läuten, lieblich wie Botschaft der Engel vernommen, Daß die Tage der Pfingsten zu uns kommen, Wo die Feste der Menschen wieder Feste des fröhlichen Lebens sind.",112,Jahrhundertwende,Naturalismus
35747,"Bierbaum, Otto Julius_Frühlingszuruf_1887","Bierbaum, Otto Julius",Frühlingszuruf,1887,"Nun sich die Knospen aus den Zweigen drängen, Blühende Kräfte morsche Bande sprengen, Wohin du siehst, wacht alles fröhlich auf –: Nun sei in deiner Seele rein und heiter, Erzengel rechts und links dir als Begleiter, Nimm in den Morgen fröhlich deinen Lauf!Die Schwingen streifen dich an beiden Seiten, Um dich der Engel Atem im Geleiten, Wie muß dein Schritt jetzt frei und kräftig sein! Schreit aus und glaube: Dir erklang das Werde! Schick deine Blicke aus: Die ganze Erde Blüht dir ans Herz: Was schön ist, das ist dein!Denn der ist König über alle Dinge, Und den berührt der Engel goldene Schwinge, Der seine Blicke so aussenden kann, Daß sie wie Adler Beute heimwärts tragen, Und dem die Morgenstunden leuchtend sagen: Du Mensch mit hellen Augen, nimm uns an!",155,Naturalismus,Jahrhundertwende
21126,"Stadler, Ernst_UNTITLED_1898","Stadler, Ernst",UNTITLED,1898,"Die Platanen sind schon entlaubt. Nebel fließen. Wenn die Sonne einmal durch den Panzer grauer Wolken sticht, Spiegeln ihr die tausend Pfützen ein gebleichtes runzliges Gesicht. Alle Geräusche sind schärfer. Den ganzen Tag über hört man in den Fabriken die Maschinen gehn – So tönt durch die Ebenen der langen Stunden mein Herz und mag nicht stille stehn Und treibt die Gedanken wie surrende Räder hin und her, Und ist wie eine Mühle mit windgedrehten Flügeln, aber ihre Kammern sind leer: Sie redet irre Worte in den Abend und schlägt das Kreuz. Schon schlafen die Winde ein. Bald wird es schnei'n, Dann fällt wie Sternenregen weißer Friede aus den Wolken und wickelt alles ein.",128,Jahrhundertwende,Expressionismus
26431,Klabund_Die Glocke_1909,Klabund,Die Glocke,1909,"Die Glocke dröhnt Und stöhnt Die Stunden in die Welt. O, wer sie dieses Zwangs entbände! Sie ist bis an ihr Ende Bestellt, Daß klingend sie ihr Herz ins Nichts verschwende.",36,Jahrhundertwende,Expressionismus
26101,Klabund_Der Springbrunn_1909,Klabund,Der Springbrunn,1909,"Im Stadtpark wird der Springbrunn angedreht. Der Strahl schießt auf, tönt, steigt und steht Für einen Augenblick, Gehalten von der Sonnenfaust. Und wie der Strahl dann in die Tiefe saust: Wasser stieg auf, Glanz fällt zurück.",44,Jahrhundertwende,Expressionismus
46693,"Löns, Hermann_Morgensonne_1890","Löns, Hermann",Morgensonne,1890,"Die Morgensonne umbrandet Den Wald mit brausender Flut, Gold ist vor meinen Augen Und rosenrote Glut.Gold ist vor meinen Augen Und rosenrote Glut, Die warme Morgensonne Auf deinem Haare ruht.",33,Naturalismus,Naturalismus
70,"Flaischlen, Cäsar_Trutzlied_1892","Flaischlen, Cäsar",Trutzlied,1892,"Wenn Geld im Beutel Sorgen macht , wie reiche Leute sagen , von uns dann hätte wahrlich keins viel Grund , sich zu beklagen : was unsereins zu sehen kriegt , ist selten lang zu heben , von darum also könnten wir wie Gott in Frankreich leben.Doch ob auch arme Teufel nur , das macht uns wenig Nöte , wir haben , drum so lustig Lied und freun uns doch des Lebens ! Und das gerade ist die Kunst ... mit Geld kann 's jeder haben ... auch ohne daß man zahlen muß , am Leben sich zu laben.Und hier , Herr , sag ich , liegt der Punkt , der Punkt , an dem sich 's bandelt : und wenn wie Kuckuckskinder nur das Schicksal uns behandelt , wir kriechen dennoch nicht zu Kreuz und werden keine Mucker : wenn wir dem Glück so kuckuck sind , ist 's uns noch viel kuckucker ! Wir wollen , was da werden soll , getrost uns selber schmieden , denn was das Glück im Schoße hält , sind doch nur lauter Nieten . Wir knieen nicht , wir betteln nicht , es mög uns Rosen streuen , wir haben das Geheimnis , auch an Dornen uns zu freuen.So stehn wir stolz und trotzgewillt , wenn andre furchtsam zagen , wir wissen , was wir wollen , und wir wissen , was wir wagen ! Und löst Freund Hein die Frage dann zum Schluß unwiderleglich , so haben wir 's uns wenigstens so froh gemacht als möglich !",256,Jahrhundertwende,Naturalismus
69029,"Holz, Arno_UNTITLED_1898","Holz, Arno",UNTITLED,1898,"Durch die Friedrichstrasse — die Laternen brennen nur noch halb, der trübe Wintermorgen dämmert schon — bummle ich nach Hause.In mir, langsam, steigt ein Bild auf.Ein grüner Wiesenplan, ein lachender Frühlingshimmel, ein weisses Schloss mit weissen Nymphen.Davor ein riesiger Kastanienbaum, der seine roten Blütenkerzen in einem stillen Wasser spiegelt!",56,Jahrhundertwende,Naturalismus
36047,"Bierbaum, Otto Julius_Mai-Feier_1887","Bierbaum, Otto Julius",Mai-Feier,1887,"Der Mai ist voller Nücken Und hat es so an sich, Daß man einander drücken Muß ganz absonderlich; Einander liebzuhaben, Ists die gewisse Zeit Für Mädchen und für Knaben, – Einander liebzuhaben In großer Zärtlichkeit.Die Haut ist nie so samten Den Mädchen, wie im Mai; Und wenn sie mich verdammten, Die von der Klerisei, Ich muß es frei bekennen: Ich streichle gerne sie Und fühl ein hold Entbrennen, – Ich muß es frei bekennen: Mir wird, ich weiß nicht wie.Und ach, der Augen Funkeln! Hilf, heiliger Florian! Sie leuchten selbst im Dunkeln Und zünden alles an. Die kältesten Herzen brennen Wie Zunder lichterloh: Großfeuer ists zu nennen, – Die kältesten Herzen brennen Und sind des Brennens froh.Her mit dem feuchten Strohe Der Sorgen und des Wehs! Aufpraßles in der Lohe Des Mai-Autodafés! Die Liebe soll verzehren, Was uns der Schmerz beschert, Auf Nimmerwiederkehren! – Die Liebe soll verzehren, Was nicht der Liebe wert.",179,Naturalismus,Jahrhundertwende
44006,"Stramm, August_Allmacht_1894","Stramm, August",Allmacht,1894,Forschen Fragen Du trägst Antwort Fliehen Fürchten Du stehst Mut! Stank und Unrat Du breitst Reine Falsch und Tücke Du lachst Recht! Wahn Verzweiflung Du schmiegst Selig Tod und Elend Du wärmst Reich! Hoch und Abgrund Du bogst Wege Hölle Teufel Du siegst Gott!,48,Jahrhundertwende,Expressionismus
36750,"Holz, Arno_UNTITLED_1896","Holz, Arno",UNTITLED,1896,Schon rasen ümb die Erde Herrn schon bohrt sich durch den dikken Schnee der angenehme Mertzen-Klee.Darzwischen/ spizz und munter/ steht gölber Krokus drunter/ darzu so plinckert schon durchs Graß der Teich fast wie auß Spihgel-Glaß.die Häsgens legen Eyer/ die Tichter tichten allbereit/Bald nahn nun sampt den Störchen die stähts verlihbten Lörchen/ schon traumt es ihnen jeden-falls von Krebs-Bluht und von Mükken-Schmaltzin der Himmel ferbt sich sanfften Blaus/ itzt/ Winter/ zeuch den Harnisch auß!Du hast uns sehr gefallen/ drümb lohbt ich dich für allen/ doch itzt/ so muß ich dir gestehn/ möcht ich dich gern von Hindten sehn.,100,Jahrhundertwende,Naturalismus
36645,"Holz, Arno_Der Ruhm?_1896","Holz, Arno",Der Ruhm?,1896,"Der Ruhm? Ein Ding, das unter sogenannten Brüdern Fast so reel wie eine Seifenblase? Geh, lass dir deine Nase putzen, Junge! Ein Rollmops, den die Mitwelt mit mir theilt, Wird mir unendlich schmeichelhafter sein, Als tausend stilgerechte Mausoleen. Die enthusiastisch mir die Nachwelt baut. Auch ist es Lüge, dass die Liebe sich Mitunter auf ein Rosenblatt verirrt. Auf dieses Monstrum hab ich Jagd gemacht Wie ein Professor, der Botanik liest, Vom Brocken bis zum Popokatepetl. Doch, was die Dichter mir auch vorgefaselt, Ich fand sie all mein Lebtag nur im Kuhdreck!",110,Jahrhundertwende,Naturalismus
