pid,filename,poet,title,year,poem,poemlength,epoch_year,epoch_poet
18341,"Wille, Bruno_UNTITLED_1894","Wille, Bruno",UNTITLED,1894,"Über rußbestaubten Dächerwogen , Straßendunst und dumpfem Werkgetose , Über all dem bang beladnen Volke Schwebt die Wolke Blendend weiß , wie eine Riesenwasserrose Über schwarzem Kolke.Und hernieder blickt die Reine In den düstern Hof , wo zwischen Mauern , Ungeliebt vom Sonnenscheine , Ein gebeugtes Weib die Jugend muß vertrauern Bei der Nadel fieberhaftem Rasseln . – Blasses Weib , erhebe dein Gesicht hinter Eisenstangen Schmachtend fluchen , – All die Fensteraugen jener langen Häuserreihen sollen aufwärts schauen Zur verklärten Wolke.In dem matten , wasserblauen Abendhimmel schwimmt das selige Eiland Ruhevoll und glänzend weiß , Wie auf Hochgebirgen keusches Eis . Sanfte Thäler thun sich droben auf ; ich schaue Seidenzarte , schneeige Hyazinthenfelder , Auf den Hügeln duftige Apfelblütenwälder Und dazwischen , blitzend gleich dem Thaue , Alabasterne Paläste . Um Geblüm und Blütenäste Hauchen Lüfte , frisch wie auf der Alpenaue , Und da singt es wie von Kinderstimmen . Doch wo weilen Rein und selig wohnen ? Dort an weißer Hügel Rändern Stehen sie in schimmernden Gewändern , Eng geschaart . Und sieh , die Einen Hüllen ihr Gesicht und weinen , Andre schauen starr und trauernd , Oft zusammenschauernd , Wie entsetzt , hernieder Auf der Weltstadt wüste Riesenglieder , Die in Staub und Sünde angstvoll keucht . Und in liebendem Erbarmen Möchten sie die Stadt umarmen : » Arme trübe Schwester , hebe Deinen Blick zu uns und schwebe Sehnsuchtsvoll Wie ein frisch erblühter Silberfalter Sonnetrunken aufwärts fliegt , Während grau und leer sein alter Puppenschrein im Staube liegt. «",257,Jahrhundertwende,Naturalismus
39891,"Ringelnatz, Joachim_Reklame_1908","Ringelnatz, Joachim",Reklame,1908,"Ich wollte von gar nichts wissen. Da habe ich eine Reklame erblickt, Die hat mich in die Augen gezwickt Und ins Gedächtnis gebissen.Sie predigte mir von früh bis spät Laut öffentlich wie im stillen Von der vorzüglichen Qualität Gewisser Bettnässer-Pillen.Ich sagte: »Mag sein! Doch für mich nicht! Nein, nein! Mein Bett und mein Gewissen sind rein!«Doch sie lief weiter hinter mir her. Sie folgte mir bis an die Brille. Sie kam mir aus jedem Journal in die Quer Und säuselte: »Bettnässer-Pille.«Sie war bald rosa, bald lieblich grün. Sie sprach in Reimen von Dichtem. Sie fuhr in der Trambahn und kletterte kühn Nachts auf die Dächer mit Lichtern.Und weil sie so zähe und künstlerisch Blieb, war ich ihr endlich zu Willen. Es liegen auf meinem Frühstückstisch Nun täglich zwei Bettnässer-Pillen.Die ißt meine Frau als »Entfettungsbonbon«. Ich habe die Frau belogen. Ein holder Frieden ist in den Salon Meiner Seele eingezogen.",176,Jahrhundertwende,Jahrhundertwende
39766,"Ringelnatz, Joachim_[»Oh«, rief ein Glas Burgunder]_1908","Ringelnatz, Joachim","[»Oh«, rief ein Glas Burgunder]",1908,"»Oh«, rief ein Glas Burgunder, »Oh, Mond, du göttliches Wunder! Du gießt aus silberner Schale Das liebestaumelnde, fahle, Trunkene Licht wie sengende Glut Hin über das nachtigallige Land – –«",41,Jahrhundertwende,Jahrhundertwende
24014,"Henckell, Karl_UNTITLED_1896","Henckell, Karl",UNTITLED,1896,"Ich bin kein Minister, Ich bin kein König, Ich bin kein Priester, Ich bin kein Held; Mir ist kein Orden, Mir ist kein Titel Verliehen worden Und auch kein Geld.Dich will ich kriegen, Du harter Plocken, Die Splitter fliegen, Der Sand stäubt auf – »Du armer Flegel«, Mein Vater brummte, »Nimm meinen Schlägel!« Und starb darauf.Heut hab ich Armer Noch nichts gegessen, Der Allerbarmer Hat nichts gesandt; Von goldnem Weine Hab ich geträumet Und klopfe Steine Fürs Vaterland.",96,Jahrhundertwende,Naturalismus
39755,"Ringelnatz, Joachim_[Der Spiegel, der Kamm]_1908","Ringelnatz, Joachim","[Der Spiegel, der Kamm]",1908,"Der Spiegel, der Kamm Und der Schwamm Und das weiße Handtuch an der Wand Und ein Mann, der hinter dem Kleiderschrank stand, Die warteten auf das schöne Mädchen Käthchen. Und endlich, endlich kam Käthchen gegangen. Da küßte der Schwamm ihr Mund und Wangen, Und sie küßte den Schwamm und beugte sich nieder Und küßte das Handtuch und küßte es wieder. Sie ließ sich von dem Spiegel umschmeicheln Und von dem Kamme ihr Goldhaar streicheln. Dann sagte sie allen recht schönen Dank. Dann sah sie den Mann hinterm Kleiderschrank Und rannte davon und schrie dabei: »Zu Hilfe! Mörder!« und »Polizei!« – – – – – – – – – – – – – – – – – – – – – – – Der Mensch glaubt über den Dingen zu stehen. Hier war das Gegenteil deutlich zu sehen.",157,Jahrhundertwende,Jahrhundertwende
12750,"Lichtenstein, Alfred_Die Fahrt nach der Irrenanstalt I_1911","Lichtenstein, Alfred",Die Fahrt nach der Irrenanstalt I,1911,"Auf lauten Linien fallen fette Bahnen Vorbei an Häusern, die wie Särge sind. An Ecken kauern Karren mit Bananen. Nur wenig Mist erfreut ein hartes Kind.Die Menschenbiester gleiten ganz verloren Im Bild der Straße, elend grau und grell. Arbeiter fließen von verkommnen Toren. Ein müder Mensch geht still in ein Rondell.Ein Leichenwagen kriecht, voran zwei Rappen, Weich wie ein Wurm und schwach die Straße hin. Und über allem hängt ein alter Lappen – Der Himmel ... heidenhaft und ohne Sinn.",90,Expressionismus,Expressionismus
12738,"Lichtenstein, Alfred_Der Türke_1911","Lichtenstein, Alfred",Der Türke,1911,"Ein ganz und gar perverser Türke kaufte sich Aus Trauer über den erst jüngst erfolgten Tod Der fetten Fatme, seines Lieblingsweibes, Bei seinem Mädchenhändler zwei noch ziemlich gut erhaltne – Man kann fast sagen: beinah nagelneue – Und eben frisch aus Frankreich importierte, Ehemalge Mannequins. Als er sie hatte, sang er, sich zur Feier:Setzt euch doch auf meine Schenkel. Fasset mich um meine Lenden. Streichelt mit den süßen Zungen Mir die weinerlichen Wangen. Ach, ihr habt so schön geschmückte Augen und so helle Hände, Müdeste von meinen Frauen, Und so lange, laue Beine. Morgen kauf ich sechs Paar neue Strümpfe euch aus dünnster Seide Und dazu ganz kleine schwarze Sammetschuhchen. Und am Abend sollt ihr tanzen Ganz verlogne, weiche Tänze In den kleinen Sammetschuhchen Und den neuen seidnen Strümpfen. In dem Garten. Vor der Sonne. Dicht am Wasser. Doch zur Nacht laß ich euch peitschen Von vier lächelnden Eunuchen.",173,Expressionismus,Expressionismus
18424,"Wille, Bruno_UNTITLED_1894","Wille, Bruno",UNTITLED,1894,"Es starrt so trüb ein altes Haus In wintergraue Fernen hinaus.In sich versunken, erbebt es bang Von dumpf verschollenem Glockenklang.Auf einmal gleitet zärtliches Licht Ihm tastend über das Angesicht.Die Wintersonne mit mattem Schein Küßt scheidend Giebel und Fensterlein.Wehmütig lächelt ihr zitternder Strahl: »Gedenkst du noch? Es war einmal ...«Dann hüllt sie das Haupt in Schneegewölk ein Und läßt das Haus im Dunkeln, allein.",71,Jahrhundertwende,Naturalismus
28781,"Hartleben, Otto Erich_UNTITLED_1884","Hartleben, Otto Erich",UNTITLED,1884,"Wie heimlich dann im Bett an deiner Brust! Aus Morgenträumen Arm in Arm erwacht, bestaunen wir den lustigen Sonnenstrahl, der keck zu solchen Heimlichkeiten drang. Behaglich recken wir die schlafgestärkten und schon von neuer Lust durchbebten Glieder, und selig lächelnd schauen wir uns stumm in Augen, die der Schlaf noch kaum verliess. O meine süsse, weisse Hede, komm – lass deine Haare fliessen! Diese Spitzen – o lass mich – lass mich: du bist schöner so, und freier schweifen meine Küsse – ah! Zieh deine Hände von den Augen, Kind: was schämst du dich? Der Sonnenstrahl ist keusch –",115,Naturalismus,Naturalismus
36073,"Bierbaum, Otto Julius_Sowas!_1887","Bierbaum, Otto Julius",Sowas!,1887,"Heute nacht erschien ich mir Als ein sonderbares Tier . Hatte Krallen Aus Korallen , Hatte Hörner wie ein Stier . Doch sie waren , ich gab wohl acht , Waren aus Muschelkalk gemacht.An ihren Spitzen saßen , Geschliffen aus Topasen , Zwei Augen , die waren wie wolkichte Nacht.Wo sonst die Augen sitzen , Sah ich aus schmalen Ritzen Ein grünes Funkeln gehn so was , nein : Jetzt sieht der Kerl sich selber nicht ein ! Gingging , gingging , welch ein Kamel ! Er kennt nicht seine eigene Seel.Gingging , gingging , wie dumm , wie dumm ! Er fragt : wieso , weshalb , warum ? Gingging , gingging , man glaubt es kaum : Es denkt das Schaf sogar im Traum.Gingging , gingging , ich habe es dick : Der Kerl übt an sich selbst Kritik ! Gingging , gingging ... Da gabs einen Krach : Weg war das Monstrum , und ich war wach.Wie seltsam kam – der Traum ? Ach nein : Wie seltsam kam der Tag mir vor ! Das da im Bett : – ich soll das sein ? Mein ganzes Ich das ? – : Kinderein ! – : Ein Teil , der sich ins Licht verlor . Ein Glied von mir : Nichts weiter bin ich hier . In der heiligen Allnacht , im unendlichen Raum Streck ich mich , dehn ich mich tausendgestaltig , Bin Pflanze , Luft , Stein , Wasser , Tier : Leben in allen Formen , lächerlich und gewaltig .",256,Naturalismus,Jahrhundertwende
69033,"Holz, Arno_UNTITLED_1898","Holz, Arno",UNTITLED,1898,"Fern liegt ein Land!In dunklen Nächten rauschten schwermütig seine Eichen. Weiche Flocken deckten mein Grab.Jetzt blühn die Primeln, die Drossel singt, und über grüne Wiesen, um den blauen See treibt der Schäfer seine Schafe.Weisse Wölkchen gleiten.Du süsse Welt! Auf deinen glänzendsten Stern hast du ein Herz, das dich liebt, gerettet!",60,Jahrhundertwende,Naturalismus
26411,Klabund_Als sie die ihr geschenkte Kristallflasche_1909,Klabund,Als sie die ihr geschenkte Kristallflasche,1909,"Brechen sich im Glas die Strahlen, Bricht das Glas sich in den Strahlen? Glänzt dein Auge in der Sonne, Glänzt die Sonn' in deinem Auge? Liebt dein Herz mich? Herzt mich deine Liebe? Seliges Verdämmern: Denn wir sterben unser Leben Und wir leben unsren Tod.",54,Jahrhundertwende,Expressionismus
46620,"Löns, Hermann_UNTITLED_1890","Löns, Hermann",UNTITLED,1890,"Über die Heide ziehen Spinneweben Von Halm zu Halm ihr silberweißes Tuch, Am Himmelsrande weiße Wölkchen schweben Und weißes Wollgras wimpelt überm Bruch.Es glüht die Luft wie ein Maschinenofen, Kein Menschenleben regt sich weit und breit, Der Baumpieper nur schmettert seine Strophen Und hoch im Blau der Mäusebussard schreit.In rosa Heidekraut den Leib ich strecke, Das Taschentuch ich auf die Augen breit', Weit von mir ich die schlaffen Glieder recke Und dehne mich in süßer Müdigkeit.O Grabesschlaf, wollüstiges Genießen! Wenn dieser müde Menschenleib verwest, Wenn die Atome auseinanderfließen Und Glied an Glied sich reckend, dehnend löst.",107,Naturalismus,Naturalismus
46678,"Löns, Hermann_Sehnsucht_1890","Löns, Hermann",Sehnsucht,1890,"Die Lungenblumen blühen Aus dunkelgrünem Moos, Mein Herz das bebt und zittert Meine Sehnsucht ist so groß.Die beiden blauen Blüten Erinnern mich so sehr An deine lieben Augen, Mein Herz das schlägt so schwer.Es geht ein Zittern und Beben Durch meiner Seele Grund, Rot ist die eine Blüte, Rot wie dein roter Mund.",58,Naturalismus,Naturalismus
46842,"Löns, Hermann_UNTITLED_1890","Löns, Hermann",UNTITLED,1890,"Ich hör' ein Vöglein singen, Das Vögelein singt zipp und zapp; Ich laß den Rappen laufen, Bald Schritt und auch bald Trab.Trompeter und die blasen, Mein Schatz, nun laß das Weinen sein; Vier Jahre gehn vorüber, Dann bin ich wieder dein.Das Fähnlein tut winken, Wir sind des Kaisers Kürassier; Ist meine Zeit vorüber, Kehr' ich zurück zu dir.Das sind die schweren Reiter, Die fürchten sich vor keinem Blei; Ihr Kleid, das ist von Eisen, Ihr Herz und das ist treu.Laß traben, laß traben, Die Welt ist weit, die Welt ist breit; Die Rosen blühen wieder, Kommt erst die rechte Zeit.",122,Naturalismus,Naturalismus
23853,"Henckell, Karl_UNTITLED_1896","Henckell, Karl",UNTITLED,1896,"Höhnisch Heulen Von herben Winden! Rauhe Schauer Rieseln durch Mark und Bein. Wirbelnde Blätter Von den Linden Schleifen in öden, Schlüpfrigen Schlamm hinein. Wolken weinen da droben; Pessimistische Zähren Spritzt mir der Sturm ins Gesicht – Leben voll Jammer und Schwären! Trotzig dich wehren! Kämpfend verklären! Lockenschüttelnd das Haupt erhoben, Seele voll Licht! Freude gebären! Modre, vermodre Du nur, du nur im Sumpfe nicht!",78,Jahrhundertwende,Naturalismus
41333,"Trakl, Georg_3_1900","Trakl, Georg",3,1900,"Ein altes Wiegenlied macht dich sehr bang. Am Wegrand fromm ein Weib ihr Kindlein stillt. Traumwandelnd hörst du wie ihr Bronnen quillt. Aus Apfelzweigen fällt ein Weiheklang.Und Brot und Wein sind süß von harten Mühn. Nach Früchten tastet silbern deine Hand. Die tote Rahel geht durchs Ackerland. Mit friedlicher Geberde winkt das Grün.Gesegnet auch blüht armer Mägde Schoß, Die träumend dort am alten Brunnen stehn. Einsame froh auf stillen Pfaden gehn Mit Gottes Kreaturen sündelos.",84,Jahrhundertwende,Expressionismus
36021,"Bierbaum, Otto Julius_Ruhe_1887","Bierbaum, Otto Julius",Ruhe,1887,"Das Leben ist ein Glück. Wie tut das Atmen gut. Wie schlägt mein Herz getrost, Wie ruhig rollt mein Blut.In meinen Augen wohnt Die Welt, ein Blumenstrauß. Sie war wohl sehr verwirrt, Nun ruht sie sicher aus.",44,Naturalismus,Jahrhundertwende
49761,"Morgenstern, Christian_UNTITLED_1892","Morgenstern, Christian",UNTITLED,1892,"Immer nicht an Mond und Sterne mag ich meine Blicke hängen – : Ach man kann mit Mond und Sternen , Wolken , Felsen , Wäldern , Bächen allzuleichtlich kokettieren , hat man solch ein schelmisch Weibchen stets um sich wie Phanta Sia.Darum senk ich heut bescheiden meine Augen in die Tiefe . Hier und da ein Hüttenlichtlein ; auch ein Feuer , dran auch wieder jenem braven Walfisch ähnlich , der dem Jonas nur auf Tage seinen Bauch zur Herberg anbot.Feuerwurm , ich grüße froh dich von den Stufen meines Schlosses ! Denn ob mancher dich auch schmähe , als den Störer stiller Lande , und die gelben Humpeldrachen , die noch bliesen , noch nicht pfiffen , wiederwünschte , – ich bekenne , daß ich stolz bin , dich zu schauen . Höher schlägt mir oft das Herze , seh ich dich auf schmalen Pfaden deine Wucht in leichter Grazie mit dem Flug der Vögel messen und mit Triumphatorpose hallend durch die Nächte tragen.Sinnbild bist du mir und Gleichnis Geistessiegs ob Stoffesträgheit ! Gleichnis bist du neuer Zeit mir , die , jahrtausendalter Kräfte Erbin , Sammlerin , sie spielend zwingt und formt , beherrscht und leitet ! Andre Zeiten , andre Drachen , andre Drachen , andre Märchen , andre Märchen , andre Mütter , andre Mütter , andre Jugend , andre Jugend , andre Männer – : Stark und stolz , gesund und fröhlich , leichten , kampfgeübten Geistes , Überwinder aller Schwerheit , Sieger , Tänzer , Spötter , Götter !",256,Jahrhundertwende,Jahrhundertwende
11980,"Falke, Gustav_UNTITLED_1884","Falke, Gustav",UNTITLED,1884,"Und so geschah es , das Grause . Mich sprang , Ein gieriger Panther , die Eifersucht an , Der Neid , und nährte von Tag zu Tag Den Hass auf ihn , der im Arm ihr lag , Die sicher in heimlicher Neigung schon lang Dem roten Riesen war zugethan , Denn so glaubte ich fest und wollte es glauben , Mich selbst ich die Leiche . Hinausgetrieben Vielleicht ins Meer , oder hängen geblieben Tief unten an spitzigen Klippennadeln , Ward Raub sie den Fischen . – Wer will mich tadeln ? Wer klagt mich an ? Bei Gott ! und hätte Die Mutter er mir , den Vater erstochen , Die Schwester geschändet im Sündenbette , Greuel auf Greuel , nicht hätt ' ich 's gerochen . Nicht so , wie er hängend zwischen Tod und Leben War wehrlos in meine Hand gegeben . Und ihr glaubt es ja alle , und keiner ist da , Der mir es aufbürdete , was geschah . Was will es denn nun ? Was lässt es mich nicht ? Als wär ' ich ein Schuft , ein erbärmlicher Wicht . Kein Mord , ein Unglück ! ich that meine Pflicht . Meine Kraft war zu schwach , das Seil mir entschwunden , Die Zähne zum Teufel , die Hände geschunden , Und blutend lag , das Gesicht auf dem Stein , Wie zerschmettert ich oben . Die Glieder flogen . Und unten stürmten und tobten die Wogen , Und ihr rollender Donner verschlang sein Schrein .",256,Naturalismus,Jahrhundertwende
35897,"Bierbaum, Otto Julius_UNTITLED_1887","Bierbaum, Otto Julius",UNTITLED,1887,"Ein dickes Maulwurfsehepaar , Das glänzend schwarz wie Sammet war , Erfuhr Familienzuwachs . Froh Lag die Frau Maulwurf auf dem Stroh Und leckte jedes Junge Mit ihrer schmalen Zunge.Da rief sie plötzlich : » Wunderlich , Mir scheint , ich weiß nicht , irr ich mich , Mich dünkts : Das Eine von den Drei ' n , Das muß was ganz besondres , Wie nie ichs träumte , ist es hier , Kommt , kommt zum Licht , ach , kommt zu mir ! Ich hab das Glück , das Glück gefunden , Und ihr lebt in der Hölle unten ! Mir nach , mir nach , mir nach zum Licht ! Kommt alle , kommt und zaudert nicht ! « Wie das der schwarze Schwarm vernahm , Jachheiße Wut ihn überkam : » Herunter mit dem Galgenstrick ! Herunter ! Brecht ihm das Genick ! « Und während er begeistert schrie , Da gruben sie und wühlten sie Viel krumme Gänge zu ihm hin Und packten ihn und zerrten ihn – Hinab . Und haben sein Fell zerfetzt Und totgebissen ihn zuletzt.Da lag der Weiße still im Dreck , Befriedigt trollten die Schwarzen weg Und fraßen viele Engerlinge Und waren zufrieden und guter Dinge.Doch , daß die Nachwelt einst erfahr , Daß mal ein weißer Maulwurf war , Und zum Beweis das Fell erseh , Bildeten sie ein Komitee : » Zu des weißen Vließes Konservierung. « Das erfand eine praktische Balsamierung , Und des Maulwurfreiches weißer Sohn Ward beigesetzt im Pantheon .",257,Naturalismus,Jahrhundertwende
28946,"Scheerbart, Paul_UNTITLED_1889","Scheerbart, Paul",UNTITLED,1889,Ich möchte so gern wie ein Vogel Durch die Lüfte fliegen. Ich möchte so gern wie ein Löwe In der Wüste liegen. Ich möchte so gern wie ein König die lange Weile besiegen. Doch der Glanz der ewigen Sonnen Begeistert mich heute nicht. Ich habe Vieles begonnen. Doch das macht noch kein Gedicht.,59,Naturalismus,Naturalismus
36035,"Bierbaum, Otto Julius_Der amen Kinder Weihnachtslied_1887","Bierbaum, Otto Julius",Der amen Kinder Weihnachtslied,1887,"Hört, schöne Herrn und Frauen, Die ihr im Lichte seid: Wir kommen aus dem Grauen, Dem Lande Not und Leid; Weh tun uns unsre Füße Und unsre Herzen weh, Doch kam uns eine süße Botschaft aus Eis und Schnee. Es ist ein Licht erglommen, Und uns auch gilt sein Schein. Wir habens wohl vernommen: Das Christkind ist gekommen Und soll auch uns gekommen sein.Drum gehn wir zu den Orten, Die hell erleuchtet sind, Und klopfen an die Pforten: Ist hier das Christuskind? Es hat wohl nicht gefunden Den Weg in unsre Nacht, Drum haben wir mit wunden Füßen uns aufgemacht, Daß wir ihm unsre frommen Herzen und Bitten weihn. Wir habens wohl vernommen: Das Christkind ist gekommen Und soll auch uns gekommen sein.So laßt es uns erschauen, Die ihr im Lichte seid! Wir kommen aus dem Grauen, Dem Lande Not und Leid; Wir kommen mit wunden Füßen, Doch sind wir trostgemut: Wenn wir das Christkind grüßen, Wird alles, alles gut. Der Stern, der heut erglommen, Gibt allen seinen Schein: Das Christkind ist gekommen! – Die ihr es aufgenommen, O, laßt auch uns zu Gaste sein!",219,Naturalismus,Jahrhundertwende
46591,"Löns, Hermann_Eulenspiegel_1890","Löns, Hermann",Eulenspiegel,1890,"Wenn wir uns auf der Straße sehen, Reißt's mich an allen Nerven fort, Dir meine Neigung zu gestehen Mit ungestümem Liebeswort.Ich seh' im Brande deiner Wangen, In deiner Augen Demutsglut Bejahung auf mein heiß Verlangen, Und doch fehlt mir der Werbemut.Vom Baume der Erkenntnis habe Ich manche süße Frucht gepflückt, Doch trug ich bald darauf zu Grabe Die Hoffnungen, die mich entzückt.Wenn wir uns küssend nie umschlossen, Dann bleiben wir uns ideal, Doch was errungen und genossen, Das ist schon morgen welk und schal.Drum will ich schnell vorüberschreiten Mit stummem Munde, kaltem Blick, Damit uns später nicht begleiten Erinn'rungen an totes Glück.",116,Naturalismus,Naturalismus
29530,"Dauthendey, Max_Das Herz wiegt schwerer Tag für Tag_1892","Dauthendey, Max",Das Herz wiegt schwerer Tag für Tag,1892,"Nebel tragen die Berge fort, Die Erde wird so herbstlich weit, Und wie vom feinen Wein entrückt Stirbt um uns jede Wirklichkeit. Das Herz wiegt schwerer Tag für Tag, Und eine Hand, die unverrückt In Frucht und Feuer bei dir lag, Wiegt in dem leeren Nebelland Schwerer als deines Herzens Schlag.",58,Jahrhundertwende,Jahrhundertwende
36642,"Holz, Arno_Trotzalledem!_1896","Holz, Arno",Trotzalledem!,1896,"Die sieben Farben und die sieben Töne, Der Welt Gestaltung und der Menschheit Treiben, Das Ewigwahre und das Ewigschöne Wird ewigwahr und ewigschön verbleiben.",27,Jahrhundertwende,Naturalismus
24045,"Henckell, Karl_UNTITLED_1896","Henckell, Karl",UNTITLED,1896,"Dreitausend Mark, heidi, per Jahr Von Seiner Exzellenz – Wie schirmt der Himmel wunderbar Lockspitzels Existenz! Kein Gentleman, kein Gentleman, Als wär das ein Malheur, So bin ich denn und blei ich dennSpitz, spitz: die Ohren aufgeknöpft! Horch, horch nach links und rechts! Bum, bum! »Und alles wird geköpft Tyrannischen Geschlechts!« Fällt mir dann so ein Tölpel rein Und brüllt: »Den Teufel – ja!« Das muß ein Anarchiste sein, Ein Anarchist, hurra!Ich bin ein Werkzeug der Gewalt Von Gottes Gnaden nur, Ein unentbehrlich Rädchen halt In der Regierungsuhr. Spitz, spitz, horch, horch! Kein Gentleman, Als wär das ein Malheur. So bin ich denn und blei ich denn»Genosse, prost!« Begleite ihn, Schüttl ihm als Freund die Hand Und melde schleunigst nach Berlin: »Ein frischer Fisch – brillant!« Aus deutschem Reichsfonds stell' ich flugs Das süße Mordsblatt her, Die »Freiheit« – kolossaler Jux! Ex'lenz, was willst du mehr?Ach, als ich noch kein Spitzel war, Welch kreuzerbärmlich Los! Dreitausend Reichsmark jedes Jahr, Das macht sich ganz famos. Mitunter puppert's mir von fern: »Du Schuft!« Herrje, ich bin Ein treuer Diener meines Herrn – Und schlag' mir's aus dem Sinn.",253,Jahrhundertwende,Naturalismus
24196,"Henckell, Karl_UNTITLED_1896","Henckell, Karl",UNTITLED,1896,"Zu Teltow, zu Teltow, im Königreiche Sachsen, Wo sonst doch nur die kleinen, die feinen Rübchen wachsen, Zu Teltow ist die Treue beim wahren Troß der Frommen Vom alten Hund aufs neue Tatarenroß gekommen. Bald beugen Die Kniee vor dem Pferde des Zollerigula.",50,Jahrhundertwende,Naturalismus
46709,"Löns, Hermann_UNTITLED_1890","Löns, Hermann",UNTITLED,1890,"Über den grünen rotblumigen Klee Tanzen die Falter, weiß wie der Schnee, Über den Feldern ist Lerchengesang, In der Ferne ist Dorfglockenklang.Rot und blau alle Feldränder blühn, Weißgestickt ist das Wiesengrün, Hell ist die Sonne und weit ist die Welt Und mein Arm dich umschlungen hält.",52,Naturalismus,Naturalismus
35697,"Bierbaum, Otto Julius_Gigerlette_1887","Bierbaum, Otto Julius",Gigerlette,1887,"Fräulein Gigerlette Lud mich ein zum Thee. Ihre Toilette War gestimmt auf Schnee; Ganz wie Pierrette War sie angethan. Selbst ein Mönch, ich wette, Sähe Gigerlette Wohlgefällig an.War ein rotes Zimmer, Drin sie mich empfing, Gelber Kerzenschimmer In dem Raume hing. Und sie war wie immer Leben und Esprit. Nie vergeß ichs, nimmer: Weinrot war das Zimmer, Blütenweiß war sie.Und im Trab mit Vieren Fuhren wir zu zweit In das Land spazieren, Das heißt Heiterkeit. Daß wir nicht verlieren Zügel, Ziel und Lauf, Saß bei dem Kutschieren Mit den heißen Vieren Amor hinten auf.",111,Naturalismus,Jahrhundertwende
45672,"Rilke, Rainer Maria_1._1900","Rilke, Rainer Maria",1.,1900,"Derselbe große Engel, welcher einst ihr der Gebärung Botschaft niederbrachte, stand da, abwartend daß sie ihn beachte, und sprach: Jetzt wird es Zeit, daß du erscheinst. Und sie erschrak wie damals und erwies sich wieder als die Magd, ihn tief bejahend. Er aber strahlte und, unendlich nahend, schwand er wie in ihr Angesicht – und hieß die weithin ausgegangenen Bekehrer zusammenkommen in das Haus am Hang, das Haus des Abendmahls. Sie kamen schwerer und traten bange ein: Da lag, entlang die schmale Bettstatt, die in Untergang und Auserwählung rätselhaft Getauchte, ganz unversehrt, wie eine Ungebrauchte, und achtete auf englischen Gesang. Nun da sie alle hinter ihren Kerzen abwarten sah, riß sie vom Übermaß der Stimmen sich und schenkte noch von Herzen die beiden Kleider fort, die sie besaß, und hob ihr Antlitz auf zu dem und dem... (O Ursprung namenloser Tränen-Bäche).Sie aber legte sich in ihre Schwäche und zog die Himmel an Jerusalem so nah heran, daß ihre Seele nur, austretend, sich ein wenig strecken mußte: schon hob er sie, der alles von ihr wußte, hinein in ihre göttliche Natur.",214,Jahrhundertwende,Jahrhundertwende
26318,Klabund_UNTITLED_1909,Klabund,UNTITLED,1909,Nummer 1 trägt eine Radfahrermütze. Nummer 2 hat die Krätze. Nummer 3 erinnert sich an seine dritte Braut. Nummer 4 weint.Der Wärter rasselt mit den Schlüsseln. Öffnet keine Pforte. Oben im ovalen Fenster Hängt der Himmel wie eine Scheibe Brot.Hunger Hunger nach dem Himmel Hunger Hunger nach der Scheibe Brot und nach der Sonnenscheibe.Nach dem Schreiten weiten Schreiten in die Weiten. Hunger Hunger nach dem kleinsten Lächeln Einer verfallenen Frau.Hier ist kein Ausgang und kein Ende. Paragraphen Trafen Tödlich. Vor den Augen saust es rötlich. An den Mauern trommeln Stümpfe ohne Hände.,102,Jahrhundertwende,Expressionismus
