pid,filename,poet,title,year,poem,poemlength,epoch_year,epoch_poet
44970,"Heym, Georg_UNTITLED_1899","Heym, Georg",UNTITLED,1899,"Mit den fahrenden Schiffen Sind wir vorübergeschweift, Die wir ewig herunter Durch glänzende Winter gestreift. Ferner kamen wir immer Und tanzten im insligen Meer, Weit ging die Flut uns vorbei, Und Himmel war schallend und leer.Sage die Stadt, Wo ich nicht saß im Tor, Ging dein Fuß da hindurch, Der die Locke ich schor? Unter dem sterbenden Abend Das suchende Licht Hielt ich, wer kam da hinab, Ach, ewig in fremdes Gesicht.Bei den Toten ich rief, Im abgeschiedenen Ort, Wo die Begrabenen wohnen; Du, ach, warest nicht dort. Und ich ging über Feld, Und die wehenden Bäume zu Haupt Standen im frierenden Himmel Und waren im Winter entlaubt.Raben und Krähen Habe ich ausgesandt, Und sie stoben im Grauen Über das ziehende Land. Aber sie fielen wie Steine Zur Nacht mit traurigem Laut Und hielten im eisernen Schnabel Die Kränze von Stroh und Kraut.Manchmal ist deine Stimme, Die im Winde verstreicht, Deine Hand, die im Traume Rühret die Schläfe mir leicht; Alles war schon vorzeiten. Und kehret wieder sich um. Gehet in Trauer gehüllet, Streuet Asche herum.",204,Jahrhundertwende,Expressionismus
44990,"Heym, Georg_UNTITLED_1899","Heym, Georg",UNTITLED,1899,"Es ist ganz dunkel. Und die Küsse fallen Wie heißer Tau im dämmernden Gemach. Der Wollust Fackeln brennen auf und wallen Mit roter Glut dem dunklen Abend nach.Das Fieber jagt ihr Blut mit weißem Brand, Daß sie sich halb schon seinem Durst gewährt. Sie bebt auf seinem Schoß, da seine Hand In ihrem Hemd nach ihren Brüsten fährt.Hinten, im Vorhang, in der Dunkelheit Steht auf das Bett, der Hafen ihrer Gier. Wie Wolken auf dem Meere lagert breit Darauf der Dunst von schwarzem Elixier.Wie wird es sein? Sie friert in seinem Arm, Der ihren nackten Leib hinüberträgt. Es zittert auf in ihrem Schoße warm, Um den er wild die beiden Arme schlägt.Ihr blondes Haar brennt durch die Nacht, darein Die tiefe Hand des feuchten Dunkels wühlt. Der Sturm der Wollust läßt sie leise schrein, Da seinen Biß sie in den Brüsten fühlt.",159,Jahrhundertwende,Expressionismus
50248,"Morgenstern, Christian_1._1892","Morgenstern, Christian",1.,1892,"Ruhe, Ruhe, tiefe Ruhe. Lautlos schlummern Menschen, Tiere. Nur des Gipfels Gletschertruhe schüttet talwärts ihre Wasser.Geisterstille, Geisterfülle, öffnet Eure Himmelsschranke! Bleibe schlafend, liebe Hülle, schwebt, Empfindung und Gedanke, aufwärts!Aufwärts in die Geisterhallen taste dich, mein höher Wesen! Laß des Leibes Schleier fallen, Koste, seingenesen, Freiheit!",65,Jahrhundertwende,Jahrhundertwende
19885,"Müller-Jahnke, Clara_UNTITLED_1882","Müller-Jahnke, Clara",UNTITLED,1882,"Ich hab mich lange Zeit gesträubt und wollt es nie und nie verstehen, was ich im Leuchten deines Blicks, im Zucken deines Munds gesehen.Es war in tiefer Dunkelheit ein Irrlicht, welches mich geblendet; und daß der Pfad, auf den es lockt, in Nacht und Not und Grauen endet –Ich weiß es längst: – In bleicher Angst halt ich die Augen fest geschlossen, und dennoch fühl ich Fieberglut durch alle Adern mir ergossen –Und dennoch pocht bei deinem Blick mein Herz in immer heißern Schlägen: magnetisch zieht das Zauberlicht den Tiefen mich der Schuld entgegen.",104,Naturalismus,Naturalismus
72522,"Holz, Arno_UNTITLED_1899","Holz, Arno",UNTITLED,1899,"Du liest, dass der Herzog von Devonshire jährlich 100,000 Pfund verbraucht, und beneidest ihn um seine Jaspispaläste.Narr!Bekuck dir den braunen, grüngesprenkelten Kattunpuckel deiner alten Zeitungsfrau, horch, was über deinem Fenster die Schwalbe mit ihren Jungen zwitschert, freue dich, wie die wilde Distel, die du nach Hause trugst, nach Honig duftet sauge in dich die Sonne!Jede Sekunde, die du lebst, vergeudet über dich Schätze.",79,Jahrhundertwende,Naturalismus
12048,"Falke, Gustav_UNTITLED_1884","Falke, Gustav",UNTITLED,1884,"Unruhig steht die Sehnsucht auf, Ihr ist so schwül, sie atmet tief, Und hundert Wünsche stehen auf, Die sie am müden Tag verschlief.Sie rührt der Mutter an den Saum, Der Mutter Nacht, die achtets kaum, Und denkt, es wär der Wind, der strich. Die Wimper hebt sie wie aus tiefem Traum Und lächelt irr und wunderlich.",67,Naturalismus,Jahrhundertwende
7937,"Dehmel, Richard Fedor Leopold_Blick in das All_1891","Dehmel, Richard Fedor Leopold",Blick in das All,1891,"Wir haben uns gesucht und nicht gefunden : wir sahen Götter , weil wir Wir hatten uns durch eigne Kraft gebunden , daß wir die eigne Kraft nicht fühlten Der Geist war leiblos aus dem All geschwunden : er sollte göttlich Wir wollten nur am Wesen uns begeistern , und konnten dennoch nicht die Form bemeistern.Und machtlos fühlte sich auf seiner Höhe der Menschengeist sich hinab ; zum Wesen ward der Dinge und Wahrheit schien ihm , daß er ewigDoch aus der Selbstbezähmung umgeboren zu neuem und was er an erhabnem gewann als Zu denn Demut hob ihn aus der Schwachheit Haft : der Geist im Leib vom Geist ins All verbunden , so hat im All der Geist sich erstEr sah , wie in der endlos großen Kette der Formen endlos groß ein Sehnen wohnt , sich selbst zu heben in der Wesenwette , in der die Form der Und aus ein Streben , das sich endlich nicht der Menschheit es bürgt auch für des Ringens Vollerfüllung ! Ein verschlossen ewig sei das Rätselbuch der Allkraft , deren Pulse in uns walten ! ein Wahn , daß uns die Lösung nur ein Fluch , daß unsrer Geistesmächte der Formwelt drohe den Zusammenbruch ! Kann sich im Stoffe gleich die Kraft kann sich vom Stoffe doch die Kraft nichtUnd ist es des Körper-Seelen-Wechsels Werdefleiß , ist Uns noch ist Uns die Mühe noch der Mühe Preis : so kann uns ob nicht für solchen Lohn die Qual zu heiß ! wir sind ein daß wir nicht",256,Naturalismus,Jahrhundertwende
21049,"Stadler, Ernst_UNTITLED_1898","Stadler, Ernst",UNTITLED,1898,Nun schreiten wir in Abends leisem Leuchten den Wiesenhang von Blumengold umschüttet den Schatten zu die von erloschnen Hügeln hinsinken über das entflammte Tal.Uns ward die Mär von fernen Tempels Zinnen: Gold sind die Türme silbern strahlt das Tor weiß schimmern seine Alabastersäulen aus schwarzem Lorbeer vor und Rosenbüschen. Im Glühen und Verrieseln dunkler Dolden bebt zag der Schritt durch die verwunschnen Beete der Stufen Glanz von rotem Licht umflattert wo tief in klingender Gewölbe Schauern von Purpurnacht der Decken überströmt auf runder Schale schläft der heilige Kelch.Schon tropft das Dunkel über uns wie Tau. Wann rinnt es golden durch umflorte Wipfel? Wann lockt durch schwüle Stille süßer Ton?,114,Jahrhundertwende,Expressionismus
52657,"Lersch, Heinrich_Mensch im Eisen_1907","Lersch, Heinrich",Mensch im Eisen,1907,"Mein Tagwerk ist: im engen Kesselrohr bei kleinem Glühlicht kniend krumm zu sitzen – an Nieten hämmernd in der Hitze schwitzen. Verrußt sind Aug` und Haar und Ohr –Als wär ich nur ein kleiner Schlagmotor, So lass` ich meine Arme federnd flitzen – Die glühnde Luft sticht wie mit giftigen Spitzen; Immer von neuem bricht der Schweiß hervor...O Mensch! Wo bist du? Wie ein Käfertier Im Bernstein eingeschlossen hockst du rings im Eisen, Eisen umpanzert dich in schließendem Gewirr.Im Auge rast die Seele, arm und irr. Heimweh heult wahnsinnswild, Heimweh weint süße Weisen Nach Erde, Mensch und Licht. So schrei doch, Mensch im Eisen!",122,Jahrhundertwende,Expressionismus
35809,"Bierbaum, Otto Julius_UNTITLED_1887","Bierbaum, Otto Julius",UNTITLED,1887,"Mein Acker wogt, mein Weizen blüht ... Die Sonne scheint mir ins Gemüt ... In Ballen flieht der Sorgen Qualm ... Gedichte sprießen Halm an Halm ... Es wellt der Hoffnung Wiesengrün ... Der Liebe Sphinxenaugen glühn ... Ein schmerzlich Glück, duftwolkenschwer, Drängt dunkelsammtenblau sich her Und droht mir schwülend ins Gemüt ... Mein Acker wogt, mein Weizen blüht ...",64,Naturalismus,Jahrhundertwende
18328,"Wille, Bruno_UNTITLED_1894","Wille, Bruno",UNTITLED,1894,"Wie liegt die Welt in Regenfloren So leichenhaft verloren ! Der Himmel grau und greise , Die Erde runzlig greise ; Und beide weinen leise . Vergilbter Rasen , Moderlaub , Der Bäume schwärzliches Geäst – So trüb verschwommen , Gleich gramgetränkten Grübelein . Mein Haupt ist öde wie im Herbst ein Nest , Und auf dem Herzen preßt Mir kalt und schwer ein Herz , Und all mein Werk Zwei schwere Hände auf dem starren Herzen Fern stirbt der Straßenlärm , stumm schaun die düstern Wände Auf meinen greisen Schatz , Der leise schluchzt – in seine welken Hände . Dann – kommt der Leichenmann , Packt alles in den Sarg : Haare , Lippen , Herz und Hände , Und preßt den Deckel fest mit knirschenden Schrauben . Nun mag ich träumen Im Finstern , Stillen , Kühlen ... Und ich träume : Ich bin ein zarter Keim Und grabe heimlich feine Wurzeln , Stemme mich rüstig wider die Krume Und recke neugiervoll mein Köpfchen ... Da blendet und umspült mich Entzückend goldnes Licht , So lau , so weich ! Horch , wie jauchzend zwitschern Die behenden Vöglein ! Mit ihren süßen Kehlen Hüpft mein Kinderherz . Und sieh , auf Zweigen sitzen Viel kleine runde Knospen . Ich nicke ihnen lächelnd zu ; Sie nicken wieder Und wollen mit mir spielen . Und wie wir spielen in warmer Sonne , Da wachsen den lieben Kleinen Lauter Flügelchen weiß und rosa , Und zwischen Zweigen und Blättchen schweben sie , Duftige Engelchenschwärme .",256,Jahrhundertwende,Naturalismus
12740,"Lichtenstein, Alfred_Frühling_1912","Lichtenstein, Alfred",Frühling,1912,Ich ha viel zu viel gegessen. Obs bekömmlich ist sehr fraglich. Nach so fettem Mittagessen Fühl' ich mich recht unbehaglich.Doch ich rülpse hübsch und rauche Zigaretten hin und wieder. Liegend auf dem schweren Bauche Pieps ich lauter Frühlingslieder.Sehnsuchtsvoll wie auf der Rampe Quietscht die Stimme aus der Kehle. Und wie eine alte Lampe Blakt der Wind die saure Seele.,67,Expressionismus,Expressionismus
43999,"Stramm, August_Dämmerung_1894","Stramm, August",Dämmerung,1894,Hell weckt Dunkel Dunkel wehrt Schein Der Raum zersprengt die Räume Fetzen ertrinken in Einsamkeit! Die Seele tanzt Und Schwingt und schwingt Und Bebt im Raum Du! Meine Glieder suchen sich Meine Glieder kosen sich Meine Glieder Schwingen sinken sinken ertrinken In Unermeßlichkeit Du!Hell wehrt Dunkel Dunkel frißt Schein! Der Raum ertrinkt in Einsamkeit Die Seele Strudelt Sträubet Halt! Meine Glieder Wirbeln In Unermeßlichkeit Du!Hell ist Schein! Einsamkeit schlürft! Unermeßlichkeit strömt Zerreißt Mich In Du! Du!,88,Jahrhundertwende,Expressionismus
46894,"Löns, Hermann_Fort mit Schaden_1890","Löns, Hermann",Fort mit Schaden,1890,"Was von den Vätern wir geerbt, Ach, Plunder ist's zumeist, Wie im Kolleg mit kühnem Mut Herr Borchers uns beweist.»Holzgraben, das ist abgeschmackt,« So sprach der Stadtpapa; »Ich sehe keinen Graben dort, Und Holz ist auch nicht da!«Und wenn Senator Plathner auch Dem Redner widerspricht, Was kümmert die Historie uns? So was geniert uns nicht!Damit der Redner auch was hat Für seine Rednermüh', So nennt die Straße doch nach ihm, Nennt Borchersstraße sie!",96,Naturalismus,Naturalismus
24210,"Henckell, Karl_Orchis poetica_1896","Henckell, Karl",Orchis poetica,1896,"So ist's, so war's, so bleibt's zu allen Zeiten: Ein echter Dichter mag den Schlamm durchschreiten, Es wird, wohin sein Fuß getreten eben, Sich eine Orchis aus dem Sumpf erheben.",40,Jahrhundertwende,Naturalismus
18353,"Wille, Bruno_UNTITLED_1894","Wille, Bruno",UNTITLED,1894,"Auf sandiger Haide am Kiefernforst Kauert ein Häuschen gedrückt An Fenster, Dach und Lehmgewand Verwahrlost und zerstückt.Des bretternen Stalles Thüre klafft, – Verkauft sind Schaafe und Ziegen; Im Dünger ein letztes Hühnchen scharrt, Und mürrisch brummen die Fliegen;Und in der Stube, da quarrt das Kind, Das Weib, das zornige, schilt, Des Häuslers Stimme, trunken und rauh, Lästert dazwischen wild ...Am Fenster die schlanke Sonnenblume Erbebt in geheimem Leid; Aus Schutt und Unkraut strebt sie scheu Und starrt in die Ferne weit.Dort hinter vergilbtem Kartoffelkraut Und blondem Stoppelhaar Erglänzt der Himmel so goldig zart, Wie Gesang so wunderklar.Im Dufte dort mit schmetternder Glut Verblüht die Abendsonne; – O schmachtende Seele, starre hinein Und trinke dir einzige Wonne! –Und die Blume – am taumelnden Sonnenball Hängt schwärmerisch starr ihr Angesicht, Ihr gelbumlodertes frommes Gesicht, Versunken im Licht, ertrunken im Licht.Die breiten graugrünen Blätter spreitet Sie sehnlich in zitternder Scheidetrauer, Und hinter der sinkenden Sonne gleitet Ihr Sinnen hinunter mit Andachtsschauer.",182,Jahrhundertwende,Naturalismus
41411,"Trakl, Georg_UNTITLED_1900","Trakl, Georg",UNTITLED,1900,"Ihr großen Städte Steinern aufgebaut In der Ebene! So sprachlos folgt Der Heimatlose Mit dunkler Stirne dem Wind, Kahlen Bäumen am Hügel. Ihr weithin dämmernden Ströme! Gewaltig ängstet Schaurige Abendröte Im Sturmgewölk. Ihr sterbenden Völker! Bleiche Woge Zerschellend am Strande der Nacht, Fallende Sterne.",52,Jahrhundertwende,Expressionismus
23841,"Henckell, Karl_UNTITLED_1896","Henckell, Karl",UNTITLED,1896,"Es wetterleuchtet durch die Nacht, Die Donner, sie rollen von ferne, Die Wolken stürmen zur wilden Schlacht, Und ängstlich verlöschen die Sterne. Es jagt und wettert und kracht und braust, Wie wenn in Lüften der Böse haust – Was schmiegst du dich an mich mit Zittern? He, holla! Mich freut das Gewittern.Kennst du das Leben, mein liebes Kind? Ach nein, du tändelst in Träumen. Oft stürmt durch das Leben der Wirbelwind Und reißt an den knorrigsten Bäumen. Unter Donner und Blitzen, in stürmischer Nacht Schlägt der Mensch mit dem Schicksal die lustige Schlacht. Was schmiegst du dich an mich mit Zittern? He, holla! Mich freut das Gewittern.Wie brannte die Sonne so heiß und so dumpf! Die Bäume, sie rangen nach Odem; Nun flutet es feucht, und der dürrste Stumpf Saugt ein den köstlichen Brodem. Wenn träge die Sonne das Leben verbrennt, Willkommen dann, schlagendes Element! Laß ab von Zagen und Zittern, He, holla! Mich freut das Gewittern.",188,Jahrhundertwende,Naturalismus
41389,"Trakl, Georg_Anif_1900","Trakl, Georg",Anif,1900,"Erinnerung: Möven, gleitend über den dunklen Himmel Männlicher Schwermut. Stille wohnst du im Schatten der herbstlichen Esche, Versunken in des Hügels gerechtes Maß;Immer gehst du den grünen Fluß hinab, Wenn es Abend geworden, Tönende Liebe; friedlich begegnet das dunkle Wild,Ein rosiger Mensch. Trunken von bläulicher Witterung Rührt die Stirne das sterbende Laub Und denkt das ernste Antlitz der Mutter; O, wie alles ins Dunkel hinsinkt;Die gestrengen Zimmer und das alte Gerät Der Väter. Dieses erschüttert die Brust des Fremdlings. O, ihr Zeichen und Sterne.Groß ist die Schuld des Geborenen. Weh, ihr goldenen Schauer Des Todes, Da die Seele kühlere Blüten träumt.Immer schreit im kahlen Gezweig der nächtliche Vogel Über des Mondenen Schritt, Tönt ein eisiger Wind an den Mauern des Dorfs.",145,Jahrhundertwende,Expressionismus
28901,"Scheerbart, Paul_UNTITLED_1889","Scheerbart, Paul",UNTITLED,1889,"Meine ganze Welt ist kantig, Und die Bäume sind verrückt. Sage, Wilhelm, sage, Sauhirt, Warum gehst du so gebückt?",26,Naturalismus,Naturalismus
19957,"Müller-Jahnke, Clara_Die Ernte_1882","Müller-Jahnke, Clara",Die Ernte,1882,"Weiße flimmernde Sonnenflut rings auf den wogenden Weiten ruht ; rüstige Mäher bei scharfem Schnitt – – schwirrende Sensen singen mit : Die Halme fallen.Und hart am staubigen Straßenrain schafft tief gebückt ein Mütterlein ; schon manche brennende Stunde lang sirrt und surrt der Sichelklang – – Die Halme fallen.Da schaut aus schimmerndem Aehrenfeld der Gutsherr auf zum Wolkenzelt : – » Vorwärts , ihr Knechte ! die Stunde rinnt ! Mein Mahl bereitet das Ingesind ; mein Weib umrauscht ein seidener Flor – – und der Jude wartet am Gartentor. « Die Halme fallen ! Und müde legt nach des Tages Brand das Weib die Sichel aus der Hand : » Du goldner Segen auf schmalem Feld , du gibst mir Brot und du schaffst mir Geld ! « – Die Halme fallen.– » Vorwärts , ihr Hunde , verdient den Lohn ! « Er denkt an seinen fernen Sohn . Der schnellste Reiter auf blachem Feld und der Gott der Weiber – das kostet Geld ! – Die Halme fallen. » Und all das Gold « – die Alte sinnt – » in die Ferne schickt ich 's dem einzigen Kind . Sie trieben ihn fort von Haus und Huf , nun harrt er drüben der Heimat Ruf : Die Halme fallen.Und kehrt er heim , wenn der Himmel loht , wenn der Weizen reif und das Mohnfeld rot , dann faßt er die Sense zu heißem Schnitt – und ich laufe und sammle und jauchze mit : » Die Halme fallen ! «",258,Naturalismus,Naturalismus
68657,"George, Stefan_UNTITLED_1897","George, Stefan",UNTITLED,1897,Lieder wie ich gern sie sänge  Darf ich freunde noch nicht singen  Nur dies flüchtige gedränge  Scheuer reime will gelingen Hinter reben oder hinter  Stillen mauern zu kredenzen  Zur erheitrung weisser winter  Und zum trost in fahlen lenzen Was ich nach den harten fehden  In den schooss des friedens bette  Und aus reicher jugend eden  In das leben über-rette. ,91,Jahrhundertwende,Jahrhundertwende
36069,"Bierbaum, Otto Julius_Theater-Reformer_1887","Bierbaum, Otto Julius",Theater-Reformer,1887,"Welch ein Lärmen! Welch ein Schrein! –: Gebt uns Schläuche! Neue Schläuche! Seh ich hin, sinds arme Gäuche, Und sie haben keinen Wein.Pfui! rufen sie, Guckkasten! Welch ein Stall da! – Doch über diesem Stalle leuchtete der Stern Zu mancher göttlichen Geburt. – O, werte Herrn, Bedenkt den Spruch: Hic Rhodus est, hic salta!Das ist gewiß: Es wird ein schönes Haus, Sieht neu, geschmackvoll, festlich, heiter aus, Und, was der wohlerfahrene Architekt Erstrebt, es wird erreicht, nicht bloß bezweckt: Man kann von allen Sitzen alles hörn und sehn.In dies Theater werd ich gerne gehn, Sofern das Hörn und Sehn sich auch verlohnt Und man uns gnädiglich mit dem verschont, Was jetzt schon, fürcht ich, hier um Einlaß jammert, Inbrünstig sich an andre Künste klammert, Weil es allein nicht stehn und gehen kann.Denn Krüppel seh ich mir nicht gerne an, Sind sie auch prächtig, ja in Gold geschient. Mit Orthopädik ist uns nicht gedient.Ein schief gewachsenes Mädchen wird nicht grade, Gehts im Reform-Kostüm zur Promenade.",203,Naturalismus,Jahrhundertwende
39898,"Ringelnatz, Joachim_Die Waisenkinder_1908","Ringelnatz, Joachim",Die Waisenkinder,1908,"Zwanzig grobe Strohhüte gehen Zwei und zwei wie Militär. Zwanzig schwarze Pelerinchen wehen, Als wenn's zum Begräbnis wär.Magre Lehrerin voraus, Hinten magre zweite, Eine dritte an der Seite, Also zieht aus engem Haus Eine Schlange in die Weite.Hilfe! Mideid! Und Beschwerde! Zwanzig arme Waisenkinder, Streng getrieben, eine Herde Junger Rinder –.Weil mich meine Mutter knufft, Und um Stärkres zu vermeiden, Sag ich: »Ja, man läßt sie weiden In der frischen, freien Luft.«»Weiden? – Dummheit! Siehst du nicht, Was hier vorgeht, roher Bengel! Junge Blumen brauchen Licht, Wärme, Erde, Wurzel, Stengel –.«»Manche brauchen Mist, Mama, Weil sie anderes vermissen, Und der ist – wer kann es wissen – Hier vielleicht sehr reichlich da.«»Treibt mit diesen Engeln Spott! Und mich will er nicht verstehen. Warte, dir wird's schlimm ergehen! Und das wünsch ich dir. Bei Gott.«Meine Mutter dreht Rücken zu und geht.Und nun sauf ich wo, wo keine Rinder, Blumen, Engel sind, Bin für mich oder für meine Mutter Naseweisenkind.",209,Jahrhundertwende,Jahrhundertwende
29691,"Dauthendey, Max_Du sagst, du siehst nicht mehr zur Luft_1892","Dauthendey, Max","Du sagst, du siehst nicht mehr zur Luft",1892,"Du sagst, du siehst nicht mehr zur Luft, Weil jetzt die Wiesenblumen blühen! Ich weiß, daß jede dich nur ruft, Der rote Mohn will dir nur glühen. Und all die tausend Wiesenkleinen Sich blühend nur um dich vereinen. Doch manchmal fällt noch zu den Steinen Ganz nebenbei ein Blick von dir, Und dann blühn alle Steine mir.",66,Jahrhundertwende,Jahrhundertwende
44913,"Heym, Georg_UNTITLED_1899","Heym, Georg",UNTITLED,1899,"Palmyras Tempelstaub bläst auf der Wind , Der durch die Hallen säuselt in der Zeit Des leeren Mittags , wo die Sonne weit Im Blauen rast . Der goldene Atem spinnt , Der goldene Staub des Mittags sich wie Rauch Im Glanz der Wüste , wie ein seidenes Zelt Der ungeheuren Fläche . Dach der Welt . Wie ferne Flöten tönt des Zephirs Hauch die Schultern hüllt Des Flüchtigen . Sein blauer Helmbusch rolltDarob im Sturme weit am Horizont , Am Meer , und seiner Inseln Perlenseil . Er eilt dahin , wo schon der Ida steil Mit Eichen tost und dröhnt der Hellespont.Das Stromland fort , dem grünen Abend zu . Wie der Drommete Ton erschallt sein Gang An Ossas Echo . Troas Schilf entlang , In rote Wälder tritt sein Purpurschuh , In Sammetwiesen weich . Dem Feuer nach , Das einst gen Argos flog , tritt machtvoll er Auf Chalkis hin . Darunter rauscht das Meer Hervor aus grüner Grotten Steingemach.Sein Arm , den er auf Meer und Lande streckt , Ragt dunkel auf wie eine Feuersbrunst . Sein Atem füllt das Meer mit schwarzem Dunst , Des weißes Maul die roten Sohlen leckt.Auf Marathon schleppt seines Mantels Saum , Ein violetter Streif , wo schon das Horn Der Muschel stimmt am Strand der Toten vorn Der Sturmgott laut aus weißer Brandung Schaum.Des Rohres rote Fahnen rührt der Wind Von seines Fußes Fittich um am Strand Der fernen Elis , da der Nacht Trabant , Schildknappe Mond , den dunklen Pfad beginnt .",256,Jahrhundertwende,Expressionismus
35680,"Bierbaum, Otto Julius_UNTITLED_1887","Bierbaum, Otto Julius",UNTITLED,1887,"Ich und du und du und du, Zwei mal zwei ist viere, Tragen Kränze auf dem Kopf, Kränze aus Papiere; Rechts herum und links herum, Röck' und Zöpfe fliegen, Wenn wir alle schwindlich sind, Falln wir um und liegen, Purzelpatsch, wir liegen da, Patschelpurz, im Grase: Wer die längste Nase hat, Der fällt auf die Nase.",71,Naturalismus,Jahrhundertwende
26155,Klabund_14_1909,Klabund,14,1909,"Weil du von mir ein Kind erhältst, So willst du dich erhenken Und mir mit einem Gott vergelts Dein junges Leben schenken?Weißt du wohl, was ich damit tu, Ob ichs zu Staub zerreibe? Ich spiele es den Sternen zu, Ich spiele es den Fernen zu, Damit es leuchten bleibe!Da nun die Lust in dir verwest: Laß mir den Sohn am Leben! Wenn Wolke du in Winden wehst Und bei den ewigen Träumen stehst, WirdWeil du das Kind in mir erlöst, So willst du dich erhenken? Du sollst noch einmal, eh du gehst, Mir deine Jungfraunschaft schenken.",114,Jahrhundertwende,Expressionismus
70433,"Holz, Arno_UNTITLED_1886","Holz, Arno",UNTITLED,1886,Allwöchentlich ein Buch von zwanzig Bogen! Wir aber thun stets unsre alte Frage: Habt ihr euch immer noch nicht ausgelogen?Allwöchentlich ein Buch von zwanzig Bogen! Wir aber thun stets unsre alte Frage: Habt ihr euch immer noch nicht ausgelogen?,46,Naturalismus,Naturalismus
19893,"Müller-Jahnke, Clara_Sonnenwende_1882","Müller-Jahnke, Clara",Sonnenwende,1882,"Es fiel ein Blütenregen herab auf Wald und Feld, ein Netz von Sonnenstrahlen umspinnt die grüne Welt; das flammt und blüht und duftet und höhnt den Glockenschlag, als ging er nie zu Ende, der süße, goldene Tag . . .O Tag der Sonnenwende, vollblühende Rosenzeit, du hast mir ins Herz geduftet berauschende Seligkeit! Das pocht und glüht und zittert und bebt im Vollgenuß, als ging er nie zu Ende, der süße, erste Kuß –O Tag der Sonnenwende – – – – – – – – – – – – – –",102,Naturalismus,Naturalismus
21109,"Stadler, Ernst_UNTITLED_1898","Stadler, Ernst",UNTITLED,1898,"Nun bist du, Seele, wieder deinem Traum Und deiner Sehnsucht selig hingegeben. In holdem Feuer glühend fühlst du kaum, Daß Schatten alle Bilder sind, die um dich leben.Denn nächtelang war deine Kammer leer. Nun grüßen dich, wie über Nacht die Zeichen Des jungen Frühlings durch die Fenster her, Die neuen Schauer, die durch deine Seele streichen.Und weißt doch: niemals wird Erfüllung sein Den Schwachen, die ihr Blut dem Traum verpfänden, Und höhnend schlägt das Schicksal Krug und Wein Den ewig Dürstenden aus hochgehobnen Händen.",97,Jahrhundertwende,Expressionismus
69041,"Holz, Arno_UNTITLED_1898","Holz, Arno",UNTITLED,1898,"Ueber die Welt hin ziehen die Wolken. Grün durch die Wälder fliesst ihr Licht.Herz, vergiss!In stiller Sonne webt linderndster Zauber, unter wehenden Blumen blüht tausend Trost.Vergiss! Vergiss!Aus fernem Grund pfeift, horch, ein Vogel. . . . Er singt sein Lied.Das Lied vom Glück!Vom Glück.",58,Jahrhundertwende,Naturalismus
46931,"Löns, Hermann_Der Tiergarten_1890","Löns, Hermann",Der Tiergarten,1890,"Noch sitzt der Kater auf dem Dache, Und schon hat man sein Fell verkauft; Noch hört der Tiergarten dem Fiskus, Und schon man um den Zweck sich rauft.Der möchte ihn zur Rennbahn machen, Doch meine ich, für diesen Zweck Stehn dort die Bäume sehr im Wege Und deshalb müßten diese weg.Zur Hasenheide will ein andrer Ihn machen; ach, wie wunderschön, Wenn Würstchenhändler dann dort grölen Und zwanzig Karussells sich drehn.Die Bäume fall'n, die Buden wachsen, Und eine Tafel dort ich seh: Der Tiergarten, der ist im Hofe, Den Schlüssel kriegt man beim Portier.",109,Naturalismus,Naturalismus
19851,"Müller-Jahnke, Clara_Suleika_1882","Müller-Jahnke, Clara",Suleika,1882,"Nicht im Rosenschmuck der Jugend fand ich dich und liebt ich dich, grau schon ringelten die Locken um der Stirne Weisheit sich, doch in deinem Kusse lodert ungezähmte Jugendkraft, stimmt die Harfe meiner Seele zur Musik der Leidenschaft. –Deine grauen Haare bergen, was in deiner Seele ruht, wie die Asche des Vulkanes Zeuge ist der innern Glut, und aus deiner Augen Tiefen, sprühet blitzend, göttlich rein, ewig junges Leben kündend, deines Geistes Feuerschein.",85,Naturalismus,Naturalismus
